,Title,Author(s),Journal,Cited (articles),Cited (cases),Accessed,Topics
0,Remedying Racial Profiling [article],"Garrett, Brandon (Cited 132 times)","Columbia Human Rights Law Review, Vol. 33, Issue 1 (Fall 2001 ), pp. 41-148",70,2,97," Law Enforcement, Law Enforcement and Corrections, Racial Profiling, Remedies, Statistics"
0,Standing While Black: Distinguishing Lyons in Racial Profiling Cases [notes],"Garrett, Brandon (Cited 132 times)","Columbia Law Review, Vol. 100, Issue 7 (November 2000), pp. 1815-1846",27,2,19," Law Enforcement and Corrections, Practice and Procedure, Racial Profiling, Standing, Courts"
0,A Tactical Fourth Amendment [article],"Garrett, Brandon (Cited 132 times); Stoughton, Seth (Cited 141 times)","Virginia Law Review, Vol. 103, Issue 2 (April 2017), pp. 211-308",20,na,63," Law Enforcement, Criminal Law and Procedure, Law and Society, Race and Ethnicity"
0,"How Jurors Evaluate Fingerprint Evidence: The Relative Importance of Match Language, Method Information, and Error Acknowledgment [article]","Garrett, Brandon (Cited 132 times); Mitchell, Gregory (Cited 966 times)","Journal of Empirical Legal Studies, Vol. 10, Issue 3 (2013), pp. 484-511",7,na,20," Criminal Law and Procedure, Evidence, Science and Technology"
0,The Decline of the Virginia (and American) Death Penalty [article],"Garrett, Brandon (Cited 132 times)","Georgetown Law Journal, Vol. 105, Issue 3 (March 2017), pp. 661-730",6,na,47," Death, Plea Bargaining"
0,Capital Jurors in an Era of Death Penalty Decline [article],"Garrett, Brandon (Cited 132 times); Krauss, Daniel (Cited 22 times); Scurich, Nicholas (Cited 30 times)","Yale Law Journal Forum, Vol. 126, pp. 417-430",2,na,20," Death, Race and Ethnicity"
0,The Global Evolution of Corporate Prosecutions [article],"Garrett, Brandon (Cited 132 times)","Law and Financial Markets Review, Vol. 11, Issue 2-3 (June-September 2017), pp. 55-60",na,na,na," Comparative Law, Corporations, Business Organizations, Criminal Law and Procedure, Evidence"
