,Title,Author(s),Journal,Cited (articles),Cited (cases),Accessed,Topics
0,Judging the Law of Politics [comments],"Charles, Guy-Uriel (Cited 49 times)","Michigan Law Review, Vol. 103, Issue 6 (May 2005), pp. 1099-1141",37,na,11," Judges, Politics, Judicial Review, Democracy"
0,"The Electoral College, the Right to Vote, and Our Federalism: A Comment on a Lasting Institution [article]","Fuentes-Rohwer, Luis (Cited 267 times); Charles, Guy-Uriel (Cited 49 times)","Florida State University Law Review, Vol. 29, Issue 2 (Winter 2002), pp. 879-924",8,na,38," Electoral College, Federalism, Right to Vote, Constitutional Law, Politics"
0,"Dissent, Diversity, and Democracy: Heather Gerken and the Contingent Imperative of Minority Rule [article]","Charles, Guy-Uriel (Cited 49 times)","Tulsa Law Review, Vol. 48, Issue 3 (Spring 2013), pp. 493-502",2,na,8," Democracy, Federalism, Research"
0,Sonia Sotomayor and the Construction of Merit [article],"Charles, Guy-Uriel (Cited 49 times); Chen, Daniel L. (Cited 56 times); Gulati, Mitu (Cited 1596 times)","Emory Law Journal, Vol. 61, Issue 4 (2012), pp. 801-862",2,na,5," Immigration Law, Judges, Jurisprudence, Politics, Race"
0,"Habermas, the Public Sphere, and the Creation of a Racial Counterpublic [article]","Charles, Guy-Uriel (Cited 49 times); Fuentes-Rohwer, Luis (Cited 267 times)","Michigan Journal of Race & Law, Vol. 21, Issue 1 (Fall 2015), pp. 1-22",na,na,38," Law and Society, Legal Analysis and Writing, Copyright, Legal History, Television"
0,"Public Programs, Private Financing [article]","Lemos, Margaret H. (Cited 538 times); Charles, Guy-Uriel (Cited 49 times)","Law and Contemporary Problems, Vol. 81, Issue 3 (2018), pp. 137-160",na,na,18," Banking and Finance, Criminal Law and Procedure, Government Contracts, Torts"
0,Patriotic Philanthropy: Financing the State with Gifts to Government [article],"Lemos, Margaret H. (Cited 538 times); Charles, Guy-Uriel (Cited 49 times)","California Law Review, Vol. 106, Issue 4 (August 2018), pp. 1129-1194",na,na,53," Gifts, Government, Philanthropy, Politics, Banking and Finance, Police, Race"
