,Title,Author(s),Journal,Cited (articles),Cited (cases),Accessed,Topics
0,"Polygamy, Prostitution, and the Federalization of Immigration Law [article]","Abrams, Kerry (Cited 495 times)","Columbia Law Review, Vol. 105, Issue 3 (April 2005), pp. 641-716",108,na,49," Immigration Law, Legal History, Polygamy, Women"
0,Immigration Law and the Regulation of Marriage [article],"Abrams, Kerry (Cited 495 times)","Minnesota Law Review, Vol. 91, Issue 6 (June 2007), pp. 1625-1709",107,6,71," Domestic Relations, Immigration Law, Marriage, Regulation, Blood, History, Homelessness"
0,Plenary Power Preemption [article],"Abrams, Kerry (Cited 495 times)","Virginia Law Review, Vol. 99, Issue 3 (May 2013), pp. 601-640",52,2,19," Aliens, Colleges and Universities, Immigration Law, Students, Tuition, Constitutional Law"
0,Marriage Fraud [article],"Abrams, Kerry (Cited 495 times)","California Law Review, Vol. 100, Issue 1 (February 2012), pp. 1-68",47,na,59," Domestic Relations, Fraud, Legal History, Marriage, Constitutional Law, Immigration Law, Congress"
0,Marriage as a Message: Same-Sex Couples and the Rhetoric of Accidental Procreation [article],"Abrams, Kerry (Cited 495 times); Brooks, Peter (Cited 143 times)","Yale Journal of Law & the Humanities, Vol. 21, Issue 1 (Winter 2009), pp. 1-36",36,na,11," Domestic Relations, Marriage, Sex, Race, Sexuality and the Law"
0,The Hidden Dimension of Nineteenth-Century Immigration Law [article],"Abrams, Kerry (Cited 495 times)","Vanderbilt Law Review, Vol. 62, Issue 5 (October 2009), pp. 1353-1418",26,na,68," Immigration Law, Polygamy, Legal History"
0,Immigration's Family Values [article],"Abrams, Kerry (Cited 495 times); Piacenti, R. Kent (Cited 30 times)","Virginia Law Review, Vol. 100, Issue 4 (June 2014), pp. 629-710",22,na,35," Domestic Relations, Immigration Law, Citizenship"
0,Citizen Spouse [article],"Abrams, Kerry (Cited 495 times)","California Law Review, Vol. 101, Issue 2 (April 2013), pp. 407-444",18,na,8," Citizenship, Marriage, Economic Development"
0,Immigration Status and the Best Interests of the Child Standard [article],"Abrams, Kerry (Cited 495 times)","Virginia Journal of Social Policy & the Law, Vol. 14, Issue 1 (Fall 2006), pp. 87-102",18,na,28," Best Interests of the Child, Child Custody, Domestic Relations, Family Law, Immigration Law, Children, Domestic Violence"
0,What Makes the Family Special [article],"Abrams, Kerry (Cited 495 times)","University of Chicago Law Review, Vol. 80, Issue 1 (Winter 2013), pp. 7-28",18,4,22," Citizenship, Domestic Relations, Emigration and Immigration, Fraudulent Conveyances, Immigration Law, States"
0,"Peaceful Penetration: Proxy Marriage, Same-Sex Marriage, and Recognition [article]","Abrams, Kerry (Cited 495 times)","Michigan State Law Review, Vol. 2011, Issue 1 (2011), pp. 141-172",14,na,7," Legal History, Marriage, Same-Sex Marriage, Sex, Legal Education, Religion"
0,Cumulative Constitutional Rights [article],"Abrams, Kerry (Cited 495 times); Garrett, Brandon L. (Cited 1133 times)","Boston University Law Review, Vol. 97, Issue 4 (July 2017), pp. 1309-1356",9,na,32," Constitutional Law, Constitutional Rights, Jurisprudence, Employment, Human Rights Law, Immigration Law, Juveniles"
0,DNA and Distrust [article],"Abrams, Kerry (Cited 495 times); Garrett, Brandon L. (Cited 1133 times)","Notre Dame Law Review, Vol. 91, Issue 2 (December 2015), pp. 757-814",7,4,95," Medical Jurisprudence, Science and Technology, Criminal Law and Procedure, Evidence"
0,The End of Annulment [article],"Abrams, Kerry (Cited 495 times)","Journal of Gender, Race & Justice, Vol. 16, Issue 3 (Summer 2013), pp. 681-704",6,na,7," Annulment, Domestic Relations, Race and Ethnicity, Marital Status"
0,Family History: Inside and Out [reviews],"Abrams, Kerry (Cited 495 times)","Michigan Law Review, Vol. 111, Issue 6 (April 2013), pp. 1001-1020",4,na,11," History, Age, Domestic Relations, Family Law, Joint Venture, Sex, States, Water, Women"
0,Family Reunification and the Security State [article],"Abrams, Kerry (Cited 495 times)","Constitutional Commentary, Vol. 32, Issue 2 (Summer 2017), pp. 247-280",2,na,39," Civil Rights, Domestic Relations, Fourteenth Amendment, Immigration Law, European Union"
0,"The Rights of Marriage: Obergefell, Din, and the Future of Constitutional Family Law [article]","Abrams, Kerry (Cited 495 times)","Cornell Law Review, Vol. 103, Issue 3 (March 2018), pp. 501-564",1,na,83," Constitutional Law, Domestic Relations, Family Law, Marriage, Law and Society, Sexual Orientation"
0,Domicile Dismantled [article],"Abrams, Kerry (Cited 495 times); Barber, Kathryn","Indiana Law Journal, Vol. 92, Issue 2 (Spring 2017), pp. 387-434",na,na,22," Domicile, Education, Gender, Jurisdiction, Right to Vote, Children"
0,Reconsidering Work and Family with the Marriage Equation [reviews],"Abrams, Kerry (Cited 495 times)","Jotwell: The Journal of Things We Like (Lots), Vol. 2013, pp. [5]-[6]",na,na,na," Marriage, Domestic Relations, Gender"
0,"The Future of Immigration Enforcement, a Tribute to David A. Martin [comments]","Abrams, Kerry (Cited 495 times)","Journal of Law & Politics, Vol. 30, Issue 4 (Spring 2015), pp. 401-410",na,na,5," Immigration Law, Criminal Law and Procedure, Law Enforcement and Corrections, Courts, Sentencing and Punishment"
0,"Structured Dialogue on Building a Sustainable, Stable Immigration Enforcement System [article]","Abrams, Kerry (Cited 495 times)","Journal of Law & Politics, Vol. 30, Issue 4 (Spring 2015), pp. 555-580",na,na,3," Appeals, Causation, Insurance, Liability, Liability Insurance"
0,Labor Protection Parity for Au Pairs [reviews],"Abrams, Kerry (Cited 495 times)","Jotwell: The Journal of Things We Like (Lots), Vol. 2014, pp. [131]-[132]",na,na,na," Women, Comparative Law, Criminal Law and Procedure, Human Rights Law, Juveniles"
0,Restructuring Family Law [reviews],"Abrams, Kerry (Cited 495 times)","Jotwell: The Journal of Things We Like (Lots), Vol. 2015, pp. [424]-[425]",na,na,na," Family Law, Domestic Relations, Civil Rights, Land Use, Law and Society"
0,Making Admin Visible [reviews],"Abrams, Kerry (Cited 495 times)","Jotwell: The Journal of Things We Like (Lots), Vol. 2016, pp. [21]-[22]",na,na,na," Gender, Law and Society, Banking, Regulation, Databases, Revolution"
0,Flirting with Federal Family Law [reviews],"Abrams, Kerry (Cited 495 times)","Jotwell: The Journal of Things We Like (Lots), Vol. 2017, pp. [132]-[134]",na,na,na," Family Law, Civil Rights, Constitutional Law, Domestic Relations, Federalism"
0,"Polygamy, Prostitution, and the Federalization of Immigration Law [article]","Abrams, Kerry (Cited 495 times)","Immigration and Nationality Law Review, Vol. 26, pp. 15-90",na,na,4," Immigration Law, Legal History, Polygamy, Women"
