,Title,Author(s),Journal,Cited (articles),Cited (cases),Accessed,Topics
0,A Policy Analysis of Fee-Shifting Rules under the Internal Revenue Code [article],"Schmalbeck, Richard L. (Cited 24 times); Myers, Gary (Cited 149 times)","Duke Law Journal, Vol. 1986, Issue 6 (December 1986), pp. 970-1002",14,na,2," Fees, Government, Practice and Procedure, Taxation, Costs"
0,Foreword [comments],"Schmalbeck, Richard L. (Cited 24 times)","Law and Contemporary Problems, Vol. 48, Issue 4 (Autumn 1985), pp. 1-6",6,na,3," Historic Preservation, Legislation, Tax Policy"
0,The Impact of Tax-Exempt Status: The Supply-Side Subsidies [article],"Schmalbeck, Richard L. (Cited 24 times)","Law and Contemporary Problems, Vol. 69, Issue 4 (Autumn 2006), pp. 121-138",3,na,na," Subsidies, Health, Health Care Providers, Hospitals"
0,Unifying Depreciation Recapture [article],"Schmalbeck, Richard L. (Cited 24 times); Soled, Jay A. (Cited 255 times)","Connecticut Law Review, Vol. 48, Issue 2 (December 2015), pp. 531-560",1,na,1," Tax Policy, Taxation-Federal, Property, Real Property, Taxation, Interest"
0,Determining an Asset's Tax Basis in the Absence of a Meaningful Transfer Tax Regime [article],"Soled, Jay A. (Cited 255 times); Schmalbeck, Richard L. (Cited 24 times)","Columbia Journal of Tax Law, Vol. 10, Issue 1 (2018), pp. 49-76",na,na,5," State and Local Government Law, Estate Planning, Taxation-Federal"
