Title,Author(s),id,Journal,BBCite,Cited (articles),Cited (cases),Accessed,Topics
The Eighth Amendment's Lost Jurors: Death Qualification and Evolving Standards of Decency [article],"Cover, Aliza Plener (Cited 10 times)",584,"Indiana Law Journal, Vol. 92, Issue 1 (Early Winter 2016), pp. 113-156",92 Ind. L.J. 113 (2016-2017),6,na,26,na
"Archetypes of Faith: How Americans See, and Believe in, Their Constitution [article]","Cover, Aliza Plener (Cited 10 times)",584,"Stanford Law & Policy Review, Vol. 26, Issue 2 (2015), pp. 555-596",26 Stan. L. & Pol'y Rev. 555 (2015),3,na,6,na
Hybrid Jury Strikes [article],"Cover, Aliza Plener (Cited 10 times)",584,"Harvard Civil Rights-Civil Liberties Law Review, Vol. 52, Issue 2 (Summer 2017), pp. 357-396",52 Harv. C.R.-C.L. L. Rev. 357 (2017),1,na,16,na
On Law-Breaking and Law's Legitimacy [article],"Cover, Aliza Plener (Cited 10 times)",584,"University of Maryland Law Journal of Race, Religion, Gender and Class, Vol. 15, Issue 2 (Fall 2015), pp. 310-318","15 U. Md. L.J. Race, Religion, Gender & Class 310 (2015)",na,na,14,na
The Arbiters of Decency: A Study of Legislators' Eight Amendment Role [article],"Niven, David (Cited 14 times); Cover, Aliza Plener (Cited 10 times)",584,"Washington Law Review, Vol. 93, Issue 3 (October 2018), pp. 1397-1448",93 Wash. L. Rev. 1397 (2018),na,na,4,na
The Pope and the Capital Juror [article],"Cover, Aliza Plener (Cited 10 times)",584,"Yale Law Journal Forum, Vol. 128, pp. 599-609",128 Yale L.J. F. 599 (2018-2019),na,na,na,na
