Title,Author(s),id,Journal,BBCite,Cited (articles),Cited (cases),Accessed,Topics
Regulating Employment Relationships in the Sharing Economy [article],na,9614,"Employee Rights and Employment Policy Journal, Vol. 20, Issue 1 (2016), pp. 1-36",na,9,na,191,na
"Temples, Courts, and Dynamic Equilibrium in the Indian Constitution [article]",na,9614,"American Journal of Comparative Law, Vol. 64, Issue 3 (Fall 2016), pp. 555-582",na,3,na,80,na
Sovereignty and Social Change in the Wake of India's Recent Sodomy Cases [article],na,9614,"Boston College International and Comparative Law Review, Vol. 40, Issue 1 (2017), pp. 1-26",na,3,na,16,na
Secularism in the Indian Context [article],na,9614,"Law & Social Inquiry, Vol. 38, Issue 1 (Winter 2013), pp. 138-167",na,3,na,53,na
Addressing the Retirement Crisis with Shadow 401(K)S [article],na,9614,"Notre Dame Law Review Online, Vol. 92, pp. 38-53",na,2,na,4,na
"Invisible Bosses for Invisible Workers, or Why the Sharing Economy Is Actually Minimally Disruptive [article]",na,9614,"University of Chicago Legal Forum, Vol. 2017, pp. 35-62",na,1,na,46,na
"Gods' Homes, Men's Courts, Women's Rights [article]",na,9614,"International Journal of Constitutional Law, Vol. 16, Issue 2 (April 2018), pp. 552-573",na,na,na,na,na
Data Deficits in Municipal Rideshare Collaborations [article],"Das Acevedo, Deepa (Cited 22 times)",9614,"Saint Louis University Law Journal, Vol. 63, Issue 1 (Fall 2018), pp. 69-92",na,na,na,na,na
Unbundling Freedom in the Sharing Economy [article],na,9614,"Southern California Law Review, Vol. 91, Issue 5 (July 2018), pp. 793-838",na,na,na,60,na
