Title,Author(s),id,Journal,BBCite,Cited (articles),Cited (cases),Accessed,Topics
Pluralism in America: Why Judicial Diversity Improves Legal Decisions about Political Morality [notes],"Milligan, Joy (Cited 48 times)",4887,"New York University Law Review, Vol. 81, Issue 3 (June 2006), pp. 1206-1248",na,17,na,43,na
"The Ph.D. Rises in American Law Schools, 1960-2011: What Does It Mean for Legal Education [article]","McCrary, Justin (Cited 21 times); Milligan, Joy (Cited 48 times); Phillips, James (Cited 24 times)",4887,"Journal of Legal Education, Vol. 65, Issue 3 (Spring 2016), pp. 543-579",65 J. Legal Educ. 543 (2015-2016),16,na,10,na
Religion and Race: On Duality and Entrenchment [article],"Milligan, Joy (Cited 48 times)",4887,"New York University Law Review, Vol. 87, Issue 2 (May 2012), pp. 393-472",87 N.Y.U. L. Rev. 393 (2012),9,na,10,na
Protecting Disfavored Minorities: Toward Institutional Realism [article],"Milligan, Joy (Cited 48 times)",4887,"UCLA Law Review, Vol. 63, Issue 4 (May 2016), pp. 894-967",63 UCLA L. Rev. 894 (May 2016),5,na,22,na
Subsidizing Segregation [article],"Milligan, Joy (Cited 48 times)",4887,"Virginia Law Review, Vol. 104, Issue 5 (September 2018), pp. 847-932",104 Va. L. Rev. 847 (2018),na,na,41,na
