Title,Author(s),id,Journal,BBCite,Cited (articles),Cited (cases),Accessed,Topics
Legitimacy and Federal Criminal Enforcement Power [article],"Ouziel, Lauren M. (Cited 37 times)",8777,"Yale Law Journal, Vol. 123, Issue 7 (May 2014), pp. 2236-2333",123 Yale L. J. 2236 (2013-2014),26,na,na,na
Waiving States' Sovereign Immunity from Suit in Their Own Courts: Purchased Waiver and the Clear Statement Rule [notes],"Ouziel, Lauren (Cited 37 times)",8777,"Columbia Law Review, Vol. 99, Issue 6 (October 1999), pp. 1584-1607",na,5,na,4,na
Beyond Law and Fact: Jury Evaluation of Law Enforcement [article],"Ouziel, Lauren M. (Cited 37 times)",8777,"Notre Dame Law Review, Vol. 92, Issue 2 (December 2016), pp. 691-746",92 Notre Dame L. Rev. 691 (December 2016),4,na,32,na
Ambition and Fruition in Federal Criminal Law: A Case Study [article],"Ouziel, Lauren M. (Cited 37 times)",8777,"Virginia Law Review, Vol. 103, Issue 6 (October 2017), pp. 1077-1140",103 Va. L. Rev. 1077 (2017),1,na,9,na
The Regulatory Challenge of Public Corruption [reviews],"Ouziel, Lauren M. (Cited 37 times)",8777,"Journal of Criminal Law and Criminology, Vol. 108, Issue 3 (Summer 2018), pp. 639-ii",na,na,na,19,na
Steering White-Collar Enforcement [comments],"Ouziel, Lauren M. (Cited 37 times)",8777,"Texas Law Review Online, Vol. 97, pp. 44-53",na,na,na,na,na
