Title,Author(s),id,Journal,BBCite,Cited (articles),Cited (cases),Accessed,Topics
Buckling under Pressure: An Empirical Test of the Expressive Effects of Law [notes],"Wittlin, Maggie (Cited 26 times)",9990,"Yale Journal on Regulation, Vol. 28, Issue 2 (Summer 2011), pp. 419-470",na,16,na,12,na
Hindsight Evidence [comments],"Wittlin, Maggie (Cited 26 times)",9990,"Columbia Law Review, Vol. 116, Issue 5 (June 2016), pp. 1323-1394",na,5,na,24,na
Entering the Innovation Twilight Zone: How Patent and Antitrust Law Must Work Together [article],"Lewis, Jeffrey I. D. (Cited 19 times); Wittlin, Maggie (Cited 26 times)",9990,"Vanderbilt Journal of Entertainment and Technology Law, Vol. 17, Issue 3 (Spring 2015), pp. 517-574",17 Vand. J. Ent. & Tech. L. 517 (2014-2015),4,na,5,na
The Results of Deliberation [article],"Wittlin, Maggie (Cited 26 times)",9990,"University of New Hampshire Law Review, Vol. 15, Issue 1 (November 2016), pp. 161-226",15 U.N.H. L. Rev. 161 (2016-2017),1,na,7,na
Common Problems of Plausibility and Probabilism [article],"Wittlin, Maggie (Cited 26 times)",9990,"International Journal of Evidence & Proof, Vol. 23, Issue 1-2 (April 2019), pp. 184-190",na,na,na,na,na
What Causes Polarization on IP Policy [article],"Wittlin, Maggie (Cited 26 times); Ouellette, Lisa Larrimore (Cited 401 times); Mandel, Gregory N. (Cited 623 times)",9990,"U.C. Davis Law Review, Vol. 52, Issue 2 (December 2018), pp. 1193-1242",52 U.C.D. L. Rev. 1193 (2018-2019),na,na,na,na
