Title,Author(s),id,Journal,BBCite,Cited (articles),Cited (cases),Accessed,Topics
Police Reform and the Dismantling of Legal Estrangement [notes],"Bell, Monica C. (Cited 58 times)",6516,"Yale Law Journal, Vol. 126, Issue 7 (May 2017), pp. 2054-2151",na,38,na,180,na
"The Braiding Cases, Cultural Deference, and the Inadequate Protection of Black Women Consumers [comments]","Bell, Monica C. (Cited 58 times)",6516,"Yale Journal of Law and Feminism, Vol. 19, Issue 1 (2007), pp. 125-154",na,6,na,55,na
Grassroots Death Sentences: The Social Movement for Capital Child Rape Laws [article],"Bell, Monica C. (Cited 58 times)",6516,"Journal of Criminal Law and Criminology, Vol. 98, Issue 1 (Fall 2007), pp. 1-30",na,4,na,29,na
The Obligation Thesis: Understanding the Persistent Black Voice in Modern Legal Scholarship [article],"Bell, Monica (Cited 58 times)",6516,"University of Pittsburgh Law Review, Vol. 68, Issue 3 (Spring 2007), pp. 643-700",68 U. Pitt. L. Rev. 643 (2006-2007),3,na,17,na
Situational Trust: How Disadvantaged Mother Reconceive Legal Cynicism [article],"Bell, Monica C. (Cited 58 times)",6516,"Law & Society Review, Vol. 50, Issue 2 (2016), pp. 314-347",50 Law & Soc'y Rev. 314 (2016),3,na,9,na
Advocacy in Ideas: Legal Education and Social Movements [article],"Bell, Monica (Cited 58 times); Hernandez, Tanya K. (Cited 486 times); Maldonado, Solangel (Cited 424 times); Perkins, Rachelle (Cited 31 times); Thomas, Chantal (Cited 402 times); Johnson, Olatunde (Cited 36 times); Lopez, Elise (Cited 1 times)",6516,"Columbia Journal of Gender and Law, Vol. 36, Issue 1 (2018), pp. 40-60",36 Colum. J. Gender & L. 40 (2018),1,na,28,na
Hidden Laws of the Time of Ferguson [comments],"Bell, Monica C. (Cited 58 times)",6516,"Harvard Law Review Forum, Vol. 132, Issue 1 (October 2018), pp. 1-23",na,na,na,na,na
The Establishment Clause and Public Education in an Islamophobic Era [article],"Eldik, Yaseen; Bell, Monica C. (Cited 58 times)",6516,"Stanford Journal of Civil Rights & Civil Liberties, Vol. 8, Issue 2 (August 2012), pp. 245-258",8 Stan. J. C.R. & C.L. 245 (2012),na,na,15,na
