Title,Author(s),ID,Journal,BBCite,Topics,Cited (articles),Cited (cases),Accessed
"Unsecured Borders: Immigration Restrictions, Crime Control and National Security [comments]","Chacon, Jennifer M. (Cited 841 times)",2814,"Connecticut Law Review, Vol. 39, Issue 5 (July 2007), pp. 1827-1892",39 Conn. L. Rev. 1827 (2006-2007),"Criminal Law and Procedure, Immigration Law, Fourteenth Amendment, Military, War and Peace",162,na,260
Misery and Myopia: Understanding the Failures of U.S. Efforts to Stop Human Trafficking [article],"Chacon, Jennifer M. (Cited 841 times)",2814,"Fordham Law Review, Vol. 74, Issue 6 (May 2006), pp. 2977-3040",74 Fordham L. Rev. 2977 (2005-2006),"Criminal Law and Procedure, International Law, Legislation, Human Rights Law, Remedies",136,na,47
A Diversion of Attention: Immigration Courts and the Adjudication of Fourth and Fifth Amendment Rights [article],"Chacon, Jennifer M. (Cited 841 times)",2814,"Duke Law Journal, Vol. 59, Issue 8 (May 2010), pp. 1563-1634",59 Duke L.J. 1563 (2009-2010),"Constitutional Law, Courts, Criminal Law and Procedure, Disability Law, Immigration Law, Psychiatry and Psychology",122,na,54
Managing Migration through Crime [article],"Chacon, Jennifer M. (Cited 841 times)",2814,"Columbia Law Review Sidebar, Vol. 109, pp. 135-148",109 Colum. L. Rev. Sidebar 135 (2009),"Immigration Law, Law and Society, Criminal Law and Procedure",94,na,165
Tensions and Trade-Offs: Protecting Trafficking Victims in the Era of Immigration Enforcement [article],"Chacon, Jennifer M. (Cited 841 times)",2814,"University of Pennsylvania Law Review, Vol. 158, Issue 6 (May 2010), pp. 1609-1654",158 U. Pa. L. Rev. 1609 (2009-2010),"Criminal Law and Procedure, Human Rights Law, Human Trafficking, Immigration Law, Labor Law, International Criminal Law, Law and Society, Offenses Against the Person",54,na,29
Overcriminalizing Immigration [article],"Chacon, Jennifer M. (Cited 841 times)",2814,"Journal of Criminal Law and Criminology, Vol. 102, Issue 3 (Summer 2012), pp. 613-652",102 J. Crim. L. & Criminology 613 (2012),"Immigration Law, State and Local Government Law, Constitutional Law, Criminal Law and Procedure, Law Enforcement",46,na,114
Whose Community Shield: Examining the Removal of the Criminal Street Gang Member [article],"Chacon, Jennifer M. (Cited 841 times)",2814,"University of Chicago Legal Forum, Vol. 2007, pp. 317-358",2007 U. Chi. Legal F. 317 (2007),"Criminal Law and Procedure, Immigration Law, Law Enforcement and Corrections, Economics, Remedies",42,na,16
The Transformation of Immigration Federalism [article],"Chacon, Jennifer M. (Cited 841 times)",2814,"William & Mary Bill of Rights Journal, Vol. 21, Issue 2 (December 2012), pp. 577-618",21 Wm. & Mary Bill Rts. J. 577 (2012-2013),"Federalism, Immigrants, Discrimination, Immigration Law",41,na,40
Loving across Borders: Immigration Law and the Limits of Loving [article],"Chacon, Jennifer M. (Cited 841 times)",2814,"Wisconsin Law Review, Vol. 2007, Issue 2 (2007), pp. 345-378",2007 Wis. L. Rev. 345 (2007),"Immigration Law, Civil Rights, Domestic Relations, Fourteenth Amendment, Law and Society, Race and Ethnicity",37,na,62
Producing Liminal Legality [article],"Chacon, Jennifer M. (Cited 841 times)",2814,"Denver University Law Review, Vol. 92, Issue 4 (2015), pp. 709-768",92 Denv. U. L. Rev. 709 (2015),"Law and Society, Liability, Immigrants, Violence",19,na,40
Immigration and the Bully Pulpit [comments],"Chacon, Jennifer M. (Cited 841 times)",2814,"Harvard Law Review Forum, Vol. 130, Issue 7 (May 2017), pp. 243-268",130 Harv. L. Rev. F. 243 (2016-2017),"Immigration Law, Criminal Law and Procedure, Religion, Civil Rights, Courts",15,na,198
Border Exceptionalism in the Era of Moving Borders [article],"Chacon, Jennifer M. (Cited 841 times)",2814,"Fordham Urban Law Journal, Vol. 38, Issue 1 (November 2010), pp. 129-154",38 Fordham Urb. L.J. 129 (2010-2011),"Constitutional Law, Courts, Criminal Law and Procedure, Immigration Law, Jurisdiction",14,na,17
Citizenship and Family: Revisiting Dred Scott [article],"Chacon, Jennifer M. (Cited 841 times)",2814,"Washington University Journal of Law and Policy, Vol. 27, pp. 45-70",27 Wash. U. J. L. & Pol'y 45 (2008),"Citizenship, Domestic Relations, Biography, Civil Rights, Legal History",13,na,6
"Race as a Diagnostic Tool: Latinas/os and Higher Education in California, Post-209 [article]","Chacon, Jennifer M. (Cited 841 times)",2814,"California Law Review, Vol. 96, Issue 5 (October 2008), pp. 1215-1258",96 Calif. L. Rev. 1215 (2008),"Education, Race, State and Local Government Law, Affirmative Action",10,na,10
Privatized Immigration Enforcement [article],"Chacon, Jennifer M. (Cited 841 times)",2814,"Harvard Civil Rights-Civil Liberties Law Review, Vol. 52, Issue 1 (Winter 2017), pp. 1-46",52 Harv. C.R.-C.L. L. Rev. 1 (2017),"Immigration Law, Rico, Politics, Privatization, Government Contracts, International Law, Military Law",7,na,59
The 1996 Immigration Law Come of Age [article],"Chacon, Jennifer M. (Cited 841 times)",2814,"Drexel Law Review, Vol. 9, Issue 2 (Spring 2017), pp. 297-322",9 Drexel L. Rev. 297 (2016-2017),"Criminal Law and Procedure, Race and Ethnicity, Immigration Law",6,na,21
Feminists at the Border [article],"Chacon, Jennifer (Cited 841 times)",2814,"Denver University Law Review, Vol. 91, Issue 1 (Fall 2013), pp. 85-108",91 Denv. U. L. Rev. 85 (2013-2014),"Immigration Law, Military, War and Peace, Feminism, Fourteenth Amendment, Politics, War",5,na,16
"Human Trafficking, Immigration Regulation, and Subfederal Criminalization [article]","Chacon, Jennifer M. (Cited 841 times)",2814,"New Criminal Law Review, Vol. 20, Issue 1 (Winter 2017), pp. 96-129",20 New Crim. L. Rev. 96 (2017),"Human Rights Law, Criminal Law and Procedure, Law Enforcement",3,na,113
Policing Immigration after Arizona [comments],"Chacon, Jennifer M. (Cited 841 times)",2814,"Wake Forest Journal of Law & Policy, Vol. 3, Issue 2 (June 2013), pp. 231-248",3 Wake Forest J. L. & Pol'y 231 (2013),"Federalism, Immigration Law, Jurisdiction, Law Enforcement and Corrections, Privacy, Technology, States",3,na,9
The Mercer Girls Guide to Immigration [article],"Chacon, Jennifer M. (Cited 841 times)",2814,"Vanderbilt Law Review En Banc, Vol. 64, pp. 15-28",64 Vand. L. Rev. En Banc 15 (2011),"Immigration Law, Regulation, Juveniles",2,na,na
Opening Our Hearts: A Response to Angela Onwuachi-Willig's according to Our Hearts [article],"Chacon, Jennifer (Cited 841 times)",2814,"Journal of Gender, Race & Justice, Vol. 16, Issue 3 (Summer 2013), pp. 725-740",16 J. Gender Race & Just. 725 (Summer 2013),"Domestic Relations, Race and Ethnicity, Constitutional Law, Military, War and Peace, Politics, Annulment",2,na,6
"Civil Rights, Immigrants' Rights, Human Rights: Lessons from the Life and Works of Dr. Martin Luther King, Jr. [article]","Chacon, Jennifer M. (Cited 841 times)",2814,"New York University Review of Law & Social Change, Vol. 32, Issue 4 (2008), pp. 465-484",32 N.Y.U. Rev. L. & Soc. Change 465 (2007-2008),"Biography, Civil Rights, Human Rights, Human Rights Law, Immigrants, Immigration Law, Martin Luther King, Jr",2,na,31
Statutory Analysis: Using Criminal Law to Highlight Issues in Statutory Interpretation [comments],"Chacon, Jennifer M. (Cited 841 times)",2814,"UC Irvine Law Review, Vol. 1, Issue 1 (2011), pp. 130-145",1 UC Irvine L. Rev. 130 (2011),"Criminal Law, Statutory Interpretation, Common Law, Legislation, Students",1,na,5
Who Is Responsible for U.S. Immigration Policy [article],"Chacon, Jennifer (Cited 841 times)",2814,"Insights on Law and Society, Vol. 14, Issue 3 (Spring 2014), pp. 20-24",14 Insights on L. & Soc'y 20 (2013-2014),"Immigration Law, State and Local Government Law, States, Federalism, Human Rights",1,na,13
Unsettling History [reviews],"Chacon, Jennifer M. (Cited 841 times)",2814,"Harvard Law Review, Vol. 131, Issue 4 (February 2018), pp. 1078-1124",131 Harv. L. Rev. 1078 (2017-2018),"Law Enforcement, Race and Ethnicity, Sentencing and Punishment, Criminal Law and Procedure, Indian Law, International Law, Psychiatry and Psychology",na,na,62
Misery and Myopia: Understanding the Failures of U.S. Efforts to Stop Human Trafficking [notes],"Chacon, Jennifer M. (Cited 841 times)",2814,"Immigration and Nationality Law Review, Vol. 27, pp. 331-396",27 Immigr. & Nat'lity L. Rev. 331 (2006),"Criminal Law and Procedure, International Law, Legislation, Law and Society, Sex Crimes",na,na,314
"Unsecured Borders: Immigration Restrictions, Crime Control and National Security [notes]","Chacon, Jennifer M. (Cited 841 times)",2814,"Immigration and Nationality Law Review, Vol. 28, pp. 613-678",28 Immigr. & Nat'lity L. Rev. 613 (2007),"Criminal Law and Procedure, Immigration Law, Fourteenth Amendment, Military, War and Peace",na,na,37
Immigration and the Bully Pulpit [comments] *new*,"Chacon, Jennifer M. (Cited 841 times)",2814,"Immigration and Nationality Law Review, Vol. 38, pp. 79-104",Full Text Not Currently Available in HeinOnline,"Education Law, Students, Immigration Law, Law Enforcement, President/Executive Department, State and Local Government Law, Criminal Law and Procedure, Religion",na,na,na
Tensions and Trade-offs: Protecting Trafficking Victims in the Era of Immigration Enforcement [article],"Chacon, Jennifer M. (Cited 841 times)",2814,"Immigration and Nationality Law Review, Vol. 31, pp. 277-322",31 Immigr. & Nat'lity L. Rev. 277 (2010),"Criminal Law and Procedure, Human Rights Law, Human Trafficking, Immigration Law, Labor Law, International Criminal Law, Law and Society, Offenses Against the Person",na,na,33
When Criminal and Immigration Law Collide [reviews],"Chacon, Jennifer (Cited 841 times)",2814,"Jotwell: The Journal of Things We Like (Lots), Vol. 2010, pp. [8]-[9]",2010 Jotwell: J. Things We Like [8] (2010),"Immigration Law, Immigrants, Sentencing",na,na,na
Who Controls Immigration Policy [reviews],"Chacon, Jennifer (Cited 841 times)",2814,"Jotwell: The Journal of Things We Like (Lots), Vol. 2011, pp. [117]-[119]",2011 Jotwell: J. Things We Like [117] (2011),"State and Local Government Law, Age, Legislation, Regulation, Federalism",na,na,na
Expanding the Canon [reviews],"Chacon, Jennifer (Cited 841 times)",2814,"Jotwell: The Journal of Things We Like (Lots), Vol. 2012, pp. [21]-[24]",2012 Jotwell: J. Things We Like [21] (2012),"Immigration Law, Law Enforcement, Race and Ethnicity, Criminal Law and Procedure",na,na,na
The Rise of Automated Policing [reviews],"Chacon, Jennifer (Cited 841 times)",2814,"Jotwell: The Journal of Things We Like (Lots), Vol. 2014, pp. [382]-[384]",2014 Jotwell: J. Things We Like [382] (2014),"Immigration Law, Jurisdiction, Law Enforcement and Corrections, Constitutional Law, Criminal Law and Procedure, Law Enforcement",na,na,na
Decriminalization and Its Discontents [reviews],"Chacon, Jennifer (Cited 841 times)",2814,"Jotwell: The Journal of Things We Like (Lots), Vol. 2015, pp. [380]-[382]",2015 Jotwell: J. Things We Like [380] (2015),"Criminal Law and Procedure, Sentencing, Crimes, Drivers' Licenses, Law Enforcement, Traffic Laws",na,na,na
Criminal Law's Borders [reviews],"Chacon, Jennifer (Cited 841 times)",2814,"Jotwell: The Journal of Things We Like (Lots), Vol. 2017, pp. [46]-[49]",2017 Jotwell: J. Things We Like [46] (2017),"Criminal Law and Procedure, Immigration Law",na,na,na
Addressing Legal Estrangement [reviews],"Chacon, Jennifer (Cited 841 times)",2814,"Jotwell: The Journal of Things We Like (Lots), Vol. 2018, pp. 1-3",2018 Jotwell: J. Things We Like 1 (2018),"Police, Race, Race and Ethnicity, Consent",na,na,4
Crimmigration and the Problem of Ad Hoc Instrumentalism [reviews],"Chacon, Jennifer (Cited 841 times)",2814,"Jotwell: The Journal of Things We Like (Lots), Vol. 2013, pp. [268]-[269]",2013 Jotwell: J. Things We Like [268] (2013),"Immigration Law, Courts",na,na,na
Does the Making or Subscribing to a False Tax Return Qualify as an Aggravated Felony for Immigration Purposes (10-577) [article],"Chacon, Jennifer M. (Cited 841 times)",2814,"Preview of United States Supreme Court Cases, Vol. 39, Issue 2 (October 31, 2011), pp. 73-76","39 Preview U.S. Sup. Ct. Cas. 73 (October 31, 2011)","Immigration Law, Criminal Law and Procedure",na,na,na
When Does a State Drug Paraphernalia Conviction Relate to a Controlled Substance: Mellouli v. Holder (13-1034) [notes],"Chacon, Jennifer M. (Cited 841 times)",2814,"Preview of United States Supreme Court Cases, Vol. 42, Issue 4 (January 2015), pp. 137-140",42 Preview U.S. Sup. Ct. Cas. 137 (2014-2015),"Criminal Law and Procedure, Immigration Law, Sentencing, Agriculture Law, Race and Ethnicity, Sentencing and Punishment, Social Welfare",na,na,na
"Does Conviction under a Criminal Statute That Penalizes Misrepresentations in the Procurement of Naturalization, and That Has the Collateral Consequence of Automatic Denaturalization, Require Proof of the Materiality of the Misrepresentations: Maslenjak v. United States (16-309) [article]","Chacon, Jennifer M. (Cited 841 times)",2814,"Preview of United States Supreme Court Cases, Vol. 44, Issue 7 (April 17, 2017), pp. 240-243",44 Preview U.S. Sup. Ct. Cas. 240 (2016-2017),"Procurement, Proof, States, Citizenship, Revocation, Immigration Law",na,na,1
Past as Prelude: Immigration Jurisprudence after Anthony Kennedy [article],"Chacon, Jennifer M. (Cited 841 times)",2814,"Preview of United States Supreme Court Cases, Vol. 45, Issue 8 (August 8, 2018), pp. 270-275","45 Preview U.S. Sup. Ct. Cas. 270 (August 8, 2018)","Jurisprudence, Immigration Law, Judicial Review, Sovereignty, National Security",na,na,19
Who Is Subject to the INA Provision for the Automatic Reinstatement of Removal Orders (04-1376) [article],"Chacon, Jennifer M. (Cited 841 times)",2814,"Preview of United States Supreme Court Cases, Vol. 2005-2006, Issue 6 (March 20, 2006), pp. 318-322",2005-2006 Preview U.S. Sup. Ct. Cas. 318 (2005-2006),"Immigration Law, Constitutional Law, Due Process, Judicial Review, Jurisdiction, Legislation",na,na,1
Can a State Felony Drug Conviction Equivalent to a Federal Misdemeanor Be a Removable Offense (05-547)(05-7664) [article],"Chacon, Jennifer M. (Cited 841 times)",2814,"Preview of United States Supreme Court Cases, Vol. 34, Issue 1 (October 3, 2006), pp. 26-30",34 Preview U.S. Sup. Ct. Cas. 26 (2006-2007),"Criminal Law and Procedure, Immigration Law",na,na,1
When is a Habeas Corpus Petition Challenging a Resentencing a Second or Successive Petition (09-158) [article],"Chacon, Jennifer M. (Cited 841 times)",2814,"Preview of United States Supreme Court Cases, Vol. 37, Issue 6 (March 22, 2010), pp. 248-251",37 Preview U.S. Sup. Ct. Cas. 248 (2009-2010),Criminal Law and Procedure,na,na,na
Panel Discussion I: Understanding Immigration: Satisfying Padilla's New Definition of Competence in Legal Representation [comments],"Chacon, Jennifer (Cited 841 times); Lasch, Christopher (Cited 24 times); Vazquez, Yolanda (Cited 142 times)",2814,"Tennessee Journal of Law and Policy, Vol. 9, Special Issue (Summer 2013), pp. 73-119",9 Tenn. J. L. & Pol'y 73 (2013-2014),"Criminal Law and Procedure, Immigration Law, Legal Profession",na,na,1
Is There a Duress Exception to the Persecutor Bar to Asylum and Withholding of Removal (07-499) [article],"Chacon, Jennifer M. (Cited 841 times)",2814,"Preview of United States Supreme Court Cases, Vol. 36, Issue 2 (November 3, 2008), pp. 126-129",36 Preview U.S. Sup. Ct. Cas. 126 (2008-2009),"Immigration Law, International Law, Criminal Law and Procedure",na,na,3
Citizenship Matters: Conceptualizing Belonging in an Era of Fragile Inclusions [article],"Chacon, Jennifer M. (Cited 841 times)",2814,"U.C. Davis Law Review, Vol. 52, Issue 1 (November 2018), pp. 1-80",52 U.C.D. L. Rev. 1 (2018-2019),Citizenship,na,na,39
Citizenship and Family: Revisiting Dred Scott [article],"Chacon, Jennifer M. (Cited 841 times)",2814,"Immigration and Nationality Law Review, Vol. 29, Issue 1 (2008), pp. 633-660",29 Immigr. & Nat'lity L. Rev. 633 (2008),"Citizenship, Domestic Relations, Slavery",na,na,6
Did a Washington Court's Jury Instruction on Accomplice Liability Unconstitutionally Alleviate the Prosecution's Burden (07-772) [article],"Chacon, Jennifer M. (Cited 841 times)",2814,"Preview of United States Supreme Court Cases, Vol. 36, Issue 1 (October 6, 2008), pp. 46-50",36 Preview U.S. Sup. Ct. Cas. 46 (2008-2009),"Criminal Law and Procedure, Law Enforcement and Corrections",na,na,2
Local Resistance and Criminal Law Reform [reviews],"Chacon, Jennifer (Cited 841 times)",2814,"Jotwell: The Journal of Things We Like (Lots), Vol. 2019, pp. 1-3",2019 Jotwell: J. Things We Like 1 (2019),"Criminal Law, Law Reform, Federalism, Police",na,na,na
