Title,Author(s),ID,Journal,BBCite,Topics,Cited (articles),Cited (cases),Accessed
The Mythical Beginnings of Intellectual Property [article],"Silbey, Jessica (Cited 151 times)",4784,"George Mason Law Review, Vol. 15, Issue 2 (Winter 2008), pp. 319-380",15 Geo. Mason L. Rev. 319 (2007-2008),"Intellectual Property, Intellectual Property Law, Property",39,na,38
"Harvesting Intellectual Property: Inspired Beginnings and Work-Makes-Work, Two Stages in the Creative Processes of Artists and Innovators [article]","Silbey, Jessica (Cited 151 times)",4784,"Notre Dame Law Review, Vol. 86, Issue 5 (September 2011), pp. 2091-2132",86 Notre Dame L. Rev. 2091 (2011),"Intellectual Property, Property, Intellectual Property Law, Property Law",18,na,17
Comparative Tales of Origins and Access: Intellectual Property and Rhetoric of Social Change [article],"Silbey, Jessica (Cited 151 times)",4784,"Case Western Reserve Law Review, Vol. 61, Issue 1 (Fall 2010), pp. 195-268",61 Case W. Res. L. Rev. 195 (2010-2011),"Intellectual Property, Intellectual Property Law, Jurisprudence, Law and Society, Property, Copyright, Human Rights",15,na,29
Cross-Examining Film [article],"Silbey, Jessica (Cited 151 times)",4784,"University of Maryland Law Journal of Race, Religion, Gender and Class, Vol. 8, Issue 1 (Spring 2008), pp. 17-46","8 U. Md. L.J. Race, Religion, Gender & Class 17 (2008)","Evidence, Practice and Procedure, Judges, Legal Profession, Politics",12,na,13
Evidence Verite and the Law of Film [article],"Silbey, Jessica (Cited 151 times)",4784,"Cardozo Law Review, Vol. 31, Issue 4 (March 2010), pp. 1257-1300",31 Cardozo L. Rev. 1257 (2009-2010),"Evidence, Practice and Procedure, Legal Profession, Politics, Civil Rights",11,na,27
Videotaped Confessions and the Genre of Documentary [article],"Silbey, Jessica (Cited 151 times)",4784,"Fordham Intellectual Property, Media & Entertainment Law Journal, Vol. 16, Issue 3 (Spring 2006), pp. 789-808",16 Fordham Intell. Prop. Media & Ent. L.J. 789 (2005-2006),"Confessions, Evidence, Constitutional Amendment, Constitutional Law, Eminent Domain, Property, Annexation, Municipalities, State and Local Government Law",9,na,23
"Criminal Performances: Film, Autobiography, and Confession [article]","Silbey, Jessica (Cited 151 times)",4784,"New Mexico Law Review, Vol. 37, Issue 1 (WInter 2007), pp. 189-244",37 N.M. L. Rev. 189 (2007),"Criminal Law and Procedure, Psychiatry and Psychology, Law Enforcement and Corrections",9,na,11
Patterns of Courtroom Justice [article],"Silbey, Jessica (Cited 151 times)",4784,"Journal of Law and Society, Vol. 28, Issue 1 (March 2001), pp. 97-116",28 J.L. & Soc'y 97 (2001),"Movies, Trials, Communications Law, Law and Society",7,na,23
Images in/of Law [article],"Silbey, Jessica (Cited 151 times)",4784,"New York Law School Law Review, Vol. 57, Issue 1 (2012-2013), pp. 171-184",57 N.Y. L. Sch. L. Rev. 171 (2012-2013),"Evidence, Practice and Procedure, First Amendment, Publicity, Right of Publicity, Computer Law",7,na,29
Truth Tales and Trial Films [article],"Silbey, Jessica (Cited 151 times)",4784,"Loyola of Los Angeles Law Review , Vol. 40, Issue 2 (Winter 2007), pp. 551-588",40 Loy. L. A. L. Rev. 551 (2006-2007),"Legal Profession, Politics, Communications Law, Law and Society, Evidence, Practice and Procedure",6,na,23
Patent Variation: Discerning Diversity among Patent Functions [article],"Silbey, Jessica (Cited 151 times)",4784,"Loyola University Chicago Law Journal, Vol. 45, Issue 2 (Winter 2013), pp. 441-478",45 Loy. U. Chi. L.J. 441 (2013-2014),"Intellectual Property, Property, Research",5,na,4
Analysis of Videotape Evidence in Police Misconduct Cases [article],"Schwartz, Martin A. (Cited 200 times); Silbey, Jessica (Cited 151 times); Ryan, Jack (Cited 5 times); Donoghue, Gail (Cited 21 times)",4784,"Touro Law Review, Vol. 25, Issue 3 (2009), pp. 857-908",25 Touro L. Rev. 857 (2009),"Evidence, Misconduct, Police, Videotapes",5,na,11
The Politics of Law and Film Study: An Introduction to the Symposium on Legal Outsiders in American Film [article],"Silbey, Jessica (Cited 151 times)",4784,"Suffolk University Law Review, Vol. 42, Issue 4 (2009), pp. 755-768",42 Suffolk U. L. Rev. 755 (2008-2009),"Legal Profession, Politics, Evidence, Practice and Procedure, Women",2,na,14
Fairer Uses [article],"Silbey, Jessica (Cited 151 times)",4784,"Boston University Law Review, Vol. 96, Issue 3 (May 2016), pp. 857-868",96 B.U. L. Rev. 857 (2016),"Copyright, Notice, Property, Intellectual Property Law",1,na,14
"Picturing Moral Arguments in a Fraught Legal Arena: Fetuses, Photographic Phantoms and Ultrasounds [article]","Silbey, Jessica (Cited 151 times)",4784,"Georgetown Journal of Gender and the Law, Vol. 16, Issue 3 (Summer 2015), pp. 593-632",16 Geo. J. Gender & L. 593 (2015),"Law and Society, Medical Jurisprudence, Reproduction, Abortion, Rape",1,na,29
Afterword: Conferring about the Conference [comments],"Silbey, Jessica (Cited 151 times); Perzanowski, Aaron (Cited 243 times); Trimble, Marketa (Cited 77 times)",4784,"Houston Law Review, Vol. 52, Issue 2 (2014), pp. 679-690",52 Hous. L. Rev. 679 (2014-2015),"Copyright, Intellectual Property Law, Economics, Law and Society",1,na,3
Heuristic Interventions in the Study of Intellectual Property [comments],"Silbey, Jessica (Cited 151 times)",4784,"Minnesota Law Review Headnotes, Vol. 101, pp. 333-348",101 Minn. L. Rev. Headnotes 333 (2016),"Intellectual Property, Property, Drugs, Health, Intellectual Property Law, Shelters",1,na,21
Introduction to Symposium: Reasoning from Literature [comments],"Silbey, Jessica (Cited 151 times)",4784,"Yale Journal of Law and the Humanities, Vol. 22, Issue 2 (Summer 2010), pp. 339-348",22 Yale J.L. & Human. 339 (2010),"Legal Analysis and Writing, Literature",1,na,16
Reading Intellectual Property Reform through the Lens of Constitutional Equality [reviews],"Silbey, Jessica (Cited 151 times)",4784,"Tulsa Law Review, Vol. 50, Issue 2 (Winter 2015), pp. 549-570",50 Tulsa L. Rev. 549 (2014-2015),"Intellectual Property, Intellectual Property Law, Property, Copyright, Politics, Age, Internet",1,na,7
Justifying Copyright in the Age of Digital Reproduction: The Case of Photographers [article],"Silbey, Jessica (Cited 151 times)",4784,"UC Irvine Law Review, Vol. 9, Issue 2 (January 2019), pp. 405-454",9 UC Irvine L. Rev. 405 (2018-2019),"Age, Copyright, Reproduction",na,na,10
The Past and Future of Copyright Politics [reviews],"Silbey, Jessica (Cited 151 times)",4784,"Jotwell: The Journal of Things We Like (Lots), Vol. 2014, pp. [307]-[309]",2014 Jotwell: J. Things We Like [307] (2014),"Copyright, Politics, Intellectual Property, Intellectual Property Law, Property, Internet, Legislation, Science and Technology",na,na,na
Parody and Fair Markets [reviews],"Silbey, Jessica (Cited 151 times)",4784,"Jotwell: The Journal of Things We Like (Lots), Vol. 2015, pp. [190]-[191]",2015 Jotwell: J. Things We Like [190] (2015),"Copyright, Industrial and Intellectual Property, Trademarks, Intellectual Property, Property",na,na,na
Speaking from the Grave - Should Copyright Listen [reviews],"Silbey, Jessica (Cited 151 times)",4784,"Jotwell: The Journal of Things We Like (Lots), Vol. 2016, pp. [327]-[329]",2016 Jotwell: J. Things We Like [327] (2016),"Copyright, Property",na,na,na
Three Strikes for Copyright [reviews],"Silbey, Jessica (Cited 151 times)",4784,"Jotwell: The Journal of Things We Like (Lots), Vol. 2017, pp. 1-3",2017 Jotwell: J. Things We Like 1 (2017),"Copyright, Strikes, Three Strikes, Photographs",na,na,8
The Costs of Trademarking Dolls [reviews],"Silbey, Jessica (Cited 151 times)",4784,"Jotwell: The Journal of Things We Like (Lots), Vol. 2018, pp. 1-3",2018 Jotwell: J. Things We Like 1 (2018),"Costs, First Amendment, Intellectual Property Law, Sex, International Trade",na,na,2
Narrative Topoi in the Digital Age [notes],"Said, Zahr K. (Cited 35 times); Silbey, Jessica (Cited 151 times)",4784,"Journal of Legal Education, Vol. 68, Issue 1 (Autumn 2018), pp. 103-114",68 J. Legal Educ. 103 (2018),"Age, Legal Writing",na,na,4
"Charles J. Ogletree, Jr. and Austin Sarat, Punishment in Popular Culture [reviews]","Silbey, Jessica (Cited 151 times)",4784,"Law & Society Review, Vol. 51, Issue 1 (2017), pp. 206-209",Full Text Not Currently Available in HeinOnline,"Punishment, Rape, Violence, Communications Law",na,na,na
How Do Lawyers Think Differently from Stem Professionals When Approaching Problems and Risk [article],"Silbey, Jessica (Cited 151 times)",4784,"Northwestern University Law Review Online, Vol. 112, pp. 161-162",112 Nw. U. L. Rev. Online 161 (2017-2018),"Women, Education, Minorities, Race, Technology",na,na,6
"Control over Contemporary Photography: A Tangle of Copyright, Right of Publicity, and the First Amendment [comments] *new*","Silbey, Jessica (Cited 151 times)",4784,"Columbia Journal of Law & the Arts, Vol. 42, Issue 3 (2019), pp. 351-364",42 Colum. J.L. & Arts 351 (2018-2019),na,na,na,na
