Title,Author(s),ID,Journal,BBCite,Topics,Cited (articles),Cited (cases),Accessed
The Criminalization of Poverty [article],"Gustafson, Kaaryn (Cited 82 times)",3885,"Journal of Criminal Law and Criminology , Vol. 99, Issue 3 (Spring 2009), pp. 643-716",99 J. Crim. L. & Criminology 643 (2008-2009),"Social Welfare Law, Fraud",51,na,173
"Breaking Vows: Marriage Promotion, the New Patriarchy, and the Retreat from Egalitarianism [article]","Gustafson, Kaaryn (Cited 82 times)",3885,"Stanford Journal of Civil Rights & Civil Liberties, Vol. 5, Issue 2 (October 2009), pp. 269-308",5 Stan. J. C.R. & C.L. 269 (2009),"Marriage, Domestic Relations, Family Law, Jurisdiction, Government, States",21,na,45
Degradation Ceremonies and the Criminalization of Low-Income Women [article],"Gustafson, Kaaryn (Cited 82 times)",3885,"UC Irvine Law Review, Vol. 3, Issue 2 (2013), pp. 297-358",3 UC Irvine L. Rev. 297 (2013),"Women, Law and Society, Civil Procedure, Practice and Procedure, Procedure, Psychiatry and Psychology, Race",4,na,55
Broken Promises [comments],"Gustafson, Kaaryn (Cited 82 times)",3885,"Berkeley Women's Law Journal, Vol. 13, Issue 1 (1998), pp. 3-6",13 Berkeley Women's L.J. 3 (1998),"Affirmative Action, Education, Legal Education",3,na,1
"Disability, Fluidity, and Measuring without Baselines [article]","Gustafson, Kaaryn (Cited 82 times)",3885,"Mississippi Law Journal, Vol. 75, Issue 4 (Spring 2006), pp. 1007-1038",75 Miss. L.J. 1007 (2005-2006),"Disability, Law and Society, Economics, Labor, Labor Law",2,na,22
