Title,Author(s),ID,Journal,BBCite,Topics,Cited (articles),Cited (cases),Accessed
The Keepers of the Federal Courts Canon [reviews],"Vladeck, Steve",7246,"Jotwell: The Journal of Things We Like (Lots), Vol. 2015, pp. [155]-[157]",2015 Jotwell: J. Things We Like [155] (2015),"Courts, Federal Courts, Jurisprudence, Judges, Legal Education",na,na,na
Why Military Justice Doesn't get Enough Academic Attention [reviews],"Vladeck, Steve",7246,"Jotwell: The Journal of Things We Like (Lots), Vol. 2018, pp. 1-2",2018 Jotwell: J. Things We Like 1 (2018),"Jurisdiction, Military, War and Peace, Sexuality and the Law, Criminal Law and Procedure, Psychiatry and Psychology",na,na,6
Judicial Specialization and the Functional Case for Non-Article III Courts [reviews],"Vladeck, Steve",7246,"Jotwell: The Journal of Things We Like (Lots), Vol. 2011, pp. [29]-[31]",2011 Jotwell: J. Things We Like [29] (2011),"Courts, Administration Law, Judges, Titles",na,na,na
"Federal Crimes, State Courts, and Palmore [reviews]","Vladeck, Steve",7246,"Jotwell: The Journal of Things We Like (Lots), Vol. 2012, pp. [67]-[69]",2012 Jotwell: J. Things We Like [67] (2012),"Criminal Law and Procedure, Jurisdiction, Constitutional Law, Judges, State and Local Government Law",na,na,na
The National Security Courts We Already Have [reviews],"Vladeck, Steve",7246,"Jotwell: The Journal of Things We Like (Lots), Vol. 2013, pp. [93]-[94]",2013 Jotwell: J. Things We Like [93] (2013),"Courts, National Security, Sentencing, Judges, Politics, Supreme Court of the United States",na,na,na
What Abbasi Should Have Said [reviews],"Vladeck, Steve",7246,"Jotwell: The Journal of Things We Like (Lots), Vol. 2017, pp. 1-3",2017 Jotwell: J. Things We Like 1 (2017),"National Security, Remedies, Immunity, Damages",na,na,8
Appealing to Justice [reviews],"Vladeck, Steve",7246,"Jotwell: The Journal of Things We Like (Lots), Vol. 2014, pp. [219]-[221]",2014 Jotwell: J. Things We Like [219] (2014),"Appeals, Courts, Federal Courts, Jurisdiction",na,na,na
"The Perils of State Standing, Revisited [reviews]","Vladeck, Steve",7246,"Jotwell: The Journal of Things We Like (Lots), Vol. 2016, pp. [52]-[55]",2016 Jotwell: J. Things We Like [52] (2016),"Standing, Jurisdiction, States, Health, Ultra Vires",na,na,na
Bringing in the Jury [reviews],"Vladeck, Steve",7246,"Jotwell: The Journal of Things We Like (Lots), Vol. 2016, pp. [385]-[386]",2016 Jotwell: J. Things We Like [385] (2016),"Constitutional Law, Criminal Law and Procedure, Practice and Procedure",na,na,na
