Title,Author(s),ID,Journal,BBCite,Topics,Cited (articles),Cited (cases),Accessed
Harmonizing Third-Party Litigation Funding Regulation [article],na,7569,"Cardozo Law Review, Vol. 36, Issue 3 (February 2015), pp. 861-912",36 Cardozo L. Rev. 861 (2014-2015),"Banking, Dispute Resolution, Practice and Procedure, Regulation, Torts, Class Actions",11,na,116
Judging Third-Party Funding [article],"Sahani, Victoria Shannon (Cited 16 times)",7569,"UCLA Law Review, Vol. 63, Issue 2 (2016), pp. 388-448",63 UCLA L. Rev. 388 (2016),"Banking, Practice and Procedure, Arbitration, Commercial Arbitration, International Commercial Arbitration, International Arbitration",11,na,201
Reshaping Third-Party Funding [article],"Sahani, Victoria Shannon (Cited 16 times)",7569,"Tulane Law Review, Vol. 91, Issue 3 (February 2017), pp. 405-472",91 Tul. L. Rev. 405 (2016-2017),"Legal Profession, Professional Ethics, Class Actions, Arbitration, Investment",3,na,145
Recent Developments in Third-Party Funding [notes],na,7569,"Journal of International Arbitration, Vol. 30, Issue 4 (August 2013), pp. 443-452",30 J. Int'l Arb. 443 (2013),"Arbitration, Commercial Arbitration, International Commercial Arbitration, International Arbitration, Investment",2,na,4
Third-Party Litigation Funding and the Dodd-Frank Act [article],na,7569,"Transactions: The Tennessee Journal of Business Law, Vol. 16, Issue 1 (Fall 2014), pp. 15-24",16 Transactions: Tenn. J. Bus. L. 15 (2014-2015),"Banking, Dispute Resolution, Practice and Procedure, Regulation, Torts, Class Actions",1,na,21
Panel 4: Litigation Funding and the Federal Rules of Civil Procedure [comments],"Miller, Arthur (Cited 3 times); Gillers, Stephen (Cited 811 times); Fishbein, Michael; Burch, Elizabeth Chamblee (Cited 541 times); Glover, Maria; Sahani, Victoria Shannon (Cited 16 times)",7569,"New York University Journal of Law and Business, Vol. 12, Issue 3 (2016), pp. 603-634",12 N.Y.U. J.L. & Bus. 603 (2015-2016),"Civil Procedure, Federal Rules of Civil Procedure, Procedure, Banking, Dispute Resolution, Legal Profession, Professional Ethics, Money, Trade Regulation",na,na,11
