Title,Author(s),ID,Journal,BBCite,Topics,Cited (articles),Cited (cases),Accessed
"Black Like Me Gangsta Culture, Clarence Thomas, and Afrocentric Academies [article]","Brown, Eleanor (Cited 41 times)",3991,"New York University Law Review, Vol. 75, Issue 2 (May 2000), pp. 308-353",75 N.Y.U. L. Rev. 308 (2000),"Law and Society, Civil Rights, Criminal Law and Procedure, Juveniles",29,na,23
The Scope of Volunteer Activity and Public Service [article],"Brown, Eleanor (Cited 41 times)",3991,"Law and Contemporary Problems, Vol. 62, Issue 4 (Autumn 1999), pp. 17-42",62 Law and Contemp. Probs. 17 (1999),"Immunity, Social Welfare Law, Torts, Criminal Law and Procedure, Professional Ethics, Youth Sports",9,na,12
Assessing the Value of Volunteer Activity [article],"Brown, Eleanor (Cited 41 times)",3991,"Nonprofit and Voluntary Sector Quarterly, Vol. 28, Issue 1 (March 1999), pp. 3-17",28 Nonprofit & Voluntary Sector Q. 3 (1999),"Labor, Government, Economics, Literature",2,na,29
Social Capital and Philanthropy: An Analysis of the Impact of Social Capital on Individual Giving and Volunteering [article],"Brown, Eleanor (Cited 41 times); Ferris, James M. (Cited 1 times)",3991,"Nonprofit and Voluntary Sector Quarterly, Vol. 36, Issue 1 (March 2007), pp. 85-99",36 Nonprofit & Voluntary Sector Q. 85 (2007),"Philanthropy, Evidence",1,na,62
The Need to Open Doors and Hearts: The Detention of Unaccompanied Minors Seeking Asylum in the United States and Mexico [article],"Chavez, Lizbeth M.; Chavez, Tammy V.; Todd, Adam G. (Cited 49 times); Brown, Eleanor (Cited 41 times); Perez-Bustillo, Camilo",3991,"University of Dayton Law Review, Vol. 42, Issue 3 (Winter 2017), pp. 359-410",42 U. Dayton L. Rev. 359 (2017),"Civil Rights, Comparative and Foreign Law, Human Rights Law, Immigration Law, International Law, Juveniles, Sentencing and Punishment",na,na,134
Life Expectancy and the Search for a Bag Lady Effect in Charitable Giving [notes],"Brown, Eleanor (Cited 41 times); Mesch, Debra J. (Cited 2 times); Hayat, Amir Daniel",3991,"Nonprofit and Voluntary Sector Quarterly, Vol. 45, Issue 3 (June 2016), pp. 630-645",Full Text Not Currently Available in HeinOnline,"Gender, Homelessness, Housing, Property, Property Law, Real Property, Women, Medical Jurisprudence",na,na,na
Altruism toward Groups: The Charitable Provision of Private Goods [article],"Brown, Eleanor (Cited 41 times)",3991,"Nonprofit and Voluntary Sector Quarterly, Vol. 26, Issue 2 (June 1997), pp. 175-184",26 Nonprofit & Voluntary Sector Q. 175 (1997),"Taxation, Money, Government",na,na,4
Symposium: Methodology in Surveying Giving and Volunteering Behavior: Introduction [comments],"Brown, Eleanor (Cited 41 times); Burlingame, Dwight",3991,"Nonprofit and Voluntary Sector Quarterly, Vol. 30, Issue 3 (September 2001), pp. 480-482",30 Nonprofit & Voluntary Sector Q. 480 (2001),"Immunity, Social Welfare Law, Torts, Youth Sports, Criminal Law and Procedure, Professional Ethics",na,na,2
