,Title,Author(s),Journal,Cited (articles),Cited (cases),Accessed,Topics
0,Keeping Faith: Government Ethics & (and) Government Ethics Regulation [article],"Farina, Cynthia (Cited 46 times)","Administrative Law Review, Vol. 45, Issue 3 (Summer 1993), pp. 287-342",27,1,6, Professional Ethics
0,"Regulatory Improvement Legislation: Risk Assessment, Cost-Benefit Analysis, and Judicial Review [article]","Anderson, Fred (Cited 16 times); Chirba-Martin, Mary Ann (Cited 40 times); Elliott, E. Donald (Cited 1896 times); Farina, Cynthia (Cited 46 times)","Duke Environmental Law & Policy Forum, Vol. 11, Issue 1 (Fall 2000), pp. 89-138",16,na,16," Judicial Review, Legislation, Administrative Law, Economics"
0,Democratic Deliberation in the Wild: The McGill Online Design Studio and the Regulationroom Project [article],"Farina, Cynthia (Cited 46 times); Kong, Hoi (Cited 32 times); Blake, Cheryl (Cited 11 times); Newhart, Mary (Cited 25 times); Luka, Nik","Fordham Urban Law Journal, Vol. 41, Issue 5 (October 2014), pp. 1527-1580",3,na,18," Comparative Law, Politics, Banking, Banking Law, Public Law"
0,E-Rulemaking [chapter],"Farina, Cynthia (Cited 46 times)","Developments in Administrative Law and Regulatory Practice, Vol. 2007-2008, pp. 57-66",na,na,na," Science and Technology, Legislation, Practice and Procedure, Democracy"
0,Judicial Review of Petitions [article],"Farina, Cynthia (Cited 46 times)","Administrative Law Review, Vol. 48, Issue 3 (Summer 1996), pp. 355-355",na,na,na," Judges, Jurisprudence, Administration Law, Politics"
