,Title,Author(s),Journal,Cited (articles),Cited (cases),Accessed,Topics
0,Constructive Trusts in Bankruptcy [article],"Sherwin, Emily L. (Cited 143 times)","University of Illinois Law Review, Vol. 1989, Issue 2 (1989), pp. 297-366",45,16,19," Bankruptcy, Bankruptcy Law, Remedies, Trusts, Contracts, Creditors"
0,Creditors' Rights against Participants in a Leveraged Buyout [article],"Sherwin, Emily L. (Cited 143 times)","Minnesota Law Review, Vol. 72, Issue 3 (February 1988), pp. 449-522",42,6,10," Commercial Law, Corporations, Creditors, Banking, Bankruptcy, Foreign Investment, International Claims, Liquidation, Securities, Agency"
0,Law and Equity in Contract Enforcement [article],"Sherwin, Emily L. (Cited 143 times)","Maryland Law Review, Vol. 50, Issue 2 (1991), pp. 253-315",36,na,28," Contracts, Equity, Remedies, Defenses, Practice and Procedure, Commercial Code, Sales, Uniform Commercial Code"
0,Contribution Arguments in Commercial Law [article],"Walt, Steven (Cited 284 times); Sherwin, Emily L. (Cited 143 times)","Emory Law Journal, Vol. 42, Issue 4 (Fall, 1993), pp. 897-966",14,2,4," Commercial Law, Economics, Creditors, Debt, Interest"
0,The Bubble Concept in Water Pollution Control [notes],"Sherwin, Emily L. (Cited 143 times)","Boston University Law Review, Vol. 60, Issue 3 (May 1980), pp. 686-712",3,na,3," Pollution, Water, Water Pollution, Environmental Law"
0,"Essay on Private Remedies, An [article]","Sherwin, Emily L. (Cited 143 times)","Canadian Journal of Law and Jurisprudence, Vol. 6, Issue 1 (January 1993), pp. 89-112",2,na,3," Remedies, Jurisprudence, Torts, Liability"
0,The Limits of Feminism [article],"Sherwin, Emily L. (Cited 143 times)","Journal of Contemporary Legal Issues, Vol. 9, pp. 249-256",1,na,10," Feminism, Abortion, Constitutional Law, Equal Protection, Jurisprudence"
