,Title,Author(s),Journal,Cited (articles),Cited (cases),Accessed,Topics
0,On Property: An Essay [article],"Underkuffler, Laura S. (Cited 469 times)","Yale Law Journal, Vol. 100, Issue 1 (October 1990), pp. 127-148",131,na,38," Property, Jurisdiction, Criminal Law and Procedure"
0,A Statement of Progressive Property [article],"Alexander, Greogry S. (Cited 100 times); Penalver, Eduardo M. (Cited 417 times); Singer, Joseph William (Cited 3388 times); Underkuffler, Laura S. (Cited 469 times)","Cornell Law Review, Vol. 94, Issue 4 (May 2009), pp. 743-744",100,na,89," Law and Society, Property, Democracy, Politics"
0,Vouchers and beyond: The Individual as Causative Agent in Establishment Clause Jurisprudence [article],"Underkuffler, Laura S. (Cited 469 times)","Indiana Law Journal, Vol. 75, Issue 1 (Winter 2000), pp. 167-192",37,na,1," Education, Jurisprudence, Vouchers, Religious Freedom"
0,Discrimination on the Basis of Religion: An Examination of Attempted Value Neutrality in Employment [article],"Underkuffler, Laura S. (Cited 469 times)","William and Mary Law Review, Vol. 30, Issue 3 (Spring 1989), pp. 581-626",28,na,14," Civil Rights, Discrimination, Employment, Fair Employment, Labor Law, Neutrality, Religion, Government, Health, Sports"
0,Tahoe's Requiem: The Death of the Scalian View of Property and Justice [article],"Underkuffler, Laura S. (Cited 469 times)","Constitutional Commentary, Vol. 21, Issue 3 (Winter 2004), pp. 727-756",27,na,7," Death, Judges, Property, Jurisprudence"
0,Property and Change: The Constitutional Conundrum [article],"Underkuffler, Laura S. (Cited 469 times)","Texas Law Review, Vol. 91, Issue 7 (June 2013), pp. 2015-2042",16,na,12," Property, Death, Judges"
0,Odiuos Discrimination and the Religious Exemption Question [article],"Underkuffler, Laura S. (Cited 469 times)","Cardozo Law Review, Vol. 32, Issue 5 (May 2011), pp. 2069-2092",16,na,20," Discrimination, Sexuality and the Law, Maintenance, Legislation, Sexual Orientation"
0,Thoughts on Smith and Religious-Group Autonomy [comments],"Underkuffler, Laura S. (Cited 469 times)","Brigham Young University Law Review, Vol. 2004, pp. 1773-1788",14,na,3," Religion, Religious Freedom"
0,The Price of Vouchers for Religious Freedom [article],"Underkuffler, Laura S. (Cited 469 times)","University of Detroit Mercy Law Review, Vol. 78, Issue 3 (Spring 2001), pp. 463-478",13,na,3," Religious Freedom, Vouchers, Education, Jurisprudence, Schools, States"
0,Judicial Takings: A Medley of Misconceptions [article],"Underkuffler, Laura S. (Cited 469 times)","Syracuse Law Review, Vol. 61, Issue 2 (2011), pp. 203-212",11,5,5," Land Use Planning, Takings, Due Process, Jurisprudence, Environment, Judiciary, Takings Clause"
0,The Politics of Property and Need [comments],"Underkuffler, Laura S. (Cited 469 times)","Cornell Journal of Law and Public Policy, Vol. 20, Issue 2 (Winter 2010), pp. 363-376",10,na,4," Politics, Property, Civil Law"
0,The Perfidy of Property [reviews],"Underkuffler, Laura S. (Cited 469 times)","Texas Law Review, Vol. 70, Issue 1 (November 1991), pp. 293-346",10,na,11," Property, Jurisprudence, Constitutional Law, Takings"
0,"Through a Glass Darkly: Van Orden, McCreary, and the Dangers of Transparency in Establishment Clause Jurisprudence [article]","Underkuffler, Laura S. (Cited 469 times)","First Amendment Law Review , Vol. 5, Issue 1 (Fall 2006), pp. 59-81",9,na,9," Jurisprudence, Liberty, Neutrality, Religion"
0,When Should Rights Trump--An Examiniation of Speech and Property [article],"Underkuffler, Laura S. (Cited 469 times)","Maine Law Review, Vol. 52, Issue 2 (2000), pp. 311-322",8,na,9," Constitutional Law, Property, Intellectual Property, Compensation"
0,Agentic and Conscientic Decisions in Law: Death and Other Cases [article],"Underkuffler, Laura S. (Cited 469 times)","Notre Dame Law Review, Vol. 74, Issue 5 (June 1999), pp. 1713-1736",8,1,3," Death, Jurisprudence, Clergy"
0,Individual Conscience and the Law [article],"Underkuffler, Laura S. (Cited 469 times)","DePaul Law Review, Vol. 42, Issue 1 (Fall 1992), pp. 93-98",6,na,4," Religion, Freedom of Religion, Jurisprudence"
0,Lessons from Outlaws [notes],"Underkuffler, Laura S. (Cited 469 times)","University of Pennsylvania Law Review PENNumbra, Vol. 156, pp. 262-268",6,na,2," Politics, Property"
0,Davey and the Limits of Equality [article],"Underkuffler, Laura S. (Cited 469 times)","Tulsa Law Review, Vol. 40, Issue 2 (Winter 2004), pp. 267-278",5,na,1," Constitutional Law, Religion, States, Discrimination, Religious Discrimination"
0,Human Genetics Studies: The Case for Group Rights [article],"Underkuffler, Laura S. (Cited 469 times)","Journal of Law, Medicine and Ethics, Vol. 35, Issue 3 (Fall 2007), pp. 383-395",4,na,2," Genetics, South Africa"
0,Teaching Property Stories [article],"Underkuffler, Laura S. (Cited 469 times)","Journal of Legal Education, Vol. 55, Issue 1 (2005), pp. 152-162",3,na,5," Property, Economics, Law and Society, Nuisance"
0,Religious Exemptions and the Common Good: A Reply to Professor Carmella [comments],"Underkuffler, Laura S. (Cited 469 times)","West Virginia Law Review, Vol. 110, Issue 1 (Fall 2007), pp. 449-458",2,na,1," Religion, Maintenance"
0,Individual Reliance and Government Forbearance: A Tale of Five Cases [article],"Underkuffler, Laura S. (Cited 469 times)","Brigham-Kanner Property Rights Conference Journal, Vol. 3, pp. 141-162",1,na,3," Government, Property, Sovereignty"
0,What Does the Constitutional Protection of Property Mean [article],"Underkuffler, Laura S. (Cited 469 times)","Brigham-Kanner Property Rights Conference Journal, Vol. 5, pp. 109-124",1,na,15, Property
0,The Blaine Debate: Must States Fund Religious Schools [article],"Underkuffler, Laura S. (Cited 469 times)","First Amendment Law Review, Vol. 2, Issue 1 (Winter 2003), pp. 179-198",1,na,2," Schools, States, Education, Government, Religion"
0,"Property, Sovereignty, and the Public Trust [article]","Underkuffler, Laura S. (Cited 469 times)","Theoretical Inquiries in Law, Vol. 18, Issue 2 (July 2017), pp. 329-354",1,na,na," Property, Sovereignty, Government"
0,Religious Freedom in an Egalitarian Age: Rejecting Doctrinal Nihilism in the Adjudication of Religious Claims [comments],"Underkuffler, Laura S. (Cited 469 times)","Journal of Civil Rights and Economic Development, Vol. 31, Issue 2 (Spring 2018), pp. 217-232",1,na,17," Age, Religious Freedom, Obligations, Religion"
0,"Markets, Morals, and the Maintenance of Government [article]","Underkuffler, Laura S. (Cited 469 times)","Cornell Journal of Law and Public Policy, Vol. 27, Issue 3 (Spring 2018), pp. 601-618",na,na,8," Comparative Law, Criminal Law and Procedure, International Trade, Law and Society, Psychiatry and Psychology"
0,"Should the Religious Be Exempt: Questions of Justice, Character, and the Maintenance of Norms [reviews]","Underkuffler, Laura S. (Cited 469 times)","Criminal Justice Ethics, Vol. 37, Issue 1 (April 2018), pp. 87-101",na,na,na," Maintenance, Affirmative Action, Civil Rights, Discrimination, Sexuality and the Law"
0,Subversive Property [comments],"Underkuffler, Laura S. (Cited 469 times)","New England Law Review, Vol. 50, Issue 3 (Spring 2016), pp. 295-304",na,na,11," Property, Sexual Orientation, Constitutional Law, Courts, Imprisonment, Sentencing, States"
0,The Establishment Clause: Political Metaphor or Guarantor of Rights [comments],"Underkuffler, Laura S. (Cited 469 times)","Texas Law Review See Also, Vol. 89, pp. 49-60",na,na,1," Religion, Jurisprudence, First Amendment, Politics"
0,A Moral Theory of Property [article],"Underkuffler, Laura S. (Cited 469 times)","Texas A&M Journal of Property Law, Vol. 2, Issue 2 (2015), pp. 301-312",na,na,10," Property, Intellectual Property, Property Law"
0,Takings and the Problem of Value: Grappling with Truth in Land-Restriction Cases [article],"Underkuffler, Laura S. (Cited 469 times)","Vermont Journal of Environmental Law, Vol. 11, Issue 3 (Spring 2010), pp. 465-478",na,na,2," Takings, Agency, Constitutional Law, Courts, Property"
0,"Religion and the Continental Congress, 1774-1789: Contributions to Original Intent [reviews]","Underkuffler, Laura S. (Cited 469 times)","Journal of Law and Religion, Vol. 16, Issue 2 (2001), pp. 559-564",na,na,na,na
