Title,Author(s),ID,Journal,BBCite,Topics,Cited (articles),Cited (cases),Accessed
The Battle over Taxing Offshore Accounts [article],"Grinberg, Itai (Cited 90 times)",7369,"UCLA Law Review, Vol. 60, Issue 2 (December 2012), pp. 304-383",60 UCLA L. Rev. 304 (2012-2013),"Human Rights Law, States, Eighth Amendment, Fines, Sentencing",30,na,39
Taxing International Portfolio Income [article],"Graetz, Michael J. (Cited 1468 times); Grinberg, Itai (Cited 90 times)",7369,"Tax Law Review, Vol. 56, Issue 4 (Summer 2003), pp. 537-586",56 Tax L. Rev. 537 (2002-2003),na,30,na,14
The New International Tax Diplomacy [article],"Grinberg, Itai (Cited 90 times)",7369,"Georgetown Law Journal, Vol. 104, Issue 5 (June 2016), pp. 1137-1196",104 Geo. L.J. 1137 (June 2016),"Diplomacy, International Trade, Tax Policy, Corporations, Taxation-Federal Income",17,na,52
Where Credit is Due: Advantages of the Credit-Invoice Method for a Partial Replacement VAT [article],"Grinberg, Itai (Cited 90 times)",7369,"Tax Law Review, Vol. 63, Issue 2 (Winter 2010), pp. 309-358",63 Tax L. Rev. 309 (2009-2010),"Credit, European Union, Financial Services, Taxation, Computer Law, Computer Programs, Property Tax, Sales, Software",13,na,25
A VAT in the United States - Fat Change [article],"Duncan, Harley (Cited 5 times); Grinberg, Itai (Cited 90 times); Hall, Christopher (Cited 19 times)",7369,"Tax Executive, Vol. 69, Issue 4 (July/August 2017), pp. 55-62",69 Tax Executive 55 (2017),"States, International Trade, Age, Commerce, Electronic Commerce",na,na,11
Session 5: VAT - Practical Considerations and Lessons Learned [article],"Merril, Peter; Grinberg, Itai (Cited 90 times); Mellor, Nigel; Pallot, Marie",7369,"Taxes: The Tax Magazine, Vol. 88, Issue 6 (June 2010), pp. 65-154",88 Tax Mag. 65 (2010),"Battered Women, Women, Climate Change, Diplomacy, States, Children",na,na,4
International Taxation in an Era of Digital Disruption: Analyzing the Current Debate [article],"Grinberg, Itai (Cited 90 times)",7369,"Taxes: The Tax Magazine, Vol. 97, Issue 3 (March 2019), pp. 73-104",Full Text Not Currently Available in HeinOnline,"Taxation, Jurisdiction, European Commission",na,na,na
"Federal Taxes: Revenues, Spending and Corporate Income Tax Alternatives [comments]","Gutman, Hank (Cited 1 times); Beran, Robin; Grinberg, Itai (Cited 90 times); Perry, Victoria J. (Cited 3 times); Toder, Eric (Cited 23 times)",7369,"Taxes: The Tax Magazine, Vol. 93, Issue 6 (June 2015), pp. 43-52",93 Taxes 43 (2015),"Corporations, Legislation",na,na,na
International Taxation in an Era of Digital Disruption: Analyzing the Current Debate [article],"Grinberg, Itai (Cited 90 times)",7369,"International Tax Journal, Vol. 45, Issue 2 (March-April 2019), pp. 39-[ii]",Full Text Not Currently Available in HeinOnline,"Taxation, Standing, International Trade, Trade Regulation",na,na,na
