Title,Author(s),ID,Journal,BBCite,Topics,Cited (articles),Cited (cases),Accessed
"Tax Myopia, or Mamas Don't Let Your Babies Grow up to Be Tax Lawyers [article]","Caron, Paul L. (Cited 535 times)",2664,"Virginia Tax Review, Vol. 13, Issue 3 (Winter 1994), pp. 517-590",13 Va. Tax Rev. 517 (1993-1994),"Legal Profession, Legislation, Ethics, Professional Ethics, Taxation",139,na,25
Taking Back the Law School Classroom: Using Technology to Foster Active Student Learning [article],"Caron, Paul L. (Cited 535 times); Gely, Rafael (Cited 550 times)",2664,"Journal of Legal Education, Vol. 54, Issue 4 (2004), pp. 551-569",54 J. Legal Educ. 551 (2004),"Technology, Trials, Victims, Violence",59,na,64
What Law Schools Can Learn from Billy Beane and the Oakland Athletics [article],"Caron, Paul L. (Cited 535 times); Gely, Rafael (Cited 550 times)",2664,"Texas Law Review, Vol. 82, Issue 6 (May 2004), pp. 1483-1554",82 Tex. L. Rev. 1483 (2003-2004),"Athletics, Legal Education, Schools, Sports, Law and Society, Baseball",51,na,39
Ranking Law Schools: Using SSRN to Measure Scholarly Performance [article],"Black, Bernard S. (Cited 3728 times); Caron, Paul L. (Cited 535 times)",2664,"Indiana Law Journal, Vol. 81, Issue 1 (Winter 2006), pp. 83-140",81 Ind. L.J. 83 (2006),"Schools, Legal Literature, Research",37,na,26
Tax Myopia Meets Tax Hyperopia: The Unproven Case of Increased Judicial Deference to Revenue Rulings [article],"Caron, Paul L. (Cited 535 times)",2664,"Ohio Staw Law Journal, Vol. 57, Issue 2 (1996), pp. 637-670",57 Ohio St. L.J. 637 (1996),"Taxation-Federal Income, Administration Law",36,1,7
"The Role of State Court Decisions in Federal Tax Litigation: Bosch, Erie, and Beyond [article]","Caron, Paul L. (Cited 535 times)",2664,"Oregon Law Review, Vol. 71, Issue 4 (Winter 1992), pp. 781-854",71 Or. L. Rev. 781 (1992),"Jurisdiction, State and Local Government Law, Appeals, Courts, Federal Courts, Statute of Limitations, Taxation-Federal Income",28,na,5
Dead Poets and Academic Progenitors: The Next Generation of Law School Rankings [comments],"Caron, Paul L. (Cited 535 times); Gely, Rafael (Cited 550 times)",2664,"Indiana Law Journal, Vol. 81, Issue 1 (Winter 2006), pp. 1-12",81 Ind. L.J. 1 (2006),"Law and Society, Schools, Athletics, Legal Education, Sports",27,na,16
Occupy the Tax Code: Using the Estate Tax to Reduce Inequality and Spur Economic Growth [article],"Caron, Paul L. (Cited 535 times); Repetti, James R. (Cited 458 times)",2664,"Pepperdine Law Review, Vol. 40, Special Issue (2013), pp. 1255-1290",40 Pepp. L. Rev. 1255 (2012-2013),"Economics, Estates, Law and Society, Antitrust",23,na,53
Back to the Future: Teaching Law through Stories [article],"Caron, Paul L. (Cited 535 times)",2664,"University of Cincinnati Law Review, Vol. 71, Issue 2 (Winter 2003), pp. 405-420",71 U. Cin. L. Rev. 405 (2002-2003),"Legal Education, Corporations, Securities Law, Civil Law, Education Law",18,na,15
The Estate Tax Non-Gap: Why Repeal a Voluntary Tax [article],"Caron, Paul L. (Cited 535 times); Repetti, James R. (Cited 458 times)",2664,"Stanford Law & Policy Review, Vol. 20, Issue 1 (2009), pp. 153-170",20 Stan. L. & Pol'y Rev. 153 (2009),"Death, Taxation-Federal, Taxation",17,na,6
Are Scholars Better Bloggers - Bloggership: How Blogs Are Transforming Legal Scholarship [article],"Caron, Paul L. (Cited 535 times)",2664,"Washington University Law Review, Vol. 84, Issue 5 (2006), pp. 1025-1042",84 Wash. U. L. Rev. 1025 (2006),"Schools, Liability, Citizenship, Internet",14,na,4
"Tax Regulation, Transportation Innovation, and the Sharing Economy [article]","Barry, Jordan M. (Cited 110 times); Caron, Paul L. (Cited 535 times)",2664,"University of Chicago Law Review Dialogue, Vol. 82, pp. 69-84",82 U. Chi. L. Rev. Dialogue 69 (2015-2016),"Regulation, Transportation Law, Taxation, Employment Practice, States, Tax Policy",10,na,445
The Federal Courts of Appeals' Use of State Court Decisions in Tax Cases: Proper Regard Means No Regard [article],"Caron, Paul L. (Cited 535 times)",2664,"Oklahoma Law Review, Vol. 46, Issue 3 (Fall 1993), pp. 443-488",46 Okla. L. Rev. 443 (1993),"Appeals, Courts, Federal Courts, Jurisdiction, Statute of Limitations, Gift Taxation, Taxation",9,na,3
The Associate Dean for Faculty Research Position: Encouraging and Promoting Scholarship [article],"Tomain, Joseph P. (Cited 423 times); Caron, Paul L. (Cited 535 times)",2664,"University of Toledo Law Review, Vol. 33, Issue 1 (Fall 2001), pp. 233-244",33 U. Tol. L. Rev. 233 (2001-2002),"Research, Real Estate",9,na,11
The Capital Defendant's Right to Obtain Exculpatory Evidence from the Prosecution to Present in Mitigation before Sentencing [article],"Caron, Paul L. (Cited 535 times)",2664,"American Criminal Law Review, Vol. 23, Issue 2 (Fall 1985), pp. 207-242",23 Am. Crim. L. Rev. 207 (1985-1986),"Evidence, Exculpatory Evidence, Sentencing, Criminal Law, Death",9,na,1
The One-Hundredth Anniversary of the Federal Estate Tax: It's Time to Renew Our Vows [article],"Caron, Paul L. (Cited 535 times)",2664,"Boston College Law Review, Vol. 57, Issue 3 (2016), pp. 823-842",57 B.C. L. Rev. 823 (2016),"Costs, Environmental Law, Legislation, Economics",8,na,8
The Estate Tax Deduction for Administration Expenses: Reformulating Complementary Roles for Federal and State Law Under I.R.C 2053 (a)(2) [article],"Caron, Paul L. (Cited 535 times)",2664,"Cornell Law Review, Vol. 67, Issue 5 , pp. 981-1010",67 Cornell L. Rev. 981 (1981-82),"Costs, Interest, Loans",8,3,na
Taxing Opportunity [article],"Caron, Paul L. (Cited 535 times)",2664,"Virginia Tax Review, Vol. 14, Issue 2 (Fall 1994), pp. 347-424",14 Va. Tax Rev. 347 (1994-1995),"Interest, Loans, Gift Taxation, Taxation",7,na,4
The Federal Tax Implications of Bush v. Gore [article],"Caron, Paul L. (Cited 535 times)",2664,"Washington University Law Quarterly, Vol. 79, Issue 3 (2001), pp. 749-786",79 Wash. U. L. Q. 749 (2001),"Taxation-Federal Income, Appeals, Courts, Federal Courts, Jurisdiction, Statute of Limitations, Federalism",6,na,4
Revaluation of Prior Gifts for Estate Tax Purposes after Expiration of Statute of Limitations for Year of Gift [article],"Caron, Paul L. (Cited 535 times)",2664,"Taxes - The Tax Magazine, Vol. 67, Issue 5 (May 1989), pp. 286-293",67 Taxes 286 (1989),"Gifts, Statute of Limitations",5,na,1
The Costs of Estate Tax Dithering [comments],"Caron, Paul L. (Cited 535 times)",2664,"Creighton Law Review, Vol. 43, Issue 3 (2010), pp. 637-656",43 Creighton L. Rev. 637 (2009-2010),"Costs, Environmental Law, Death, President/Executive Department, Tax Policy, Taxation-Federal",4,na,na
Affirmative Refraction: Grutter v. Bollinger through the Lens of the Case of the Speluncean Explorers [article],"Caron, Paul L. (Cited 535 times); Gely, Rafael (Cited 550 times)",2664,"Constitutional Commentary, Vol. 21, Issue 1 (Spring 2004), pp. 63-106",21 Const. Comment. 63 (Spring 2004),"Judges, Statutory Construction, Statutory Interpretation, Legal Education",3,na,23
California Dreamin': Tax Scholarship in a Time of Fiscal Crisis [comments],"Bankman, Joseph (Cited 1021 times); Caron, Paul L. (Cited 535 times)",2664,"U.C. Davis Law Review, Vol. 48, Issue 1 (November 2014), pp. 405-418",48 U.C.D. L. Rev. 405 (2014-2015),"Debts, States",3,na,3
More Taxing Cases [notes],"Caron, Paul (Cited 535 times)",2664,"Green Bag. An Entertaining Journal of Law. (Second Series), Vol. 5, Issue 2 (Winter 2002), pp. 205-206",Full Text Not Currently Available in HeinOnline,"Inheritance, Taxation, New Deal, Incorporation, International Law: History",na,na,na
"Long Tail of Legal Scholarship, The","Caron, Paul L. (Cited 535 times)",2664,na,116 Yale L.J. F. 79,na,na,na,na
The Ideal Mentor [notes],"Caron, Paul L. (Cited 535 times)",2664,"Oklahoma City University Law Review, Vol. 40, Issue 1 (Spring 2015), pp. 85-86",40 Okla. City U. L. Rev. 85 (2015),"Biography, Judges",na,na,3
Tax Advice for the Second Obama Administration [article],"Caron, Paul L. (Cited 535 times)",2664,"Pepperdine Law Review, Vol. 40, Special Issue (2013), pp. 1143-1154",40 Pepp. L. Rev. 1143 (2012-2013),"Corporations, Taxation, Interest, Congress",na,na,1
Confronting Unforeseen Problems under 28 U.S.C. 1631: The Tenth Circuit Struggles to Properly Dispose of Tucker Act Claims within the Exclusive Jurisdiction of the Claims Court [article],"Caron, Paul L. (Cited 535 times)",2664,"Brigham Young University Law Review, Vol. 1985, Issue 3 (1985), pp. 505-512",1985 BYU L. Rev. 505 (1985 ),"Jurisdiction, Courts, Statutes",na,na,na
Does the Federal Gift Tax Apply to Disclaimers of Gifts Made before the Tax Became Law (92-1546) [article],"Caron, Paul L. (Cited 535 times)",2664,"Preview of United States Supreme Court Cases, Vol. 1993-1994, Issue 3 (November 29, 1993), pp. 98-100",1993-1994 Preview U.S. Sup. Ct. Cas. 98 (1993-1994),"Disclaimers, Gifts, Interest, States",na,na,na
