Title,Author(s),ID,Journal,BBCite,Topics,Cited (articles),Cited (cases),Accessed
"Powers Inherent in Sovereignty: Indians, Aliens, Territories, and the Nineteenth Century Origins of Plenary Power over Foreign Affairs [article]","Cleveland, Sarah H. (Cited 826 times)",5739,"Texas Law Review, Vol. 81, Issue 1 (November 2002), pp. 1-284",81 Tex. L. Rev. 1 (November 2002),"Aliens, Foreign Affairs, Immigration Law, Indian Law, Jurisdiction, Sovereignty, International Law: History, Jurisprudence, National Security, States",274,2,165
Our International Constitution [article],"Cleveland, Sarah H. (Cited 826 times)",5739,"Yale Journal of International Law, Vol. 31, Issue 1 (Winter 2006), pp. 1-126",31 Yale J. Int'l L. 1 (2006),"Constitutional Law, International Law: History",127,na,31
Norm Internalization and U.S. Economic Sanctions [article],"Cleveland, Sarah H. (Cited 826 times)",5739,"Yale Journal of International Law, Vol. 26, Issue 1 (Winter 2001), pp. 1-102",26 Yale J. Int'l L. 1 (Winter 2001),"Human Rights Law, Sanctions, Customary Law, Human Rights Law, Jurisprudence, Legal Positivism, Immigration Law, International Law: History, Labor",89,na,112
Global Labor Rights and the Alien Tort Claims Act [reviews],"Cleveland, Sarah H. (Cited 826 times)",5739,"Texas Law Review, Vol. 76, Issue 6 , pp. 1533-1580",76 Tex. L. Rev. 1533 (1997-1998),"Labor, Tort Claims, Comparative Law, Sovereignty, International Trade, Labor, Trade Unions",62,na,4
Crosby and the One-Voice Myth in U.S. Foreign Relations [article],"Cleveland, Sarah H. (Cited 826 times)",5739,"Villanova Law Review, Vol. 46, Issue 5 (2001), pp. 975-1014",46 Vill. L. Rev. 975 (2001),"Cuba, Investment, Northern Ireland, Procurement, International Law: History, Schools, International Trade, Legislation, State and Local Government Law, States",52,na,15
Embedded International Law and the Constitution Abroad [article],"Cleveland, Sarah H. (Cited 826 times)",5739,"Columbia Law Review, Vol. 110, Issue 2 (March 2010), pp. 225-287",110 Colum. L. Rev. 225 (March 2010),"Constitutional Law, International Law: History, Human Rights Law, Jurisdiction",45,na,20
The Plenary Power Background of Curtiss-Wright [article],"Cleveland, Sarah H. (Cited 826 times)",5739,"University of Colorado Law Review, Vol. 70, Issue 4 (Fall 1999), pp. 1127-1156",70 U. Colo. L. Rev. 1127 (Fall 1999),"Legal History, Treaties, Constitutional Law, Foreign Affairs, President/Executive Department",38,na,22
"The Alien Tort Statute, Civil Society, and Corporate Responsibility [comments]","Cleveland, Sarah H. (Cited 826 times)",5739,"Rutgers Law Review, Vol. 56, Issue 4 (Summer 2004), pp. 971-988",56 Rutgers L. Rev. 971 (2003-2004),"Corporations, Human Rights Law, Liability, Torts, Human Rights Law, Public Law",32,na,17
Human Rights Sanctions and International Trade: A Theory of Compatibility [article],"Cleveland, Sarah H. (Cited 826 times)",5739,"Journal of International Economic Law, Vol. 5, Issue 1 (March 2002), pp. 133-190",Full Text Not Currently Available in HeinOnline,"Human Rights Law, International Trade, Sanctions, Human Rights Law",na,na,na
Defining and Punishing Offenses Under Treaties [article],"Cleveland, Sarah H. (Cited 826 times); Dodge, William S. (Cited 1042 times)",5739,"Yale Law Journal, Vol. 124, Issue 7 (May 2015), pp. 2202-2285",124 Yale L. J. 2202 (2014-2015),"Treaties, Constitutional Law, Courts, Federal Courts, International Law: History, Federalism, Jurisdiction",22,3,31
Hamdi Meets Youngstown: Justice Jackson's Wartime Security Jurisprudence and the Detention of Enemy Combatants [article],"Cleveland, Sarah H. (Cited 826 times)",5739,"Albany Law Review, Vol. 68, Issue 4 (2005), pp. 1127-1144",68 Alb. L. Rev. 1127 (2004-2005),"Detention, Jurisprudence, President/Executive Department",21,na,14
"Foreign Authority, American Exceptionalism, and the Dred Scott Case [article]","Cleveland, Sarah H. (Cited 826 times)",5739,"Chicago-Kent Law Review, Vol. 82, Issue 1 (2007), pp. 393-458",82 Chi.-Kent L. Rev. 393 (2007),"Comparative Law, Legal Analysis and Writing, Constitutional Law, Jurisprudence, Sovereignty",12,na,9
Inter-American Court of Human Rights Amicus Curiae Brief: The United States Violates International Law When Labor Law Remedies Are Restricted Based on Workers' Migrant Status [article],"Cleveland, Sarah (Cited 826 times); Lyon, Beth (Cited 133 times); Smith, Rebecca (Cited 81 times)",5739,"Seattle Journal for Social Justice, Vol. 1, Issue 3 (Spring/Summer 2003), pp. 795-918",1 Seattle J. Soc. Just. 795 (Spring/Summer 2003),"Human Rights Law, International Law: History, Labor, Labor, Remedies, States, Tort Claims, Undocumented Workers, Employment, Immigration Law",10,na,22
The Kiobel Presumption and Extraterritoriality [comments],"Cleveland, Sarah H. (Cited 826 times)",5739,"Columbia Journal of Transnational Law, Vol. 52, Issue 1 (2013), pp. 8-27",52 Colum. J. Transnat'l L. 8 (2013-2014),"Aliens, Exterritoriality, International Law: History, Jurisdiction, Torts, Human Rights Law, Conflict of Laws",8,2,32
The Legacy of Louis Henkin: Human Rights in the Age of Terror [comments],"Cleveland, Sarah H. (Cited 826 times)",5739,"Columbia Human Rights Law Review, Vol. 38, Issue 3 (Spring 2007), pp. 499-516",38 Colum. Hum. Rts. L. Rev. 499 (2006-2007),"Age, Human Rights Law, Biography, International Law: History, Military Law, War",3,na,3
Human Rights in the United States [comments],"Cleveland, Sarah (Cited 826 times); Powell, Catherine (Cited 304 times)",5739,"Columbia Human Rights Law Review, Vol. 40, Issue 1 (Fall 2008), pp. 1-6",40 Colum. Hum. Rts. L. Rev. 1 (2008-2009),"Human Rights Law, Law and Society, Legal Education, States, Age",2,na,12
After Kiobel [article],"Cleveland, Sarah H. (Cited 826 times)",5739,"Journal of International Criminal Justice, Vol. 12, Issue 3 (July 2014), pp. 551-577",12 J. Int'l Crim. Just. 551 (2014),"Aliens, Courts, Petroleum, Exterritoriality, International Law: History, Jurisdiction, Torts, Liability",1,na,41
Perspectives on the Restatement (Fourth) Project [comments],"Dodge, William S. (Cited 1042 times); Cleveland, Sarah (Cited 826 times); Stephan, Paul (Cited 1489 times); Koh, Harold Hongju (Cited 4731 times); Bellinger, John; McLachlan, Campbell (Cited 184 times)",5739,"Proceedings of the Annual Meeting, published by the American Society of International Law, Vol. 109, pp. 209-228",109 Am. Soc'y Int'l L. Proc. 209 (2015),"States, Treaties, Constitutional Law, Politics, President/Executive Department, Rule of Law",na,na,7
