,Title,Author(s),Journal,Cited (articles),Cited (cases),Accessed,Topics
0,Reinventing the Double Helix: A Novel and Nonobvious Reconceptualization of the Biotechnology Patent [article],"Demaine, Linda J. (Cited 262 times); Fellmeth, Aaron Xavier","Stanford Law Review, Vol. 55, Issue 2 (November 2002), pp. 303-462",115,na,8," Intellectual Property Law, Science and Technology"
0,Volunteering to Arbitrate through Predispute Arbitration Clauses: The Average Consumer's Experience [article],"Demaine, Linda J. (Cited 262 times); Hensler, Deborah R. (Cited 1617 times)","Law and Contemporary Problems, Vol. 67, Issues 1 and 2 (Wintr/Spring 2004), pp. 55-74",113,na,29," Commercial Law, Consumer Protection Law, Dispute Resolution, Practice and Procedure, Contracts, Trade Regulation"
0,Process Dangers of Military Involvement in Civil Law Enforcement: Rectifying the Posse Comitatus Act [article],"Demaine, Linda J. (Cited 262 times); Rosen, Brian (Cited 10 times)","New York University Journal of Legislation and Public Policy, Vol. 9, Issue 1 (2005), pp. 167-250",10,na,11," Law Enforcement, Military, War and Peace, Politics, Race and Ethnicity"
0,In Search of an Anti-Elephant: Confronting the Human Inability to Forget Inadmissible Evidence [article],"Demaine, Linda J. (Cited 262 times)","George Mason Law Review, Vol. 16, Issue 1 (Fall 2008), pp. 99-140",9,1,25," Evidence, Law and Society, Practice and Procedure"
0,Seeing Is Deceiving: The Tacit Deregulation of Deceptive Advertising [article],"Demaine, Linda J. (Cited 262 times)","Arizona Law Review, Vol. 54, Issue 3 (2012), pp. 719-764",9,na,18," Consumer Protection Law, Trade Regulation, Constitutional Law, Communications Law"
0,Navigating Policy by the Stars: The Influence of Celebrity Entertainers on Federal Lawmaking [article],"Demaine, Linda J. (Cited 262 times)","Journal of Law & Politics , Vol. 25, Issue 2 (Spring 2009), pp. 83-144",5,na,24," Law and Society, Legislation, Miscellaneous, Intellectual Property Law"
0,Playing Doctor with the Patient's Spouse: Alternative Conceptions of Health Professional Liability [article],"Demaine, Linda J. (Cited 262 times)","Virginia Journal of Social Policy & the Law, Vol. 14, Issue 3 (Spring 2007), pp. 308-356",1,na,8," Domestic Relations, Medical Jurisprudence, Health Care Providers, Medical Care, First Amendment"
