Title,Author(s),ID,Journal,BBCite,Topics,Cited (articles),Cited (cases),Accessed
Corporations without Labor: The Politics of Progressive Corporate Law [article],na,6334,"University of Pennsylvania Law Review, Vol. 151, Issue 6 (June 2003), pp. 1861-1912",151 U. Pa. L. Rev. 1861 (2002-2003),"Corporations, Labor, Politics, Documents, Statutes, Gender",47,na,6
Shareholders as Proxies: The Contours of Shareholder Democracy [article],"Mitchell, Dalia Tsuk (Cited 179 times)",6334,"Washington and Lee Law Review, Vol. 63, Issue 4 (Fall 2006), pp. 1503-1578",63 Wash. & Lee L. Rev. 1503 (2006),na,38,na,1
From Pluralism to Individualism: Berle and Means and 20th-Century American Legal Thought [article],na,6334,"Law and Social Inquiry , Vol. 30, Issue 1 (Winter 2005), pp. 179-227",30 Law & Soc. Inquiry 179 (2005),"Jurisprudence, History, Ownership, Separation, Fiduciaries",35,na,11
The New Deal Origins of American Legal Pluralism [article],na,6334,"Florida State University Law Review, Vol. 29, Issue 1 (Fall 2001), pp. 189-268",29 Fla. St. U. L. Rev. 189 (2001-2002),"Indian Law, Legal History, New Deal",31,na,6
Status Bound: The Twentieth Century Evolution of Directors' Liability [article],"Mitchell, Dalia Tsuk (Cited 179 times)",6334,"New York University Journal of Law & Business, Vol. 5, Issue 1 (Spring 2009), pp. 63-152",5 N.Y.U. J.L. & Bus. 63 (2009),"Agency, Liability, Corporations, Model Business Corporation Act",12,na,8
The End of Corporate Law [article],"Mitchell, Dalia Tsuk (Cited 179 times)",6334,"Wake Forest Law Review, Vol. 44, Issue 3 (2009), pp. 703-730",44 Wake Forest L. Rev. 703 (2009),"Securities Law, Law and Society, Jurisprudence",11,na,13
The Import of History to Corporate Law [article],"Mitchell, Dalia Tsuk (Cited 179 times)",6334,"Saint Louis University Law Journal, Vol. 59, Issue 3 (Spring 2015), pp. 683-700",59 St. Louis U. L.J. 683 (2014-2015),"History, Health, Banking, Banking Law, Business Organizations, Corporations",3,na,18
Pluralisms: The Indian New Deal as a Model [article],na,6334,"Margins, Vol. 1, Issue 2 (2001), pp. 393-450",1 Margins 393 (2001),"New Deal, Indian Law, Legal History",2,na,1
A Double Runner: Felix S. Cohen and the Indian New Deal [article],na,6334,"PoLAR: Political and Legal Anthropology Review, Vol. 25, Issue 1 (2002), pp. 48-68",25 PoLAR 48 (2002),"New Deal, Indian Law, Legal History",na,na,3
