Title,Author(s),ID,Journal,BBCite,Topics,Cited (articles),Cited (cases),Accessed
Constitutional Rights and Military Necessity: Reflections on the Society Apart [article],"Zillman, Donald N. (Cited 364 times); Imwinkelried, Edward J. (Cited 2531 times)",73,"Notre Dame Lawyer, Vol. 51, Issue 3 (February 1976), pp. 396-436",51 Notre Dame Law. 396 (1975-1976),"Constitutional Rights, Courts, Federal Courts, Military Law",34,na,6
Intramilitary Tort Law: Incidence to Service Meets Constitutional Tort [article],"Zillman, Donald (Cited 364 times)",73,"North Carolina Law Review, Vol. 60, Issue 3 (1981-1982), pp. 489-542",60 N.C. L. Rev. 489 (1981-1982),"Immunity, Torts, States",29,1,1
Legal Aspects of Solar Energy Development [article],"Zillman, Donald N. (Cited 364 times); Deeny, Raymond (Cited 29 times)",73,"Arizona State Law Journal, Vol. 1976, Issue 1 (1976), pp. 25-62",1976 Ariz. St. L.J. 25 (1976),"Solar Energy, Tax Incentives",29,na,5
The Legacy of Greer v. Spock: The Public Forum Doctrine and the Principle of the Military's Political Neutrality [article],"Zillman, Donald N. (Cited 364 times); Imwinkelried, Edward J. (Cited 2531 times)",73,"Georgetown Law Journal, Vol. 65, Issue 2 (December 1976), pp. 773-806",65 Geo. L. J. 773 (December 1976),"Neutrality, Judges, Martial Law, Medical Jurisprudence, Military Law",26,na,4
"Congress, Courts and Government Tort Liability: Reflections on the Discretionary Function Exception to the Federal Tort Claims Act [article]","Zillman, Donald N. (Cited 364 times)",73,"Utah Law Review, Vol. 1989, Issue 3 (1989), pp. 687-740",1989 Utah L. Rev. 687 (1989),"Congress, Courts, Government, Liability, Tort Claims, Torts",20,na,3
Law Student Employment and Legal Education [article],"Zillman, Donald N. (Cited 364 times); Gregory, Vickie R. (Cited 27 times)",73,"Journal of Legal Education , Vol. 36, Issue 3 (1986), pp. 390-402",36 J. Legal Educ. 390 (1986),"Education Law, Employment, Legal Education, Courts",19,na,10
Evolution in the First Amendment: Overbreadth Analysis and Free Speech within the Military Community [article],"Imwinkelried, Edward J. (Cited 2531 times); Zillman, Donald N. (Cited 364 times)",73,"Texas Law Review, Vol. 54, Issue 1 (December 1975), pp. 42-88",54 Tex. L. Rev. 42 (1975-1976),"First Amendment, Habeas Corpus, Jurisdiction",19,na,5
Protecting Discretion: Judicial Interpretation of the Discretionary Function Exception to the Federal Tort Claims Act [article],"Zillman, Donald N. (Cited 364 times)",73,"Maine Law Review, Vol. 47, Issue 2 (1995), pp. 365-388",47 Me. L. Rev. 365 (1995),Tort Claims,18,3,2
Perspectives on NEPA in the Courts [article],"Zillman, Donald N. (Cited 364 times); Gentles, Peggy (Cited 18 times)",73,"Environmental Law, Vol. 20, Issue 3 (1990), pp. 505-532",20 Envtl. L. 505 (1990),"Courts, Environmental Policy, Agency",18,na,6
Uncloaking Law School Hiring: A Recruit's Guide to the AALS Faculty Recruitment Conference [article],"Zillman, Don (Cited 364 times); Angel, Marina (Cited 456 times); Laitos, Jan (Cited 451 times); Pring, George (Cited 35 times)",73,"Journal of Legal Education , Vol. 38, Issue 2 (1988), pp. 345-358",38 J. Legal Educ. 345 (1988),"Economics, Race, Legal Education, Legal Profession",18,na,3
The Changing Meanings of Discretion: Evolution in the Federal Tort Claims Act [article],"Zillman, Donald N. (Cited 364 times)",73,"Military Law Review, Vol. 76, pp. 1-42",76 Mil. L. Rev. 1 (1977),"Tort Claims, Jurisdiction, Government, Government Liability, Liability",15,2,2
Free Speech and Military Command [article],"Zillman, Donald N. (Cited 364 times)",73,"Utah Law Review, Vol. 1977, Issue 3 (1977), pp. 423-456",1977 Utah L. Rev. 423 (1977),"States, Employees, First Amendment, Public Employees, International Law: History, National Defense, War",14,1,2
Presenting a Claim under the Federal Tort Claims Act [article],"Zillman, Donald N. (Cited 364 times)",73,"Louisiana Law Review, Vol. 43, Issue 4 (1982-1983), pp. 961-1000",43 La. L. Rev. 961 (1982-1983),"Tort Claims, Notice, Torts, Remedies, States",11,2,na
More Than Tilting at Windmills [comments],"Zillman, Donald (Cited 364 times); Walta, Mary E. (Cited 11 times); Castiella, Inigo del Guayo (Cited 10 times)",73,"Washburn Law Journal, Vol. 49, Issue 1 (Fall 2009), pp. 1-68",49 Washburn L.J. 1 (2009-2010),"Comparative Law, Renewable Energy, Wind Energy",10,na,11
Where Have All the Soldiers Gone--Observations on the Decline of Military Veterans in Government [article],"Zillman, Donald N. (Cited 364 times)",73,"Maine Law Review, Vol. 49, Issue 1 (1997), pp. 85-110",49 Me. L. Rev. 85 (1997),"Government, Veterans' Law, Congress, Intellectual Property Law, Military Service",9,na,7
The New Apprentices: An Empirical Study of Student Employment and Legal Education [article],"Zillman, Donald N. (Cited 364 times); Gregory, Vickie R. (Cited 27 times)",73,"Journal of Contemporary Law, Vol. 12, Issue 2 (1987), pp. 203-242",12 J. Contemp. L. 203 (1987),"Education Law, Employment, Legal Education, Appeals",8,na,4
Regulatory Discretion: The Supreme Court Reexamines the Discretionary Function Exception to the Federal Tort Claims Act [article],"Zillman, Donald N. (Cited 364 times)",73,"Military Law Review, Vol. 110, pp. 115-144",110 Mil. L. Rev. 115 (1985),"Tort Claims, States, Torts",7,na,na
Essay: Where Have All the Soldiers Gone II: Military Veterans in Congress and the State of Civil-Military Relations [comments],"Zillman, Donald N. (Cited 364 times)",73,"Maine Law Review, Vol. 58, Issue 1 (2006), pp. 135-157",58 Me. L. Rev. 135 (2006),"Congress, Intellectual Property Law, Veterans' Law, Government, Military Service",5,na,16
Welcoming Remkars for the First Frank M. Coffin Lecture on Law and Public Service [comments],"Zillman, Donald N. (Cited 364 times)",73,"Maine Law Review, Vol. 45, Issue 1 (1993), pp. 1-2",45 Me. L. Rev. 1 (1993),"Judges, Legal Profession",5,na,1
The American Approach to Defamation [article],"Zillman, Donald N. (Cited 364 times)",73,"Anglo-American Law Review, Vol. 9, Issue 4 (1980), pp. 316-330",9 Anglo-Am. L. Rev. 316 (1980),Defamation,4,na,2
"Controlling Boomtown Development: Lessons from the Intermountain Power Project, Part One [article]","Zillman, Donald (Cited 364 times)",73,"Land and Water Law Review, Vol. 21, Issue 1 (1986), pp. 1-32",21 Land & Water L. Rev. 1 (1986),"Compensation, Police",4,na,na
The University of Utah College of Law: An Analytical History [article],"Zillman, Donald N. (Cited 364 times)",73,"Journal of Contemporary Law, Vol. 10, pp. 141-202",10 J. Contemp. L. 141 (1984),"History, Education Law",3,na,10
Prisoners in the Bangladesh War: Humanitarian Concerns and Political Demands [article],"Zillman, Donald N. (Cited 364 times)",73,"International Lawyer (ABA), Vol. 8, Issue 1 (January 1974), pp. 124-135",8 Int'l L. 124 (1974),"Prisoners, War, Repatriation",3,na,4
A Bicentennial View of Military--Civilian Relations [article],"Zillman, Donald N. (Cited 364 times)",73,"Military Law Review, Vol. 120, pp. 1-18",120 Mil. L. Rev. 1 (1988),"Education Law, Legal Education, Legal Profession, Military, War and Peace",3,na,1
"In-Service Conscientious Objection: Courts, Boards and the Bias in Fact [article]","Zillman, Donald N. (Cited 364 times)",73,"San Diego Law Review, Vol. 10, Issue 1 (December 1972), pp. 108-142",10 San Diego L. Rev. 108 (1972-1973),"Courts, Habeas Corpus, Conscientious Objectors",3,na,na
Wisconsin Juvenile Rights after Gault [comments],"Zillman, Donald N. (Cited 364 times)",73,"Wisconsin Law Review, Vol. 1968, Issue 4 (1968), pp. 1219-1236",1968 Wis. L. Rev. 1219 (1968),"Courts, Due Process, Juvenile Courts, Children, Confessions, Juveniles",3,na,na
Introduction [comments],"Cluchey, David P. (Cited 20 times); Zillman, Donald N. (Cited 364 times)",73,"Journal of Energy & Natural Resources Law, Vol. 12, Issue 1 (February 1994), pp. 1-3",12 J. Energy & Nat. Resources L. 1 (1994),"Natural Resources Law, Trade Regulation",3,na,na
The Common Law of Access and Surface Use in Mining [article],"Zillman, Donald N. (Cited 364 times); Tyler, J. Russell Jr. (Cited 2 times)",73,"Journal of Mineral Law & Policy, Vol. 1, Issue 2 (1985-1986), pp. 267-298",1 J. Min. L. & Pol'y 267 (1985-1986),"Common Law, Compensation, Solar Energy",2,2,4
Energy Trade and the National Security Exception to the GATT [article],"Zillman, Donald N. (Cited 364 times)",73,"Journal of Energy & Natural Resources Law, Vol. 12, Issue 1 (February 1994), pp. 117-127",12 J. Energy & Nat. Resources L. 117 (1994),"National Security, International Trade",2,na,27
Political Uses of Prisoners of War [article],"Zillman, Donald N. (Cited 364 times)",73,"Arizona State Law Journal, Vol. 1975, Issue 2 (1975), pp. 237-274",1975 Ariz. St. L.J. 237 (1975),"Prisoners, War, States",2,na,8
Energy Law: Defining a Discipline [article],"Zillman, Don (Cited 364 times)",73,"Journal of Energy Law and Policy, Vol. 1, pp. 3-16",1 J. Energy L. & Pol'y 3 (1980),"Discipline, Public Utilities Law, States, Utilities, Conservation",2,na,1
Military Criminal Jurisdiction in the United States [notes],"Zillman, Donald N. (Cited 364 times)",73,"University of Western Australia Law Review, Vol. 20, Issue 1 (1990), pp. 6-33",20 U.W. Austl. L. Rev. 6 (1990),"Jurisdiction, States",2,na,1
What Military Criminal Law Can Teach Us: A United States Perspective [comments],"Zillman, Donald N. (Cited 364 times)",73,"University of New Brunswick Law Journal, Vol. 42, pp. 229-236",42 U.N.B.L.J. 229 (1993),"Criminal Law, States, Punishment, Courts",2,na,1
"Controlling Boomtown Development: Lessons from the Intermountain Power Project, Part Two [article]","Zillman, Donald (Cited 364 times)",73,"Land and Water Law Review, Vol. 21, Issue 2 (1986), pp. 325-356",21 Land & Water L. Rev. 325 (1986),"Employment, Public Contracts, Public Works, Banking, Foreign Investment, International Loans, Investment, Legislation, Taxation: International",2,na,na
"The University of Utah College of Law: An Analytical History, Part II [article]","Zillman, Donald N. (Cited 364 times)",73,"Journal of Contemporary Law, Vol. 11, Issue 1 (1984), pp. 131-218",11 J. Contemp. L. 131 (1984-1985),"History, Biography, Legal Education",1,na,6
Evolution of Modern Energy Law: A Personal Retrospective [notes],"Zillman, Donald N. (Cited 364 times)",73,"Journal of Energy and Natural Resources Law, Vol. 30, Issue 4 (December 2012), pp. 485-496",30 J. Energy & Nat. Resources L. 485 (2012),"Environmental Law, History, Schools, States, Discipline",1,na,3
The Court of Military Appeals: A Survey of Recent Decisions [comments],"Buescher, Stephen L. (Cited 2 times); Zillman, Donald N. (Cited 364 times)",73,"Military Law Review, Vol. 59, pp. 129-176",59 Mil. L. Rev. 129 (1973),"Appeals, States, Voir Dire",1,na,2
The Court of Military Appeals: A Survey of Recent Decisions [comments],"Buescher, Stephen L. (Cited 2 times); Zillman, Donald N. (Cited 364 times)",73,"Military Law Review, Vol. 55, pp. 187-246",55 Mil. L. Rev. 187 (1972),"Appeals, Jurisdiction, Constitutional Law",1,na,1
Veterans Law Symposium: Introduction [comments],"Zillman, Donald N. (Cited 364 times)",73,"Maine Law Review, Vol. 46, Issue 1 (1994), pp. 1-4",46 Me. L. Rev. 1 (1994),"Veterans' Law, Veterans' Law",1,na,1
Tort Liability of Military Officers: An Initial Examination of Chappell [article],"Zillman, Don (Cited 364 times)",73,"Army Lawyer, Vol. 1983, Issue 8 (August 1983), pp. 29-46",1983 Army Law. 29 (1983),"Liability, Torts, Immunity",1,na,na
The United States [article],"Zillman, Donald N. (Cited 364 times); Smith, Ernest (Cited 296 times)",73,"Journal of Energy & Natural Resources Law, Vol. 10, Issue 1 (1992), pp. 46-58",10 J. Energy & Nat. Resources L. 46 (1992),"States, Reclamation, Surface Mining",1,na,na
2014: An Eventful Year for Energy Law and Policy [article],"Zillman, Donald (Cited 364 times); Lucas, Alastair (Cited 2 times); Beirne, Simon (Cited 1 times)",73,"Journal of Energy and Natural Resources Law, Vol. 33, Issue 1 (February 2015), pp. 82-106",Full Text Not Currently Available in HeinOnline,"Environmental Law, Natural Resources Law, Wind Energy",na,na,na
Armed Services [article],"Zillman, Donald N. (Cited 364 times)",73,"Mercer Law Review, Vol. 23, Issue 3 (Summer 1972), pp. 741-758",23 Mercer L. Rev. 741 (1972),"Armed Services, Judicial Review, Military Law",1,na,na
Armed Services [article],"Zillman, Donald N. (Cited 364 times)",73,"Mercer Law Review, Vol. 24, Issue 3 (Summer 1973), pp. 723-734",24 Mercer L. Rev. 723 (1973),"Armed Services, Military Law",1,na,na
Living the World War - A Retrospective [notes],"Zillman, Donald (Cited 364 times); Elsbach, Elizabeth",73,"Maine Law Review, Vol. 70, Issue 2 (2018), pp. 211-234",70 Me. L. Rev. 211 (2017-2018),"Legal History, Military, War and Peace, War, Arbitration, Dispute Resolution, Legislation",na,na,7
Innovative Regulation for Energy and Resources [article],"Gulliver, John; Zillman, Donald (Cited 364 times)",73,"Journal of Energy & Natural Resources Law , Vol. 24, Issue 3 (August 2006), pp. 315-354",24 J. Energy Nat. Resources L. 315 (2006),"Regulation, Environmental Law, States",na,na,4
The British National Oil Corporation: The State Enterprise as Instrument of Energy Policy [article],"Forster, Malcolm (Cited 1 times); Zillman, Donald N. (Cited 364 times)",73,"Journal of Energy Law and Policy, Vol. 3, Issue 1 (1982), pp. 57-112",3 J. Energy L. & Pol'y 57 (1982-1983),"Oil, Gas, and Mineral Law, Environmental Law, Industry, Corporations, Petroleum",na,na,3
Geothermal Energy and National Energy Policy [article],"Zillman, Donald N. (Cited 364 times); Naumann, Steven",73,"Natural Resources Lawyer, Vol. 14, Issue 4 (1982), pp. 589-612",14 Nat. Resources Law. 589 (1981-1982),"Discipline, Easements, Solar Energy, United Nations",na,na,3
Government Liability for Seismic Hazards in Utah [article],"Zillman, Donald N. (Cited 364 times)",73,"Journal of Energy, Natural Resources, & Environmental Law, Vol. 11, Issue 1 (1990), pp. 69-96",11 J. Energy Nat. Resources & Envtl. L. 69 (1990-1991),"Government, Government Liability, Liability, Confidentiality",na,na,2
The Impact on Communities and Legal Problems of Major Energy Developments in the United States [article],"Zillman, Donald N. (Cited 364 times); Solomon, Sharon",73,"University of Western Australia Law Review, Vol. 15, pp. 64-84",15 U.W. Austl. L. Rev. 64 (1983),"States, Victims, Government, Local Government",na,na,2
Law of Public Participation in Global Energy and Resources Development: A New IBA Book [article],"Pring, George (Cited 35 times); Zillman, Donald N. (Cited 364 times); Lucas, Alastair R. (Cited 110 times)",73,"Journal of Energy & Natural Resources Law, Vol. 20, Issue 1 (February 2002), pp. 79-83",20 J. Energy & Nat. Resources L. 79 (2002),"Social Welfare Law, Environmental Law, Environmental Law",na,na,1
The Role of State Government in Nuclear Power Regulation: Jurisdictional Conflicts in the US [article],"Zillman, Donald N. (Cited 364 times)",73,"Journal of Energy & Natural Resources Law, Vol. 16, Issue 1 (February 1998), pp. 16-29",16 J. Energy & Nat. Resources L. 16 (1998),"Government, Regulation, State Government, Damages, Waste Disposal",na,na,1
"Home Court Advantage: Protecting the Domestic Uranium Industry, The (87-645) [article]","Zillman, Donald N. (Cited 364 times)",73,"Preview of United States Supreme Court Cases, Vol. 1987-1988, Issue 14 (May 27, 1988), pp. 432-434",1987-1988 Preview U.S. Sup. Ct. Cas. 432 (1987-1988),"Industry, Atomic Energy Law, Atomic Energy Law, Statutory Construction, Mineral Law",na,na,na
"Federal Court Challenge to Reservists Involuntary Activation: Mellinger V. Laird, 339 F Supp 434 (ED PA 1972) [article]","Zillman, Donald (Cited 364 times)",73,"Army Lawyer, Vol. 1972, Issue 10 (October 1972), pp. 6-8",1972 Army Law. 6 (1972),"Health, Mental Health, Water Law, Endangered Species, States",na,na,na
The Brave New World of Energy and Natural Resources Development [article],"Zillman, Donald N. (Cited 364 times); Smith, Don C. (Cited 6 times)",73,"Journal of Energy and Natural Resources Law, Vol. 37, Issue 1 (February 2019), pp. 3-46",Full Text Not Currently Available in HeinOnline,"Natural Resources Law, Environmental Law, International Law: History",na,na,na
State Competence in United States Natural Gas Regulation [notes],"Zillman, Donald (Cited 364 times)",73,"Journal of Energy & Natural Resources Law, Vol. 7, Issue 4 (1989), pp. 293-295",7 J. Energy & Nat. Resources L. 293 (1989),"Natural Gas, Regulation, States, Conflict of Laws, Oil, Gas, and Mineral Law",na,na,na
Death at Early Middle Age: Reflections on the Future of Nuclear Energy in the United States [article],"Zillman, Donald (Cited 364 times)",73,"Journal of Energy & Natural Resources Law, Vol. 7, Issue 1 (1989), pp. 34-41",7 J. Energy & Nat. Resources L. 34 (1989),"Age, Death, Nuclear Energy, States, Industry, Atomic Energy Law, Atomic Energy Law, Statutory Construction",na,na,na
Law School News [notes],"Zillman, Donald N. (Cited 364 times)",73,"Maine Bar Journal, Vol. 8, Issue 6 (November 1993), pp. 356-359",8 Maine B.J. 356 (1993),"History, Courts, Probate Law, Bar Associations",na,na,na
Recent Utah Tort Developments [article],"Zillman, Donald N. (Cited 364 times); Gentles, Peggy (Cited 18 times)",73,"Utah Bar Journal, Vol. 3, Issue 1 (January 1990), pp. 13-20",3 Utah B.J. (2d ser.) 13 (1990),"Costs, Medical Jurisprudence, Pregnancy, Torts, Damages, Hospitals",na,na,na
Ed Godrey and the University of Maine School of Law [comments],"Zillman, Donald N. (Cited 364 times)",73,"Maine Law Review, Vol. 47, Issue 2 (1995), pp. 321-322",47 Me. L. Rev. 321 (1995),"Judicial Review, Judges",na,na,na
