Title,Author(s),ID,Journal,BBCite,Topics,Cited (articles),Cited (cases),Accessed
The Piracy and Paradox: Innovation and Intellectual Property in Fashion Design [article],"Raustiala, Kal (Cited 1036 times); Sprigman, Christopher (Cited 919 times)",759,"Virginia Law Review, Vol. 92, Issue 8 (December 2006), pp. 1687-1778",92 Va. L. Rev. 1687 (2006),"Intellectual Property Law, Intellectual Property Law, Congress",255,2,416
The Architecture of International Cooperation: Transgovernmental Networks and the Future of International Law [article],"Raustiala, Kal (Cited 1036 times)",759,"Virginia Journal of International Law, Vol. 43, Issue 1 (Fall 2002), pp. 1-92",43 Va. J. Int'l L. 1 (2002-2003),"International Law: History, Age, Philosophy",229,na,274
The Geography of Justice [article],"Raustiala, Kal (Cited 1036 times)",759,"Fordham Law Review, Vol. 73, Issue 6 (May 2005), pp. 2501-2560",73 Fordham L. Rev. 2501 (2004-2005),"Jurisdiction, Military Law, Aliens, Courts, Cuba, Federal Courts, Habeas Corpus, States, Writs, Jurisprudence",100,1,29
Compliance &(and) Effectiveness in International Regulatory Cooperation [article],"Raustiala, Kal (Cited 1036 times)",759,"Case Western Reserve Journal of International Law, Vol. 32, Issue 3 (Summer 2000), pp. 387-440",32 Case W. Res. J. Int'l L. 387 (2000),"Administration Law, Environmental Law, Environmental Law, Procedure",86,na,131
The Participatory Revolution in International Environmental Law [notes],"Raustiala, Kal (Cited 1036 times)",759,"Harvard Environmental Law Review, Vol. 21, Issue 2 (1997), pp. 537-586",21 Harv. Envtl. L. Rev. 537 (1997),"Environmental Law, International Law: History, Revolution, Dispute Resolution, Environmental Law, World Trade Organization",52,na,170
Rethinking the Sovereignty Debate in International Economic Law [article],"Raustiala, Kal (Cited 1036 times)",759,"Journal of International Economic Law , Vol. 6, Issue 4 (December 2003), pp. 841-878",Full Text Not Currently Available in HeinOnline,"Economics, International Economic Law, Politics, Sovereignty, Diplomacy",na,na,na
The Piracy Paradox Revisited [notes],"Raustiala, Kal (Cited 1036 times); Sprigman, Christopher (Cited 919 times)",759,"Stanford Law Review , Vol. 61, Issue 5 (March 2009), pp. 1201-1226",61 Stan. L. Rev. 1201 (March 2009),"Intellectual Property Law, Copyright",38,na,46
Density and Conflict in International Intellectual Property Law [comments],"Raustiala, Kal (Cited 1036 times)",759,"U.C. Davis Law Review, Vol. 40, Issue 3 (March 2007), pp. 1021-1038",40 U.C. Davis L. Rev. 1021 (2006-2007),"Intellectual Property Law, Intellectual Property Law, Property Law, Human Rights Law, Developing Countries",38,na,54
The Political Implications of the Enforcement Provisions of the NAFTA Environmental Side Agreement: The CEC as a Model for Future Accords [article],"Raustiala, Kal (Cited 1036 times)",759,"Environmental Law, Vol. 25, Issue 1 (Winter 1995), pp. 31-56",25 Envtl. L. 31 (1995),"Environmental Law, Regulation, International Law: History, Organizations",31,na,12
Sovereignty and Multilateralism [article],"Raustiala, Kal (Cited 1036 times)",759,"Chicago Journal of International Law, Vol. 1, Issue 2 , pp. 401-420",1 Chi. J. Int'l. L. 401 (2000),"Sovereignty, Economics, International Economic Law, Politics",30,na,53
The Uneasy Case for Intellectual Property Rights in Traditional Knowledge [article],"Munzer, Stephen R. (Cited 519 times); Raustiala, Kal (Cited 1036 times)",759,"Cardozo Arts & Entertainment Law Journal, Vol. 27, Issue 1 (2009), pp. 37-98",27 Cardozo Arts & Ent. L.J. 37 (2009-2010),"Indian Law, Intellectual Property Law, Intellectual Property Law, Property Law, Industrial and Intellectual Property, International Trade",26,na,81
"Law, liberalization & International Narcotics Trafficking [article]","Raustiala, Kal (Cited 1036 times)",759,"New York University Journal of International Law and Politcs, Vol. 32, Issue 1 (Fall 1999), pp. 89-146",32 N.Y.U. J. Int'l L. & Pol. 89 (1999-2000),"International Law: History, Narcotics, Health, Health Law, Human Rights Law, Criminal Law, Law Enforcement",19,na,34
The Global Struggle over Geographic Indications [article],"Raustiala, Kal (Cited 1036 times); Munzer, Stephen R. (Cited 519 times)",759,"European Journal of International Law , Vol. 18, Issue 2 (2007), pp. 337-366",Full Text Not Currently Available in HeinOnline,"Agriculture Law, Industrial and Intellectual Property, Intellectual Property Law, International Trade, Trademarks, Intellectual Property Law, International Law: History, Property Law, Comparative Law",na,na,na
Police Patrols & (and) Fire Alarms in the NAAEC [article],"Raustiala, Kal (Cited 1036 times)",759,"Loyola of Los Angeles International and Comparative Law Review, Vol. 26, Issue 3 (Spring 2004), pp. 389-414",26 Loy. L.A. Int'l & Comp. L. Rev. 389 (2003-2004),"International Trade, Police, Environmental Law, Organizations",18,na,9
Refining the Limits of International Law [article],"Raustiala, Kal (Cited 1036 times)",759,"Georgia Journal of International and Comparative Law, Vol. 34, Issue 2 (2006), pp. 423-444",34 Ga. J. Int'l & Comp. L. 423 (2005-2006),"International Law: History, Jurisprudence, Law and Society",16,na,11
Domestic Institutions and International Regulatory Cooperation: Comparative Responses to the Convention on Biological Diversity [article],"Raustiala, Kal (Cited 1036 times)",759,"World Politics, Vol. 49, Issue 4 (July 1997), pp. 482-509",49 World Pol. 482 (1996-1997),Biodiversity,14,na,16
"The Rise of Transnational Networks Conference - November 7, 2008 - Transnational Networks: Past and Present [article]","Raustiala, Kal (Cited 1036 times)",759,"International Lawyer (ABA), Vol. 43, Issue 1 (Spring 2009), pp. 205-210",43 Int'l Law. 205 (2009),"International Law: History, States, Banking, Regulation",4,na,9
Empire and Extraterritoriality in Twentieth Century America [article],"Raustiala, Kal (Cited 1036 times)",759,"Southwestern Law Review, Vol. 40, Issue 4 (2011), pp. 605-616",40 Sw. L. Rev. 605 (2010-2011),"Military, War and Peace, Legal History, Rico",3,na,25
Fake it till You Make It: The Good News about China's Knockoff Economy [comments],"Raustiala, Kal (Cited 1036 times); Sprigman, Christopher (Cited 919 times)",759,"Foreign Affairs, Vol. 92, Issue 4 (July/August 2013), pp. 25-[iii]",92 Foreign Aff. 25 (2013),"Music, Intellectual Property Law, States, Intellectual Property Law, Property Law",2,na,146
Governing the Internet [comments],"Raustiala, Kal (Cited 1036 times)",759,"American Journal of International Law, Vol. 110, Issue 3 (July 2016), pp. 491-503",110 Am. J. Int'l L. 491 (2016),Internet,2,na,33
The Council and the Court: Law and Politics in the Rise of the International Criminal Court [reviews],"Kaye, David (Cited 38 times); Raustiala, Kal (Cited 1036 times)",759,"Texas Law Review, Vol. 94, Issue 4 (March 2016), pp. 713-742",94 Tex. L. Rev. 713 (2015-2016),"Criminal Law, International Criminal Court, International Law: History, Politics, Children, Human Rights Law, Juveniles, Evidence",1,na,18
Al Maqaleh v. Gates [notes],"Raustiala, Kal (Cited 1036 times)",759,"American Journal of International Law, Vol. 104, Issue 4 (October 2010), pp. 647-653",104 Am. J. Int'l L. 647 (2010),"Habeas Corpus, Constitutional Law, Military, War and Peace, Sentencing",1,na,na
A Comparative Look at Extraterritoriality: Bagram and Beyond: Remarks [comments],"Raustiala, Kal (Cited 1036 times)",759,"American Society of International Law Proceedings, Vol. 104, pp. 103-105",104 Am. Soc'y Int'l L. Proc. 103 (2010),"International Law: History, Habeas Corpus, Criminal Law, Military, War and Peace",na,na,3
An Introduction: International Law in a Multipolar World [comments],"Alexandrov, Stanimir (Cited 2 times); de Chazournes, Laurence Boisson (Cited 56 times); Raustiala, Kal (Cited 1036 times)",759,"American Society of International Law Proceedings, Vol. 107, pp. 1-2",107 Am. Soc'y Int'l L. Proc. 1 (2013),"International Law: History, Globalization, Human Rights Law, International Economic Law, International Trade, Government Contracts, Partnerships, Rule of Law, Sovereignty",na,na,4
An Internet Whole and Free: Why Washington Was Right to Give up Control [comments],"Raustiala, Kal (Cited 1036 times)",759,"Foreign Affairs, Vol. 96, Issue 2 (March/April 2017), pp. 140-149",96 Foreign Aff. 140 (2017),Internet,na,na,46
Rethinking Post-Sale Confusion [comments],"Raustiala, Kal (Cited 1036 times); Sprigman, Christopher Jon (Cited 919 times)",759,"The Trademark Reporter, Vol. 108, Issue 3 (May-June 2018), pp. 881-903",108 Trademark Rep. 881 (2018),"Commercial Law, Criminal Law, Intellectual Property Law, Appeals",na,na,35
Introductory Remarks [comments],"Raustiala, Kal (Cited 1036 times)",759,"American Society of International Law Proceedings, Vol. 105, pp. 393-394",105 Am. Soc'y Int'l L. Proc. 393 (2011),"International Law: History, Rico, Securities Law, Corporations, Interest",na,na,5
