Title,Author(s),ID,Journal,BBCite,Topics,Cited (articles),Cited (cases),Accessed
Anchor Babies: Something less than Equal under the Equal Protection Clause [article],"Hernandez, Laura A. (Cited 8 times)",906,"Southern California Review of Law and Social Justice, Vol. 19, Issue 3 (Summer 2010), pp. 331-376",19 S. Cal. Rev. L. & Soc. Just. 331 (2010),"Equal Protection, Fourteenth Amendment, Housing Law, Immigration Law, Children, Education Law, Parents and Children, Tuition, Gender",7,na,27
Dreams Deferred - Why In-State College Tuition Rates are Not a Benefit under the IIRIRA and How This Interpretation Violates the Spirit of Plyler [article],"Hernandez, Laura A. (Cited 8 times)",906,"Cornell Journal of Law and Public Policy, Vol. 21, Issue 3 (Spring 2012), pp. 525-566",21 Cornell J. L. & Pub. Pol'y 525 (Spring 2012),"Education Law, Immigration Law, Tuition, Immigrants, Statutes, Students",1,na,19
Separate and Legally Unequal - How the Demonization of Immigrant Affects United States Policy [article],"Hernandez, Laura A. (Cited 8 times)",906,"Duke Forum for Law and Social Change, Vol. 9, pp. 1-20",9 Duke F. L. & Soc. Change 1 (2017),"States, Government, First Amendment, Religion",na,na,17
The Constitutional Limits of Supply and Demand: Why a Successful Guest Worker Program Must Include a Path to Citizenship [article],"Hernandez, Laura A. (Cited 8 times)",906,"Stanford Journal of Civil Rights & Civil Liberties, Vol. 10, Issue 2 (June 2014), pp. 251-292",10 Stan. J. C.R. & C.L. 251 (2014),"Citizenship, Immigration Law, Labor, States",na,na,16
When the Wise Latina Judge Meets a Living Constitution - Why It is a Matter of Perspective [article],"Hernandez, Laura A. (Cited 8 times)",906,"Texas Hispanic Journal of Law & Policy, Vol. 17, pp. 53-98",17 Tex. Hisp. J. L. & Pol'y 53 (2011),"Judges, Race, History, Race, Sex, Jurisprudence, Politics",na,na,15
