Title,Author(s),ID,Journal,BBCite,Topics,Cited (articles),Cited (cases),Accessed
Patents and the Regulatory State: Rethinking the Patent Bargain Metaphor after Eldred [article],"Ghosh, Shubha (Cited 680 times)",900,"Berkeley Technology Law Journal, Vol. 19, Issue 4 (Fall 2004), pp. 1315-1388",19 Berkeley Tech. L.J. 1315 (2004),"Intellectual Property Law, Intellectual Property Law, Regulation, Economics",67,na,23
What Do Patents Purchase - In Search of Optimal Ignorance in the Patent Office [article],"Ghosh, Shubha (Cited 680 times); Kesan, Jay (Cited 1223 times)",900,"Houston Law Review, Vol. 40, Issue 5 (Spring 2004), pp. 1219-1264",40 Hous. L. Rev. 1219 (2003-2004),"Intellectual Property Law, Statistics",55,na,7
Deprivatizing Copyright [article],"Ghosh, Subha (Cited 680 times)",900,"Case Western Reserve Law Review, Vol. 54, Issue 2 (Winter 2003), pp. 387-502",54 Case W. Res. L. Rev. 387 (2003-2004),"Copyright, Intellectual Property Law, Jurisprudence, Law and Society, Politics, Computer Law, Licensing",48,na,29
The Functions of Transaction Costs: Rethinking Transaction Cost Minimization in a World of Friction [article],"Driesen, David M. (Cited 822 times); Ghosh, Shubha (Cited 680 times)",900,"Arizona Law Review, Vol. 47, Issue 1 (2005), pp. 61-112",47 Ariz. L. Rev. 61 (2005),"Costs, Economics, Commitment, Intellectual Property Law, Intellectual Property Law",46,1,14
An Economic Analysis of the Common Control Exception to Gray Market Exclusion [article],"Ghosh, Shubha (Cited 680 times)",900,"University of Pennsylvania Journal of Internatonal Business Law, Vol. 15, Issue 3 (Fall 1994), pp. 373-440",15 U. Pa. J. Int'l Bus. L. 373 (1994-1995),"Economics, Trade Regulation, Intellectual Property Law, International Trade, Plain Language",34,1,na
Toward a Theory of Regulatory Takings for Intellectual Property: The Path Left Open after College Savings v. Florida Prepaid [article],"Ghosh, Shubha (Cited 680 times)",900,"San Diego Law Review, Vol. 37, Issue 3 (Summer 2000), pp. 637-710",37 San Diego L. Rev. 637 (2000),"Constitutional Law, Intellectual Property Law, Intellectual Property Law, Takings, Age, Federalism, States",32,1,22
"Globalization, Patents, and Traditional Knowledge [article]","Ghosh, Shubha (Cited 680 times)",900,"Columbia Journal of Asian Law, Vol. 17, Issue 1 (Fall 2003), pp. 73-120",17 Colum. J. Asian L. 73 (2003-2004),"Globalization, Intellectual Property Law, International Trade, Patents, Copyrights and Trademarks, Intellectual Property Law, Property Law",26,na,142
"The Merits of Ownership; or, How I Learned to Stop Worrying and Love Intellectual Property Review Essay of Lawrence Lessig, The Future of Ideas, and Siva Vaidhyanathan, Copyrights and Copywrongs [article]","Ghosh, Shubha (Cited 680 times)",900,"Harvard Journal of Law & Technology, Vol. 15, Issue 2 (Spring 2002), pp. 453-496",15 Harv. J. L. Tech 453 (2001-2002),"Intellectual Property Law, Intellectual Property Law, Ownership, Property Law, Computer Law, Revolution",23,na,9
"Pills, Patents, and Power: State Creation of Gray Markets as a Limit on Patent Rights [article]","Ghosh, Shubha (Cited 680 times)",900,"Florida Law Review, Vol. 53, Issue 4 (September 2001), pp. 789-830",53 Fla. L. Rev. 789 (2001),"Intellectual Property Law, International Trade, Copyright, Trade Regulation",22,na,7
"Race-Specific Patents, Commercialization, and Intellectual Property Policy [article]","Ghosh, Shubha (Cited 680 times)",900,"Buffalo Law Review, Vol. 56, Issue 2 (May 2008), pp. 409-494",56 Buff. L. Rev. 409 (2008),"Intellectual Property Law, Intellectual Property Law, Race, Research, Medical Jurisprudence",20,na,26
"Decoding and Recoding Natural Monopoly, Deregulation, and Intellectual Property [article]","Ghosh, Shubha (Cited 680 times)",900,"University of Illinois Law Review, Vol. 2008, Issue 4 (2008), pp. 1125-1184",2008 U. Ill. L. Rev. 1125 (2008),"Deregulation, Intellectual Property Law",20,na,17
Copyright as Privatization: The Case of Model Codes [article],"Ghosh, Shubha (Cited 680 times)",900,"Tulane Law Review, Vol. 78, Issue 3 (February 2004), pp. 653-726",78 Tul. L. Rev. 653 (2003-2004),"Copyright, Legal Analysis and Writing, Legislation, Privatization, Intellectual Property Law, Government",19,na,15
Gray Markets in Cyberspace [article],"Ghosh, Shubha (Cited 680 times)",900,"Journal of Intellectual Property Law, Vol. 7, Issue 1 (Fall 1999), pp. 1-56",7 J. Intell. Prop. L. 1 (1999-2000),"Commercial Law, Computer Law, Jurisdiction",18,na,6
The Fable of the Commons: Exclusivity and the Construction of Intellectual Property Markets [article],"Ghosh, Shubha (Cited 680 times)",900,"U.C. Davis Law Review, Vol. 40, Issue 3 (March 2007), pp. 855-890",40 U.C. Davis L. Rev. 855 (2006-2007),"Intellectual Property Law, Copyright, Jurisprudence, Law and Society",18,na,5
"Pills, Patents, and Power: State Creation of Gray Markets as a Limit on Patent Rights [article]","Ghosh, Shubha (Cited 680 times)",900,"Florida Journal of International Law, Vol. 14, Issue 2 (Spring 2002), pp. 217-260",14 Fla. J. Int'l L. 217 (2001-2002),"Intellectual Property Law, Intellectual Property Law, International Trade, Plain Language",17,na,4
"Traditional Knowledge, Patents, and the New Mercantilism (Part II) [article]","Ghosh, Shubha (Cited 680 times)",900,"Journal of the Patent and Trademark Office Society, Vol. 85, Issue 11 (November 2003), pp. 885-924",85 J. Pat. & Trademark Off. Soc'y 885 (2003),"Biotechnology, Genetics, Industrial and Intellectual Property, Intellectual Property Law, Intellectual Property Law, Property Law, Indian Law",17,na,38
"Protection and Enforcement of Well-Known Mark Rights in China: History, Theory and Future [article]",na,900,"Northwestern Journal of Technology and Intellectual Property, Vol. 7, Issue 2 (Spring 2009), pp. 119-161",7 Nw. J. Tech. & Intell. Prop. 119 (2008-2009),"History, Corporations, International Trade, Multinational Corporations, Trademarks, Intellectual Property Law",12,na,10
"Carte Blanche, Quanta, and Competition Policy [article]","Ghosh, Shubha (Cited 680 times)",900,"Journal of Corporation Law, Vol. 34, Issue 4 (Summer 2009), pp. 1209-1242",34 J. Corp. L. 1209 (2008-2009),"Trade Regulation, Intellectual Property Law, Antitrust, Industrial and Intellectual Property, Intellectual Property Law, Property Law",11,na,1
"On Bobbling Heads, Paparazzi, and Justice Hugo Black [article]","Ghosh, Shubha (Cited 680 times)",900,"Santa Clara Law Review, Vol. 45, Issue 3 (2005), pp. 617-650",45 Santa Clara L. Rev. 617 (2004-2005),"Publicity, Right of Publicity, Constitutional Law, First Amendment",10,na,5
The Morphing of Poperty Rules and Liability Rules: An Intellectual Property Optimist Examines Article 9 and Bankruptcy [article],"Ghosh, Shubha (Cited 680 times)",900,"Fordham Intellectual Property, Media & Entertainment Law Journal, Vol. 8, Issue 1 (Autumn 1997), pp. 99-172",8 Fordham Intell. Prop. Media & Ent. L.J. 99 (1997-1998),"Bankruptcy Law, Intellectual Property Law, Liability, Assignments, Security Interests",10,na,5
Reflections on the Traditional Knowledge Debate [article],"Ghosh, Shubha (Cited 680 times)",900,"Cardozo Journal of International and Comparative Law, Vol. 11, Issue 2 (Summer 2003), pp. 497-510",11 Cardozo J. Int'l & Comp. L. 497 (2003-2004),"Globalization, Intellectual Property Law, International Trade, Patents, Copyrights and Trademarks, International Law: History",9,na,50
Predatory Conduct and Predatory Legislation: Exclusionary Tactics in Airline Markets [article],"Ghosh, Shubha (Cited 680 times); Bush, Darren (Cited 201 times)",900,"Houston Law Review , Vol. 45, Issue 2 (2008), pp. 343-394",45 Hous. L. Rev. 343 (2008-2009),"Legislation, Antitrust, Trade Regulation",9,na,5
Exclusivity - The Roadblock to Democracy [comments],"Ghosh, Shubha (Cited 680 times)",900,"Saint Louis University Law Journal, Vol. 50, Issue 3 (Spring 2006), pp. 799-828",50 St. Louis U. L.J. 799 (Spring 2006),"Democracy, Intellectual Property Law, Intellectual Property Law, Privatization",8,na,5
Whistling Dixie: The Invalidity and Unconstitutionality of Covenants against Yankees [comments],"Brophy, Alfred L. (Cited 562 times); Ghosh, Shubha (Cited 680 times)",900,"Villanova Environmental Law Journal, Vol. 10, Issue 1 (1999), pp. 57-90",10 Vill. Envtl. L.J. 57 (1999),"Constitutional Law, Covenants, Restrictive Covenants, Antitrust",7,na,na
Turning Gray into Green: Some Comments on Napster [article],"Ghosh, Shubha (Cited 680 times)",900,"Hastings Communications and Entertainment Law Journal (Comm/Ent), Vol. 23, Issue 3 (2000-2001), pp. 563-586",23 Hastings Comm. & Ent. L.J. 563 (2000-2001),"Economics, Computer Law, Copyright, Intellectual Property Law",7,na,2
Where's the Sense in Hill v. Gateway 2000: Reflections on the Visible Hand of Norm Creation [article],"Ghosh, Shubha (Cited 680 times)",900,"Touro Law Review, Vol. 16, Issue 4 (Summer 2000), pp. 1125-1144",16 Touro L. Rev. 1125 (1999-2000),"Law and Society, Liability, Human Rights Law",6,na,5
"Reconciling Property Rights and States' Rights in the Information Age: Federalism, the Sovereign's Prerogative and Takings after College Savings [article]","Ghosh, Shubha (Cited 680 times)",900,"University of Toledo Law Review, Vol. 31, Issue 1 (Fall 1999), pp. 17-54",31 U. Tol. L. Rev. 17 (1999-2000),"Age, Federalism, States, Takings, Constitutional Law, Intellectual Property Law, Intellectual Property Law, Industrial and Intellectual Property, Trade Secrets",6,na,5
"Methods, Conclusions, and the Search for Scientific Validity in Economics and Other Social Sciences [article]","Ghosh, Shubha (Cited 680 times)",900,"Digest: National Italian American Bar Association Law Journal, Vol. 8, pp. 1-30",8 Dig.: Nat'l Italian Am. B. Ass'n L.J. 1 (2000),"Economics, Social Sciences, Adopted Children, Evidence, Science and Technology",6,na,1
Why Intergenerational Equity [comments],"Ghosh, Shubha (Cited 680 times)",900,"Wisconsin Law Review, Vol. 2011, Issue 2 (2011), pp. 103-110",2011 Wis. L. Rev. 103 (2011),"Equity, Comparative Law, Intellectual Property Law, Intellectual Property Law",6,na,23
Beyond Hatch-Waxman [article],"Ghosh, Shubha (Cited 680 times)",900,"Rutgers University Law Review, Vol. 67, Issue 3 (Spring 2015), pp. 779-804",67 Rutgers U. L. Rev. 779 (2015),"Courts, Intellectual Property Law, Antitrust",5,na,12
Legal Code and the Need for a Broader Functionality Doctrine in Copyright [article],"Ghosh, Shubha (Cited 680 times)",900,"Journal of the Copyright Society of the U.S.A., Vol. 50, pp. 71-112",50 J. Copyright Soc'y U.S.A. 71 (2002-2003),"Copyright, Software",5,na,14
"Property Rules, Liability Rules, and Termination Rights: A Fresh Look at the Employment at Will Debate with Applications to Franchising and Family Law [article]","Ghosh, Shubha (Cited 680 times)",900,"Oregon Law Review, Vol. 75, Issue 4 (Winter 1996), pp. 969-1036",75 Or. L. Rev. 969 (1996),"Employment, Employment-At-Will, Family Responsibility/Support Laws, Franchising, Labor, Liability, Age, Employment Practice, Labor",4,na,7
Managing the Intellectual Property Sprawl [article],"Ghosh, Shubha (Cited 680 times)",900,"San Diego Law Review, Vol. 49, Issue 4 (November-December 2012), pp. 979-1032",49 San Diego L. Rev. 979 (2012),"Intellectual Property Law, Comparative Law, Law and Society, Psychiatrists and Psychologists",4,na,6
When Exclusionary Conduct Meets the Exclusive Rights of Intellectual Property: Morris v. PGA Tour and the Limits of Free Riding as an Antitrust Business Justification [article],"Ghosh, Shubha (Cited 680 times)",900,"Loyola University Chicago Law Journal, Vol. 37, Issue 4 (Summer 2006), pp. 723-752",37 Loy. U. Chi. L.J. 723 (2005-2006),"Antitrust, Golf, Intellectual Property Law, Trade Regulation",4,na,6
"Traditional Knowledge, Patents and the New Mechanisms (Part I) [article]","Ghosh, Shubha (Cited 680 times)",900,"Journal of the Patent and Trademark Office Society, Vol. 85, Issue 10 (October 2003), pp. 828-833",85 J. Pat. & Trademark Off. Soc'y 828 (2003),"Globalization, Intellectual Property Law, International Trade, Patents, Copyrights and Trademarks, Intellectual Property Law, Property Law",4,na,9
"The Legal, Economic and Policy Roles of Immigrant Entrepreneurs in the Immigrant Debate [article]","Ghosh, Shubha (Cited 680 times)",900,"UCLA Asian Pacific American Law Journal, Vol. 5, Issue 1 (Spring 1998), pp. 15-44",5 UCLA Asian Pac. Am. L.J. 15 (1998),"Immigration Law, International Trade, Small Businesses, Administration Law, Business Organizations",4,na,2
Patent Law and the Assurance Game: Refitting Intellectual Property in the Box of Regulation [article],"Ghosh, Shubha (Cited 680 times)",900,"Canadian Journal of Law and Jurisprudence, Vol. 18, Issue 2 (July 2005), pp. 307-332",18 Can. J. L. & Jurisprudence 307 (2005),"Intellectual Property Law, Regulation, Intellectual Property Law, Contracts, Law and Society, Violence",4,na,9
Informing and Reforming the Marketplace of Ideas: The Public-Private Model for Data Production and the First Amendment [article],"Ghosh, Shubha (Cited 680 times)",900,"Utah Law Review, Vol. 2012, Issue 2 (2012), pp. 653-706",2012 Utah L. Rev. 653 (2012),"First Amendment, Commercial Law, Health, Identification, Privacy",4,na,4
Convergence [article],"Ghosh, Shubha (Cited 680 times)",900,"Minnesota Journal of Law, Science and Technology, Vol. 15, Issue 1 (Winter 2014), pp. 95-114",15 Minn. J.L. Sci. & Tech. 95 (2014),"Antitrust, Judges, Settlements, Economics, Food and Drug Law, Intellectual Property Law, Trade Regulation",4,na,6
Federal and State Resolutions of the Problem of Daubert and Technical or Other Specialized Knowledge [article],"Ghosh, Shubha (Cited 680 times)",900,"American Journal of Trial Advocacy, Vol. 22, Issue 2 (Fall 1998), pp. 237-266",22 Am. J. Trial Advoc. 237 (1998-1999),"Science and Technology, Courts, Federal Courts",4,na,na
Gandhi & (and) the Life of the Law [article],"Ghosh, Shubha (Cited 680 times)",900,"Syracuse Law Review, Vol. 53, Issue 4 (2003), pp. 1273-1278",53 Syracuse L. Rev. 1273 (2003),"Politics, Jurisprudence, Copyright, Economics, Intellectual Property Law",3,na,5
"Decentering the Consuming Self: Personalized Medicine, Science, and the Market for Lemons [article]","Ghosh, Shubha (Cited 680 times)",900,"Wake Forest Journal of Law & Policy, Vol. 5, Issue 2 (June 2015), pp. 299-338",5 Wake Forest J. L. & Pol'y 299 (2015),"Consumer Protection Law, Medical Jurisprudence, Biotechnology, Food and Drug Law, Health, Intellectual Property Law",3,na,95
Short-Circuiting Contract Law: The Federal Circuit's Contract Law Jurisprudence and IP Federalism [article],"Ghosh, Shubha (Cited 680 times)",900,"Journal of the Patent and Trademark Office Society, Vol. 96, Issue 4 (2014), pp. 536-566",96 J. Pat. & Trademark Off. Soc'y 536 (2014),"Federalism, Jurisprudence, Bankruptcy Law, Commercial Law, Intellectual Property Law, Jurisdiction, Common Law",3,na,5
Patenting Games: Baker v. Selden Revisited [article],"Ghosh, Shubha (Cited 680 times)",900,"Vanderbilt Journal of Entertainment and Technology Law, Vol. 11, Issue 4 (Summer 2009), pp. 871-898",11 Vand. J. Ent. & Tech. L. 871 (2008-2009),"Copyright, Video Games, Intellectual Property Law",3,na,8
FDA Preemption of Drug and Device Labeling: Who Should Decide What Goes on a Drug Label [article],"Valoir, Tamsen (Cited 27 times); Ghosh, Shubha (Cited 680 times)",900,"Health Matrix: Journal of Law-Medicine, Vol. 21, Issue 2 (2011), pp. 555-598",21 Health Matrix 555 (2011),"Jurisdiction, Physicians, Standard of Care, Food and Drug Law, Liability",3,na,7
Against Contractual Authoritarianism [article],"Ghosh, Shubha (Cited 680 times)",900,"Southwestern Law Review, Vol. 44, Issue 2 (2014), pp. 239-250",44 Sw. L. Rev. 239 (2014),"Contracts, War",2,na,7
"Fragmenting Knowledge, Misconstruing Rule 702: How Lower Courts Have Resolved the Problem of Technical and Other Specialized Knowledge in Daubert v. Merrell Dow Pharmaceuticals, Inc. [comments]","Ghosh, Shubha (Cited 680 times)",900,"Chicago-Kent Journal of Intellectual Property, Vol. 1, Issue 1 (Spring 1999), pp. 1-60",1 Chi.-Kent J. Intell. Prop. 1 (1999),"Courts, Science and Technology, Federal Courts",2,na,6
Intellectual Property: American Exceptionalism or International Harmonization [article],"Ghosh, Shubha (Cited 680 times); Kieff, F. Scott (Cited 735 times); Mossoff, Adam (Cited 814 times); Tepp, Steven M. (Cited 2 times)",900,"New York University Journal of Law & Liberty, Vol. 3, Issue 2 (2008), pp. 448-490",3 N.Y.U. J.L. & Liberty 448 (2008),"Intellectual Property Law, Intellectual Property Law, Trade Regulation, Contracts",2,na,9
The Transactional Turn in Intellectual Property [article],"Ghosh, Shubha (Cited 680 times)",900,"University of Dayton Law Review, Vol. 35, Issue 3 (Spring 2010), pp. 329-344",35 U. Dayton L. Rev. 329 (2009-2010),"Intellectual Property Law, Intellectual Property Law, Literature, Bibliographies",2,na,2
"Duty, Consequences, & Intellectual Property [article]","Ghosh, Shubha (Cited 680 times)",900,"University of St. Thomas Law Journal, Vol. 10, Issue 3 (2013), pp. 801-[i]",10 U. St. Thomas L.J. 801 (2012-2013),"Comparative Law, Intellectual Property Law, Dispute Resolution, Religion, Equity",2,na,3
"A Rose Is a Rose Is: The Thorny Case of Morris Communications Corp. v. Professional Golf Association Tour, Inc. [comments]","Ghosh, Shubha (Cited 680 times)",900,"Erasmus Law and Economics Review, Vol. 1, pp. 287-294",1 Erasmus L. & Econ. Rev. 287 (2004),"Golf, Trade Regulation, Intellectual Property Law, Intellectual Property Law, Sports",2,na,1
Dilution and Competition Norms: The Case of Federal Trademark Dilution Claims against Direct Competitors [article],"Ghosh, Shubha (Cited 680 times)",900,"Santa Clara Computer & High Technology Law Journal , Vol. 24, Issue 3 (2007-2008), pp. 571-600",24 Santa Clara Computer & High Tech. L.J. 571 (2007-2008),"Trade Regulation, Intellectual Property Law, Antitrust, Courts, Intellectual Property Law, Property Law",2,na,5
The Market as Instrument: A Response to Professor Harrison [comments],"Ghosh, Shubha (Cited 680 times)",900,"SMU Law Review, Vol. 59, Issue 4 (Fall 2006), pp. 1717-1734",59 S.M.U. L. Rev. 1717 (2006),"Antitrust, Economics, Trade Regulation",2,na,na
Komesar's Razor: Comparative Institutional Analysis in a World of Networks [article],"Ghosh, Shubha (Cited 680 times)",900,"Wisconsin Law Review, Vol. 2013, Issue 2 (2013), pp. 455-480",2013 Wis. L. Rev. 455 (2013),"Courts, Statutes, Economics, Homosexuality, Same-Sex Marriage, Sex, Sex Education",2,na,4
A Court Divided [article],"Ghosh, Shubha (Cited 680 times)",900,"Chicago-Kent Journal of Intellectual Property, Vol. 17, Issue 2 (2018), pp. 346-355",17 Chi.-Kent J. Intell. Prop. 346 (2017-2018),"Software, Economics, Judges, Jurisdiction, Jurisprudence",1,na,5
The Traditional Terms of the Traditional Knowledge Debate [misc],"Ghosh, Shubha (Cited 680 times)",900,"Northwestern Journal of International Law & Business, Vol. 23, Issue 3 (Spring 2003), pp. 589-632",23 Nw. J. Int'l L. & Bus. 589 (2002-2003),na,1,na,1
Razing the Funhouse [article],"Ghosh, Shubha (Cited 680 times)",900,"Florida Law Review Forum, Vol. 64, pp. 23-25",64 Fla. L. Rev. Forum 23 (2012),"Medical Jurisprudence, Physicians, Software, Health, Patents, Copyrights and Trademarks",1,na,na
"Open Borders, the US Economic Espionage Act of 1996, and the Global Movement of Knowledge and People [article]","Ghosh, Shubha (Cited 680 times)",900,"King's Law Journal , Vol. 21, Issue 1 (February 2010), pp. 1-40",21 K.L.J. 1 (2010),"Espionage, Literature",1,na,31
Eli Lilly and the International Investment Law Challenge to a Neo-Federal IP Regime [article],"Yackee, Jason (Cited 336 times); Ghosh, Shubha (Cited 680 times)",900,"Vanderbilt Journal of Entertainment & Technology Law, Vol. 21, Issue 2 (Winter 2018), pp. 517-[viii]",21 Vand. J. Ent. & Tech. L. 517 (2018-2019),"Investment, Licensing, Administration Law, Industrial and Intellectual Property, Intellectual Property Law",1,na,7
Belief - An Essay in Understanding [article],"Ghosh, Shubha (Cited 680 times)",900,"Buffalo Law Review, Vol. 54, Issue 3 (December 2006), pp. 807-832",54 Buff. L. Rev. 807 (December 2006),"Religion, Human Rights Law, Politics",1,na,1
"Law, Technology, and Development: Policy Debates in the New Millennium [article]","Bagchi-Sen, Sharmistha (Cited 1 times); Ghosh, Shubha (Cited 680 times)",900,"Law & Policy, Vol. 27, Issue 1 (January 2005), pp. 1-5",27 Law & Pol'y 1 (2005),"International Law: History, Technology, Economic Development, States",1,na,2
The Sale of Patented Methods: Reconciling on-Sale Bar & Patent Exhaustion Doctrines in Light of in re Kollar & Quanta v. LG [article],"Ghosh, Shubha (Cited 680 times); Divine, Lucas (Cited 1 times)",900,"AIPLA Quarterly Journal, Vol. 39, Issue 3 (Summer 2011), pp. 295-334",39 AIPLA Q. J. 295 (2011),"Commercial Law, Insurance Law, Sales, Software, Licensing",1,na,2
CSI: Aoki [article],"Ghosh, Shubha (Cited 680 times)",900,"UC Davis Law Review, Vol. 45, Issue 5 (June 2012), pp. 1889-1892",45 U.C.D. L. Rev. 1889 (2011-2012),"Social Justice, Biography, Judges, Securities Law",1,na,4
Asking the Nearest Hippie [comments],"Ghosh, Shubba (Cited 680 times)",900,"Michigan Telecommunications and Technology Law Review, Vol. 22, Issue 1 (Fall 2015), pp. 135-142",22 Mich. Telecomm. & Tech. L. Rev. 135 (2015-2016),"Jurisprudence, Ownership",na,na,9
Commercializing Data [article],"Ghosh, Shubha (Cited 680 times)",900,"Elon Law Review, Vol. 3, Issue 2 (February 2012), pp. 195-210",3 Elon L. Rev. 195 (2011-2012),"Commercial Law, First Amendment, Documents",na,na,10
Jurisdiction Stripping of the Federal Circuit [article],"Ghosh, Shubha (Cited 680 times)",900,"Akron Law Review, Vol. 52, Issue 2 (2018), pp. 391-422",52 Akron L. Rev. 391 (2018),"Appeals, Jurisdiction, States, Antitrust, Trade Regulation, Courts, Jurisprudence",na,na,1
Are Universities Special [article],"Ghosh, Shubha (Cited 680 times)",900,"Akron Law Review, Vol. 49, Issue 3 (2016), pp. 671-694",49 Akron L. Rev. 671 (2016),"Intellectual Property Law, Research",na,na,5
"Free Speech, Free Markets & the Death of Trademark Law [article]","Ghosh, Shubha (Cited 680 times)",900,"Journal of National Law University, Delhi, Vol. 5, pp. 61-77",5 J. Nat'l L. U. Delhi 61 (2018),"Death, First Amendment, Economics, Jurisprudence",na,na,30
Peace Song for the Tiger Mother [article],"Ghosh, Shubha (Cited 680 times)",900,"Asian Pacific American Law Journal, Vol. 17, Issue 1 (Fall 2011 - Spring 2012), pp. 45-50",17 UCLA Asian Pac. Am. L.J. 45 (2011-2012),"Education Law, Legal Education, Strikes, International Law: History, Economics",na,na,13
How Specifically Must an Antitrust Plaintiff Plead a Conspiracy in Order to State a Claim (05-1126) [article],"Ghosh, Shubha (Cited 680 times)",900,"Preview of United States Supreme Court Cases, Vol. 34, Issue 3 (November 27, 2006), pp. 134-137",34 Preview U.S. Sup. Ct. Cas. 134 (2006-2007),"Antitrust, Courts, Practice and Procedure",na,na,na
What Is the Legal Standard for Determining When Bidding Is Predatory (05-381) [article],"Ghosh, Shubha (Cited 680 times)",900,"Preview of United States Supreme Court Cases, Vol. 34, Issue 3 (November 27, 2006), pp. 138-142",34 Preview U.S. Sup. Ct. Cas. 138 (2006-2007),"Costs, Antitrust, Trade Regulation, Liability",na,na,na
"Modeling Globalization from the Bottom Up: A Review Essay of John Braithwaite and Peter Drahos, Global Business Regulation [comments]","Ghosh, Shubha (Cited 680 times)",900,"Law & Society Review, Vol. 39, Issue 4 (2005), pp. 965-980",39 Law & Soc'y Rev. 965 (2005),"Globalization, International Trade, Regulation, Banking, Comparative Law, Dispute Resolution",na,na,9
Intellectual Property Rights: The View from Competition Policy [article],"Ghosh, Shubha (Cited 680 times)",900,"Northwestern University Law Review Colloquy, Vol. 103, pp. 344-351",103 Nw. L. Rev. Colloquy 344 (2008-2009),"Intellectual Property Law, Antitrust, Industrial and Intellectual Property, International Trade, Trade Regulation",na,na,3
Relaxing Antitrust during Economic Downturns: A Real Options Analysis of Appalachian Coals and the Failing Firm Defense [article],"Ghosh, Shubha (Cited 680 times)",900,"Antitrust Law Journal, Vol. 68, Issue 1 (2000), pp. 111-124",68 Antitrust L.J. 111 (2000-2001),"Antitrust, Price Fixing, Trade Regulation, Prices",na,na,1
"Open Borders, Intellectual Property & Federal Criminal Trade Secret Law [article]","Ghosh, Shubha (Cited 680 times)",900,"John Marshall Review of Intellectual Property Law, Vol. 9, Issue 1 (2009), pp. [i]-83",9 J. Marshall Rev. Intell. Prop. L. [i] (2009-2010),"Intellectual Property Law, Espionage, Public Policy, Reverse Engineering, Science and Technology, Trade Secrets",na,na,na
Entrepreneurship and Antitrust Enforcement [article],"Ghosh, Shubha (Cited 680 times)",900,"Antitrust Bulletin, Vol. 61, Issue 4 (2016), pp. 595-598",Full Text Not Currently Available in HeinOnline,Antitrust,na,na,na
Marks on Markets and Competition [reviews],"Ghosh, Shubha (Cited 680 times)",900,"Jotwell: The Journal of Things We Like (Lots), Vol. 2013, pp. [275]-[276]",2013 Jotwell: J. Things We Like [275] (2013),"Antitrust, Trademarks",na,na,na
Sheltering the Public Form Intellectual Property [reviews],"Ghosh, Shubha (Cited 680 times)",900,"Jotwell: The Journal of Things We Like (Lots), Vol. 2016, pp. [377]-[378]",2016 Jotwell: J. Things We Like [377] (2016),"Intellectual Property Law, Food and Drug Law, Intellectual Property Law, Shelters, Investment, Property Law",na,na,na
"All's Well That Ends Well, Sort of [reviews]","Ghosh, Shubha (Cited 680 times)",900,"Jotwell: The Journal of Things We Like (Lots), Vol. 2018, pp. 1-2",2018 Jotwell: J. Things We Like 1 (2018),"War, History, Politics",na,na,5
