Title,Author(s),ID,Journal,BBCite,Topics,Cited (articles),Cited (cases),Accessed
Deeply Persistently Conflicted: Credit Rating Agencies in the Current Regulatory Environment [article],"Lynch, Timothy E. (Cited 182 times)",1474,"Case Western Reserve Law Review, Vol. 59, Issue 2 (Winter 2009), pp. 227-304",59 Case W. Res. L. Rev. 227 (2008-2009),"Banking, Credit, Environmental Law, Securities Law, Regulation, Administration Law",37,na,34
The Project of the Harvard Forewords: A Social and Intellectual Inquiry [article],"Tushnet, Mark (Cited 9966 times); Lynch, Timothy (Cited 182 times)",1474,"Constitutional Commentary, Vol. 11, Issue 3 (Winter 1995), pp. 463-500",11 Const. Comment. 463 (Winter 1995),"Constitutional Law, Judges, Jurisprudence, Criminal Procedure, Procedure",26,na,9
In Defense of the Exclusionary Rule [article],"Lynch, Timothy (Cited 182 times)",1474,"Harvard Journal of Law & Public Policy , Vol. 23, Issue 3 (Summer 2000), pp. 711-752",23 Harv. J. L. & Pub. Pol'y 711 (1999-2000),"Criminal Law, Evidence, Exclusionary Rule, Good Faith, Misconduct, Police, States",22,1,5
Derivatives: A Twenty-First Century Understanding [article],"Lynch, Timothy E. (Cited 182 times)",1474,"Loyola University Chicago Law Journal, Vol. 43, Issue 1 (Fall 2011), pp. 1-52",43 Loy. U. Chi. L.J. 1 (2011-2012),"Banking, Bankruptcy Law, Industry",20,na,18
Rethinking the Petty Offense Doctrine [article],"Lynch, Timothy (Cited 182 times)",1474,"Kansas Journal of Law & Public Policy, Vol. 4, Issue 1 (1994-1995), pp. 7-22",4 Kan. J.L. & Pub. Pol'y 7 (1994-1995),"Jury, Constitutional Law, Fraud, Mail, States, Defendants, Right to Jury Trial",19,na,3
Gambling by Another Name; The Challenge of Purely Speculative Derivatives [article],"Lynch, Timothy E. (Cited 182 times)",1474,"Stanford Journal of Law, Business & Finance , Vol. 17, Issue 1 (Fall 2011), pp. 67-130",17 Stan. J.L. Bus. & Fin. 67 (Fall 2011),"Contracts, Gambling, Securities Law, Credit",16,na,15
Individual Rights - Is the Prosecution of Fetal Endangerment Illegitimate [comments],"Lynch, Timothy (Cited 182 times); Grace, Nancy (Cited 7 times)",1474,"ABA Journal, Vol. 82, Issue 12 (December 1996), pp. 72-73",82 A.B.A. J. 72 (1996),"Endangerment, Women, Domestic Relations, Health, Medical Jurisprudence",7,na,na
Dereliction of Duty: The Constitutional Record of President Clinton [article],"Lynch, Timothy (Cited 182 times)",1474,"Capital University Law Review, Vol. 27, Issue 4 (1999), pp. 783-840",27 Cap. U. L. Rev. 783 (1998-1999),"Constitutional Law, Politics, Regulation, Religion",7,na,na
Polluting Our Principles: Environmental Prosecutions and the Bill of Rights [article],"Lynch, Timothy (Cited 182 times)",1474,"Temple Environmental Law & Technology Journal, Vol. 15, Issue 2 (1996), pp. 161-194",15 Temp. Envtl. L. & Tech. J. 161 (1996),"Criminal Law, Jurisdiction, Environmental Law, Sanctions, Revolution",7,na,5
The Case Against Plea Bargaining [article],"Lynch, Timothy (Cited 182 times)",1474,"Regulation, Vol. 26, Issue 3 (Fall 2003), pp. 24-27",26 Regulation 24 (Fall 2003),"Plea Bargaining, Discipline",5,na,29
Coming up Short: The United States' Second-Best Strategies for Corralling Purely Speculative Derivatives [article],"Lynch, Timothy E. (Cited 182 times)",1474,"Cardozo Law Review, Vol. 36, Issue 2 (December 2014), pp. 545-624",36 Cardozo L. Rev. 545 (2014-2015),"States, Contracts, Gambling, Commercial Law, Islamic Law, Religion",4,na,6
Amending Article V to Make the Constitutional Amendment Process Itself Less Onerous [comments],"Lynch, Timothy (Cited 182 times)",1474,"Tennessee Law Review, Vol. 78, Issue 3 (Spring 2011), pp. 823-830",78 Tenn. L. Rev. 823 (2010-2011),"Constitutional Amendment, Congress, Constitutional Law, States, Federalism, Judges, Politics",3,na,14
The Gloves Are Off: States v. Feds [comments],"Lynch, Timothy (Cited 182 times)",1474,"Regulation, Vol. 20, Issue 1 (Winter 1997), pp. 59-60",20 Regulation 59 (1997),"States, Federalism, Environmental Law, Sovereignty",2,na,1
Beware: Your Rights Could Be Crimes (Part I) [comments],"Lynch, Timothy (Cited 182 times)",1474,"Regulation, Vol. 20, Issue 3 (Summer 1997), pp. 55-55",20 Regulation 55 (1997),"Crimes, Evidence, States",2,na,1
Tortuous Journey to Justice [comments],"Lynch, Timothy (Cited 182 times)",1474,"Regulation, Vol. 21, Issue 2 (Spring 1998), pp. 64-64",21 Regulation 64 (1998),"Government, Land Use, Local Government",2,na,na
The Challenge of Optimism and Complexity: Inadequately Addressed by the FCIC's Report [article],"Lynch, Timothy E. (Cited 182 times)",1474,"UMKC Law Review, Vol. 80, Issue 4 (Summer 2012), pp. 1127-1158",80 UMKC L. Rev. 1127 (2011-2012),"Securities Law, Banking, Housing Law, Damages, Liability",2,na,3
Responses to the Ten Questions [comments],"Lynch, Timothy (Cited 182 times)",1474,"William Mitchell Law Review, Vol. 36, Issue 5 (2010), pp. 5073-5086",36 Wm. Mitchell L. Rev. 5073 (2009-2010),"Liberty, States, Terrorism, War, Courts, Military Law, President/Executive Department",1,na,1
An Eerie Efficiency [article],"Lynch, Timothy (Cited 182 times)",1474,"Cato Supreme Court Review, Vol. 2001-2002, pp. 171-186",2001-2002 Cato Sup. Ct. Rev. 171 (2001-2002),"States, Evidence, Exculpatory Evidence, Constitutional Rights, Criminal Law",na,na,na
Power and Liberty in Wartime [article],"Lynch, Timothy (Cited 182 times)",1474,"Cato Supreme Court Review, Vol. 2003-2004, pp. 23-48",2003-2004 Cato Sup. Ct. Rev. 23 (2003-2004),"Liberty, Courts, Judges, Military Law, Terrorism, War, States",na,na,2
One Cheer for United States v. Booker [article],"Lynch, Timothy (Cited 182 times)",1474,"Cato Supreme Court Review, Vol. 2004-2005, pp. 215-234",2004-2005 Cato Sup. Ct. Rev. 215 (2004-2005),"States, Research, Sentencing, Appeals, Criminal Law",na,na,1
In Memoriam [comments],"Lynch, Timothy E. (Cited 182 times)",1474,"UMKC Law Review, Vol. 82, Issue 4 (Summer 2014), pp. 875-876",82 UMKC L. Rev. 875 (2013-2014),"Comparative Law, Students, History",na,na,1
Republicans Fixing to nationalize Gambling Issue [comments],"Lynch, Timothy (Cited 182 times)",1474,"Regulation, Vol. 21, Issue 1 (Winter 1998), pp. 65-65",21 Regulation 65 (1998),"Gambling, Gaming, Industry",na,na,na
The Food Lion Case: Are Journalists Above the Law [comments],"Lynch, Timothy (Cited 182 times)",1474,"Regulation, Vol. 20, Issue 2 (Spring 1997), pp. 36-36",20 Regulation 36 (1997),"Communications Law, First Amendment, Damages, Punitive Damages, Torts",na,na,1
Beware: Your Rights Could Be Crimes (Part II) [comments],"Lynch, Timothy (Cited 182 times)",1474,"Regulation, Vol. 20, Issue 4 (Fall 1997), pp. 56-56",20 Regulation 56 (1997),"Crimes, Fourth Amendment, Search Warrants",na,na,1
Beware of the Public Nuisance Lawsuit [comments],"Lynch, Timothy (Cited 182 times)",1474,"Regulation, Vol. 21, Issue 3 (Summer 1998), pp. 70-70",21 Regulation 70 (1998),"Nuisance, Industry, State and Local Government Law, Torts",na,na,1
Woburn Controversy: What We Know [comments],"Lynch, Timothy (Cited 182 times)",1474,"Regulation, Vol. 21, Issue 4 (Fall 1998), pp. 56-56",21 Regulation 56 (1998),"Jury, Ethics, Legal Ethics, Environmental Law",na,na,2
Legal Field Growth Is Rooted in Lateral Recruitment [article],"Lynch, Timothy (Cited 182 times)",1474,"Minority Trial Lawyer, Vol. 16, Issue 1 (Fall 2017), pp. 3-5",16 Minority Trial Law. 3 (2017-2018),"Age, Legal Profession, Women",na,na,na
