Title,Author(s),ID,Journal,BBCite,Topics,Cited (articles),Cited (cases),Accessed
The World Where Parallel Lines Converge: The Privilege against Self-Incrimination in Concurrent Civil and Criminal Child Abuse Proceedings [article],"Patton, William Wesley (Cited 282 times)",5523,"Georgia Law Review, Vol. 24, Issue 3 (Spring 1990), pp. 473-524",24 Ga. L. Rev. 473 (1989-1990),"Child Abuse, Self-Incrimination, Children, Domestic Relations, Juveniles",35,6,5
Severing Hansel from Gretel: An Analysis of Siblings' Association Rights [article],"Patton, William Wesley (Cited 282 times); Latz, Sara (Cited 32 times)",5523,"University of Miami Law Review, Vol. 48, Issue 4 (March 1994), pp. 745-808",48 U. Miami L. Rev. 745 (1993-1994),"Siblings, Domestic Relations, Children, Disability Law, Psychiatrists and Psychologists",32,2,41
The Status of Siblings' Rights: A View into the New Millennium [article],"Patton, William Wesley (Cited 282 times)",5523,"DePaul Law Review, Vol. 51, Issue 1 (Fall 2001), pp. 1-38",51 DePaul L. Rev. 1 (2001-2002),"Domestic Relations, Siblings, Interest, Children, Disability Law, Psychiatrists and Psychologists",19,6,10
Pandora's Box: Opening Child Protection Cases to the Press and Public [article],"Patton, William Wesley (Cited 282 times)",5523,"Western State University Law Review, Vol. 27, pp. 181-214",27 W. St. U. L. Rev. 181 (1999-2000),"Child Abuse, Victims, First Amendment, Courts, Juvenile Courts",19,na,10
Revictimizing Child Abuse Victims: An Empirical Rebuttal to the Open Juvenile Dependency Court Reform Movement [article],"Patton, William Wesley (Cited 282 times)",5523,"Suffolk University Law Review, Vol. 38, Issue 2 (2005), pp. 303-350",38 Suffolk U. L. Rev. 303 (2004-2005),"Child Abuse, Victims, Children, Courts, Juvenile Courts",16,na,16
"Forever Torn Asunder: Charting Evidentiary Parameters, the Right to Competent Counsel and the Privilege against Self-Incrimination in California Child Dependency and Parental Severance Cases [article]","Patton, William Wesley (Cited 282 times)",5523,"Santa Clara Law Review, Vol. 27, Issue 2 (1987), pp. 299-352",27 Santa Clara L. Rev. 299 (1987),"Self-Incrimination, Child Abuse",14,2,na
Opening Students' Eyes: Visual Learning Theory in the Socratic Classroom [article],"Patton, William Wesley (Cited 282 times)",5523,"Law and Psychology Review, Vol. 15, pp. 1-18",15 Law & Psychol. Rev. 1 (1991),"Students, Legal Education",13,na,54
Law Schools' Duty to Train Children's Advocates: Blueprint for an Inexpensive Experientially Based Juvenile Justice Course [article],"Patton, William Wesley (Cited 282 times)",5523,"Juvenily & Family Court Journal, Vol. 45, Issue 4 (1994), pp. 3-12",45 Juv. & Fam. Ct. J. 3 (1994),"Children, Schools, Judges, Jurisprudence, Juveniles, Natural Law",12,1,1
Standards of Appellate Review for Denial of Counsel and Ineffective Assistance of Counsel in Child Protection and Parental Severance Cases [article],"Patton, William Wesley (Cited 282 times)",5523,"Loyola University Chicago Law Journal, Vol. 27, Issue 2 (Winter 1996), pp. 195-236",27 Loy. U. Chi. L.J. 195 (1995-1996),"Appellate Review, Legal Profession, Child Abuse, Juveniles, Children, Schools",12,na,2
Viewing Child Witnesses through a Child and Adolescent Psychiatric Lens: How Attorneys' Ethical Duties Exacerbate Children's Psychopathology [article],"Patton, William Wesley (Cited 282 times)",5523,"Widener Law Review, Vol. 16, Issue 2 (2010), pp. 369-416",16 Widener L. Rev. 369 (2010),"Attorneys, Children, Psychiatrists and Psychologists, Witnesses, Sexual Abuse, Testimony, Defendants",11,1,4
Externship Site Inspections: Fitting Well-Rounded Programs into the Four Corners of the ABA Guidelines [comments],"Patton, William Wesley (Cited 282 times)",5523,"Clinical Law Review, Vol. 3, Issue 2 (Spring 1997), pp. 471-484",3 Clinical L. Rev. 471 (1996-1997),"Legal Profession, Legal Education, Students",11,na,5
Child Abuse: The Irreconcilable Differences between Criminal Prosecution and Informal Dependency Court Mediation [article],"Patton, William Wesley (Cited 282 times)",5523,"University of Louisville Journal of Family Law, Vol. 31, Issue 1 (1992-1993), pp. 37-64",31 U. Louisville J. Fam. L. 37 (1992-1993),"Child Abuse, Appellate Review, Domestic Relations, Trials, Criminal Law",10,1,2
"Mommy's Gone, Daddy's in Prison, Now What about Me - Family Reunification for Children of Single Custodial Fathers in Prison - Will the Sins of the Incarcerated Fathers Be Inherited by Their Children [article]","Patton, William Wesley (Cited 282 times)",5523,"North Dakota Law Review, Vol. 75, Issue 2 (1999), pp. 179-204",75 N.D. L. Rev. 179 (1999),"Children, Prisoners, Women, Employment, Privacy",9,na,13
Evolution in Child Abuse Litigation: The Theoretical Void where Evidentiary and Procedural Worlds Collide [article],"Patton, William Wesley (Cited 282 times)",5523,"Loyola of Los Angeles Law Review, Vol. 25, Issue 3 (April 1992), pp. 1009-1024",25 Loy. L. A. L. Rev. 1009 (1991-1992),"Child Abuse, Juveniles, Appellate Review, Domestic Relations, Trials, Legal Profession",9,na,1
When the Empirical Base Crumbles: The Myth that Open Dependency Proceedings Do No Psychologically Damage Abused Children [article],"Patton, William Wesley (Cited 282 times)",5523,"Law & Psychology Review , Vol. 33, Issue 1 (2009), pp. 29-56",33 Law & Psychol. Rev. 29 (2009),"Children, Juveniles, Domestic Relations, Freedom of the Press, Judges, Privacy",8,na,10
The Reality of Concurrent Planning: Juggling Multiple Family Plans Expeditiously without Sufficient Resources [article],"Patton, William Wesley (Cited 282 times); Pellman, Amy M. (Cited 12 times)",5523,"UC Davis Journal of Juvenile Law & Policy, Vol. 9, Issue 1 (Winter 2005), pp. 171-194",9 U.C. Davis J. Juv. L. & Pol'y 171 (2005),"Social Welfare Law, Adopted Children",7,3,9
It Matters Not What Is but What Might Have Been: The Standard of Appellate Review for Denial of Counsel in Child Dependency and Parental Severance Trials [article],"Patton, William Wesley (Cited 282 times)",5523,"Whittier Law Review, Vol. 12, Issue 4 (1991), pp. 537-550",12 Whittier L. Rev. 537 (1991),"Appellate Review, Domestic Relations, Trials, Courts, Open Courts, Right to Counsel, Due Process, Interest, Parental Rights Termination",6,na,na
Legislative Regulation of Dependency Court Attorneys: Public Relations and Separation of Powers [article],"Patton, William Wesley (Cited 282 times)",5523,"Journal of Legislation, Vol. 24, Issue 1 (1998), pp. 3-20",24 J. Legis. 3 (1998),"Attorneys, Public Relations, Regulation, Separation, Separation of Powers, Consumer Protection Law, Labor, Legal Profession, Social Welfare Law, Education Law",5,3,3
Rethinking the Privilege against Self-Incrimination in Child Abuse Dependency Proceedings: Might Parents Be Their Own Worst Witnesses [article],"Patton, William Wesley (Cited 282 times)",5523,"UC Davis Journal of Juvenile Law & Policy, Vol. 11, Issue 1 (Winter 2007), pp. 101-150",11 U.C. Davis J. Juv. L. & Pol'y 101 (2007),"Child Abuse, Parents and Children, Self-Incrimination, Social Welfare Law, Witnesses, Immunity, States, Discovery, Evidence, Exclusionary Rule",5,na,3
"To Err is Human, To Forgive, Often Unjust: Harmless Error Analysis in Child Abuse Dependency Proceedings [article]","Patton, William Wesley (Cited 282 times)",5523,"UC Davis Journal of Juvenile Law & Policy, Vol. 13, Issue 1 (Winter 2009), pp. 99-142",13 U.C. Davis J. Juv. L. & Pol'y 99 (2009),"Child Abuse, Constitutional Law, Practice and Procedure, Appeals, State and Local Government Law",4,na,1
Creating an Externship Consortium: The Glace Experience [article],"Patton, William Wesley (Cited 282 times)",5523,"Thomas M. Cooley Journal of Practical and Clinical Law, Vol. 4, Issue 3 (2001), pp. 233-250",4 T.M. Cooley J. Prac. & Clinical L. 233 (2000-2001),"Legal Education, Students",4,na,1
The Connecticut Open-Court Movement: Reflection and Remonstration [notes],"Patton, William Wesley (Cited 282 times)",5523,"Connecticut Public Interest Law Journal, Vol. 4, Fall 2004: Symposium Edition (Fall 2004), pp. 8-23",4 Conn. Pub. Int. L.J. 8 (2004-2005),"Children, Courts, Juveniles, Records, Domestic Relations, Freedom of the Press, Judges, Privacy",4,na,na
"Bringing Facts into Fiction: The First Data-Based Accountability Analysis of the Differences between Presumptively Open, Discretionarily Open, and Closed Child-Dependency-Court Systems [article]","Patton, William Wesley (Cited 282 times)",5523,"University of Memphis Law Review, Vol. 44, Issue 4 (Summer 2014), pp. 831-868",44 U. Mem. L. Rev. 831 (2013-2014),"Children, Courts, Juveniles, Records",3,na,5
The Psychiatric Implications of Media Ethics Code Policies Regarding the Publication of Child Abuse Victim Data: A Universal Deontological Model Code [article],"Patton, William Wesley (Cited 282 times)",5523,"UC Davis Journal of Juvenile Law and Policy, Vol. 16, Issue 2 (Summer 2012), pp. 427-480",16 U.C. Davis J. Juv. L. & Pol'y 427 (2012),"Child Abuse, Communications Law, Ethics, Professional Ethics, Torts",3,na,3
Getting back to the Sandbox: Designing a Legal Policy Clinic [article],"Patton, William Wesley (Cited 282 times)",5523,"International Journal of Clinical Legal Education, Vol. 16, Issue 2 (Autumn 2011), pp. 96-129",16 Int'l J. Clinical Legal Educ. 96 (2011),"Criminal Procedure, Criminology, Procedure, Partnerships, Banking, Court of Justice of the European Union, Judgments",2,na,11
An Update to Striking a Balance: Freedom of the Press versus Children's Privacy Interests in Juvenile Dependency Proceedings [article],"Patton, William Wesley (Cited 282 times); Crecco, Kelly (Cited 6 times)",5523,"First Amendment Law Review, Vol. 12, Issue 3 (Spring 2014), pp. 575-592",12 First Amend. L. Rev. 575 (2013-2014),"Children, Domestic Relations, Freedom of the Press, Judges, Juveniles, Privacy, Child Abuse, Confidentiality",2,na,3
"Children Are Invisible, Children Are Real: An Introduction to the Child Law Symposium [article]","Patton, William Wesley (Cited 282 times)",5523,"Whittier Law Review, Vol. 18, Issue 4 (Summer 1997), pp. 759-766",18 Whittier L. Rev. 759 (1996-1997),"Children, Juveniles, States, United Nations",2,na,1
An Opening Gambit in Teaching Juvenile Law: Creating Icons of Normative Family Structures [article],"Patton, William Wesley (Cited 282 times)",5523,"Law and Psychology Review, Vol. 20, pp. 1-10",20 Law & Psychol. Rev. 1 (1996),"Children, Schools, Education Law, Legal Education",2,na,na
A Legislative Case Study of the Evolution of Polyvictimization Research and Policy Implementation: Mental Health Professionals' Duty to Engage in Public Policy Advocacy [article],"Culyba, Alison Journey (Cited 1 times); Patton, William Wesley (Cited 282 times)",5523,"William & Mary Policy Review, Vol. 8, Issue 1 (2016), pp. 1-[ii]",8 Wm. & Mary Pol'y Rev. 1 (2016-2017),"Health, Mental Health, Military, War and Peace, Public Policy, Research, Literature",1,na,6
Connecticut's Failed Open Juvenile Dependency Court Pilot Project: Presumptively Open Juvenile Court Doors Closed again to Protect Abused Children [article],"Patton, William Wesley (Cited 282 times)",5523,"Whittier Journal of Child and Family Advocacy, Vol. 11, Issue 1 (Fall 2011), pp. 85-114",11 Whittier J. Child. & Fam. Advoc. 85 (Fall 2011),"Children, Domestic Relations, Freedom of the Press, Judges, Juveniles, Privacy",1,na,3
"Publication, Depublication and Review of State Bar Court Opinions: Bringing the Public into the Process [article]","Patton, William Wesley (Cited 282 times)",5523,"Whittier Law Review, Vol. 17, Issue 3 (Spring 1996), pp. 409-426",17 Whittier L. Rev. 409 (1995-1996),"Court Opinions, Professional Ethics, Attorneys, Professions",1,na,2
"Systemic Governmental Recalcitrance in Regulating Confidentiality under the Child Abuse, Prevention & Treatment Act (CAPTA): A Case Study [article]","Patton, William Wesley (Cited 282 times)",5523,"Journal of Legislation, Vol. 43, Issue 2 (2016), pp. 193-213",43 J. Legis. 193 (2016),"Child Abuse, Confidentiality, Attorneys, Child Neglect, Civil Procedure, Guardian Ad Litem, Juveniles, Legal Profession, Legal Representation, Right to Counsel",na,na,35
A Blueprint for a Fairer ABA Standard for Judging Law Graduates' Competence: How a Standard Based on Students' Scores in Relation to the National Mean MBE Score Properly Balances Consumer Safety with Increased Diversity in the Bar [article],"Patton, William Wesley (Cited 282 times)",5523,"Washington and Lee Journal of Civil Rights and Social Justice, Vol. 24, Issue 1 (Fall 2017), pp. 3-62",24 Wash. & Lee J. Civ. Rts. & Soc. Just. 3 (Fall 2017),"Students, Law and Society, Schools",na,na,21
"Unexamined Multi-Billion Dollar Business: Congressional and State Legislative Pilot Projects, The [article]","Patton, William Wesley (Cited 282 times)",5523,"Cornell Journal of Law and Public Policy, Vol. 24, Issue 2 (2014), pp. 291-318",24 Cornell J. L. & Pub. Pol'y 291 (2014-2015),"Legislation, Homes, Public Housing, Water Law",na,na,4
"How Shepard's Citations Lost Its Flock: Or, Can the Police Smell Probable Cause--A Substantive Lesson Plan [article]","Patton, William Wesley (Cited 282 times)",5523,"Law Library Journal, Vol. 80, Issue 1 (Winter 1988), pp. 131-138",80 Law Libr. J. 131 (1988),"Police, Courts, Law Enforcement",na,na,4
The California Child Abuse Hearsay Exception: Is Truth Competency Still Required [article],"Patton, William Wesley (Cited 282 times)",5523,"UC Davis Journal of Juvenile Law & Policy, Vol. 3, Issue 2 (July 1999), pp. 68-74",3 U.C. Davis J. Juv. L. & Pol'y 68 (1999),"Child Abuse, Hearsay, Children, Confrontation Clause, Evidence",na,na,3
"S.B. 1516, California's New Hybrid: Childrens' Counsel as Advocates and Guardians Ad Litem [article]","Patton, William Wesley (Cited 282 times)",5523,"UC Davis Journal of Juvenile Law & Policy, Vol. 2, pp. 16-21",2 U.C. Davis J. Juv. L. & Pol'y 16 (1997),"Guardians, Ethics, Unauthorized Practice of Law, Children",na,na,3
The Whittier Law School Legal Policy Clinic's Amicus Curiae Advocacy on Behalf of Siblings [notes],"Patton, William Wesley (Cited 282 times)",5523,"Whittier Journal of Child and Family Adovcacy, Vol. 5, Issue 2 (Spring 2006), pp. 449-476",5 Whittier J. Child. & Fam. Advoc. 449 (2005-2006),"Siblings, Social Welfare Law, Interest, Domestic Relations",na,na,2
"Biblical, Legal, and Miltonic Influences in Melville's Redburn [article]","Patton, William Wesley (Cited 282 times)",5523,"Oklahoma City University Law Review, Vol. 23, Issue 3 (Fall 1998), pp. 911-928",23 Okla. City U. L. Rev. 911 (1998),"Ultra Vires, Trials, Constitutional Law, Sixth Amendment",na,na,2
Interrelationship between Sibling Custody and Visitation and Conflicts of Interest in the Representation of Multiple Siblings in Dependency Proceedings [article],"Patton, William Wesley (Cited 282 times)",5523,"Children's Legal Rights Journal, Vol. 23, Issue 2 (Summer 2003), pp. 18-34",23 Child. Legal Rts. J. 18 (2003-2004),"Interest, Siblings, Domestic Relations",na,na,1
