Title,Author(s),id,Journal,BBCite,Cited (articles),Cited (cases),Accessed,Topics
Race and Rapport: Homophily and Racial Disadvantage in Large Law Firms [article],"Woodson, Kevin (Cited 21 times)",7055,"Fordham Law Review, Vol. 83, Issue 5 (April 2015), pp. 2557-2604",na,9,na,36,na
On the Need for Public Boarding Schools [article],"Asbury, Bret D. (Cited 35 times); Woodson, Kevin (Cited 21 times)",7055,"Georgia Law Review, Vol. 47, Issue 1 (Fall 2012), pp. 113-164",47 Ga. L. Rev. 113 (2012-2013),6,na,13,na
"Human Capital Discrimination, Law Firm Inequality, and the Limits of Title VII [article]","Woodson, Kevin (Cited 21 times)",7055,"Cardozo Law Review, Vol. 38, Issue 1 (October 2016), pp. 183-230",38 Cardozo L. Rev. 183 (2016-2017),2,na,22,na
Why Kindergarten Is Too Late: The Need for Early Childhood Remedies in School Finance Litigation [article],"Woodson, Kevin (Cited 21 times)",7055,"Arkansas Law Review, Vol. 70, Issue 1 (2017), pp. 87-138",70 Ark. L. Rev. 87 (2017-2018),1,na,15,na
Diversity without Integration [article],"Woodson, Kevin (Cited 21 times)",7055,"Penn State Law Review, Vol. 120, Issue 3 (Winter 2016), pp. 807-866",120 Penn St. L. Rev. 807 (2015-2016),1,na,16,na
Derivative Racial Discrimination [article],"Woodson, Kevin (Cited 21 times)",7055,"Stanford Journal of Civil Rights & Civil Liberties, Vol. 12, Issue 2 (June 2016), pp. 335-388",12 Stan. J. C.R. & C.L. 335 (June 2016),1,na,39,na
