Title,Author(s),id,Journal,BBCite,Cited (articles),Cited (cases),Accessed,Topics
Efficient Contracting between Foreign Investors and Host States: Evidence from Stabilized Clauses [article],"Halabi, Sam Foster (Cited 40 times)",3077,"Northwestern Journal of International Law & Business, Vol. 31, Issue 2 (Spring 2011), pp. 261-312",31 Nw. J. Int'l L. & Bus. 261 (2011),11,na,29,na
The Comity of Empagran: The Supreme Court Decides That Foreign Competition Regulation Limits American Antitrust Jurisdiction over International Cartels [legislation],"Halabi, Sam Foster (Cited 40 times)",3077,"Harvard International Law Journal, Vol. 46, Issue 1 (Winter 2005), pp. 279-294",na,10,na,12,na
International Trademark Protection and Global Public Health: A Just-Compensation Regime for Expropriations and Regulatory Takings [article],"Halabi, Sam Foster (Cited 40 times)",3077,"Catholic University Law Review, Vol. 61, Issue 2 (Spring 2012), pp. 325-380",61 Cath. U. L. Rev. 325 (2011-2012),8,na,32,na
The World Health Organization's Framework Convention on Tobacco Control: An Analysis of Guidelines Adopted by the Conference of the Parties [article],"Halabi, Sam Foster (Cited 40 times)",3077,"Georgia Journal of International and Comparative Law, Vol. 39, Issue 1 (2010), pp. 121-184",39 Ga. J. Int'l & Comp. L. 121 (2010-2011),8,na,7,na
"Supremacy Clause as Structural Safehaurd of Federalism: State Judges and International Law in the Post-Erie Era, The [article]","Halabi, Sam Foster (Cited 40 times)",3077,"Duke Journal of Comparative and International Law, Vol. 23, Issue 1 (Fall 2012), pp. 63-120",23 Duke J. Comp. & Int'l L. 63 (2012-2013),3,na,7,na
