Title,Author(s),id,Journal,BBCite,Cited (articles),Cited (cases),Accessed,Topics
Boumediene's Quiet Theory: Access to Courts and the Separation of Powers [article],"Vladeck, Stephen I. (Cited 793 times)",6688,"Notre Dame Law Review, Vol. 84, Issue 5 (July 2009), pp. 2107-2150",na,55,na,23,na
Emergency Power and the Militia Acts [notes],"Vladeck, Stephen I. (Cited 793 times)",6688,"Yale Law Journal, Vol. 114, Issue 1 (October 2004), pp. 149-194",na,53,na,14,na
The D.C. Circuit after Boumediene [article],"Vladeck, Stephen I. (Cited 793 times)",6688,"Seton Hall Law Review, Vol. 41, Issue 4 (2011), pp. 1451-1490",na,48,2,19,na
The Detention Power [notes],"Vladeck, Stephen I. (Cited 793 times)",6688,"Yale Law & Policy Review, Vol. 22, Issue 1 (Winter 2004), pp. 153-196",na,38,na,8,na
"Deconstructing Hirota: Habeas Corpus, Citizenship, and Article III [article]","Vladeck, Stephen I. (Cited 793 times)",6688,"Georgetown Law Journal , Vol. 95, Issue 5 (June 2007), pp. 1497-1554",95 Geo. L.J. 1497 (June 2007),33,na,3,na
The New Habeas Revisionism [reviews],"Vladeck, Stephen I. (Cited 793 times)",6688,"Harvard Law Review, Vol. 124, Issue 4 (February 2011), pp. 941-993",na,31,na,8,na
"Congress, the Commander-in-Chief, and the Separation of Powers after Hamden [article]","Vladeck, Stephen I. (Cited 793 times)",6688,"Transnational Law & Contemporary Problems, Vol. 16, Issue 3 (Spring 2007), pp. 933-964",na,28,na,16,na
The Espionage Act and National Security Whistleblowing after Garcetti [article],"Vladeck, Stephen I. (Cited 793 times)",6688,"American University Law Review , Vol. 57, Issue 5 (June 2008), pp. 1531-1546",na,26,na,40,na
"State Law, the Westfall Act, and the Nature of the Bivens Question [article]","Vazquez, Carlos M. (Cited 1530 times); Vladeck, Stephen I. (Cited 793 times)",6688,"University of Pennsylvania Law Review, Vol. 161, Issue 2 (January 2013), pp. 509-584",161 U. Pa. L. Rev. 509 (January 2013),26,3,28,na
Suspension Clause as a Structural Right [article],"Vladeck, Stephen I. (Cited 793 times)",6688,"University of Miami Law Review, Vol. 62, Issue 2 (January 2008), pp. 275-306",na,25,na,10,na
The New National Security Canon [article],"Vladeck, Stephen I. (Cited 793 times)",6688,"American University Law Review, Vol. 61, Issue 5 (June 2012), pp. 1295-1330",na,24,2,10,na
Non-Self-Executing Treaties and the Suspension Clause after St. Cyr [comments],"Vladeck, Stephen I. (Cited 793 times)",6688,"Yale Law Journal, Vol. 113, Issue 8 (June 2004), pp. 2007-2014",na,20,na,4,na
"The Long War, the Federal Courts, and the Necessity/Legality Paradox [reviews]","Vladeck, Stephen I. (Cited 793 times)",6688,"University of Richmond Law Review, Vol. 43, Issue 3 (March 2009), pp. 893-926",na,19,na,4,na
National Security and Bivens after Iqbal [article],"Vladeck, Stephen I. (Cited 793 times)",6688,"Lewis & Clark Law Review, Vol. 14, Issue 1 (Spring 2010), pp. 255-278",na,19,na,10,na
A Small Problem of Precedent: 18 U.S.C. 4001(a) and the Detention of U.S. Citizen Enemy Combatants [comments],"Vladeck, Stephen I. (Cited 793 times)",6688,"Yale Law Journal, Vol. 112, Issue 4 (January 2003), pp. 961-[ii]",na,18,na,9,na
States' Rights and State Standing [article],"Vladeck, Stephen I. (Cited 793 times)",6688,"University of Richmond Law Review, Vol. 46, Issue 3 (March 2012), pp. 845-876",na,16,1,17,na
"AEDPA, Saucier, and the Stronger Case for Rights-First Constitutional Adjudication [article]","Vladeck, Stephen I. (Cited 793 times)",6688,"Seattle University Law Review, Vol. 32, Issue 3 (Spring 2009), pp. 595-616",na,16,3,4,na
The Exceptionalism of Foreign Relations Normalization [article],"Vladeck, Stephen I. (Cited 793 times)",6688,"Harvard Law Review Forum, Vol. 128, pp. 322-330",128 Harv. L. Rev. F. 322 (2014-2015),15,na,16,na
Military Courts and Article III [article],"Vladeck, Stephen I. (Cited 793 times)",6688,"Georgetown Law Journal, Vol. 103, Issue 4 (April 2015), pp. 933-1002",103 Geo. L.J. 933 (2014-2015),15,na,29,na
Terrorism Trials and the Article III Courts after Abu Ali [article],"Vladeck, Stephen I. (Cited 793 times)",6688,"Texas Law Review, Vol. 88, Issue 7 (June 2010), pp. 1501-1532",na,15,na,21,na
The Passive-Aggressive Virtues [article],"Vladeck, Stephen I. (Cited 793 times)",6688,"Columbia Law Review Sidebar, Vol. 111, pp. 122-140",111 Colum. L. Rev. Sidebar 122 (2011),14,na,12,na
Inchoate Liability and the Espionage Act: The Statutory Framework and the Freedom of the Press [article],"Vladeck, Stephen I. (Cited 793 times)",6688,"Harvard Law & Policy Review, Vol. 1, Issue 1 (Winter 2007), pp. 219-238",na,14,na,33,na
The Laws of War as a Constitutional Limit on Military Jurisdiction [article],"Vladeck, Stephen I. (Cited 793 times)",6688,"Journal of National Security Law & Policy, Vol. 4, Issue 2 (2010), pp. 295-342",4 J. Nat'l Sec. L. & Pol'y 295 (2010),14,na,5,na
Foreign Affairs Originalism in Youngstown's Shadow [comments],"Vladeck, Stephen I. (Cited 793 times)",6688,"Saint Louis University Law Journal, Vol. 53, Issue 1 (Fall 2008), pp. 29-38",na,13,na,4,na
The Case against National Security Courts [article],"Vladeck, Stephen I. (Cited 793 times)",6688,"Willamette Law Review, Vol. 45, Issue 3 (Spring 2009), pp. 505-526",na,13,na,19,na
The Increasingly Unflagging Obligation: Federal Jurisdiction after Saudi Basic and Anna Nicole [notes],"Vladeck, Stephen I. (Cited 793 times)",6688,"Tulsa Law Review, Vol. 42, Issue 3 (Spring 2007), pp. 553-578",na,13,na,3,na
The FISA Court and Article III [article],"Vladeck, Stephen I. (Cited 793 times)",6688,"Washington and Lee Law Review, Vol. 72, Issue 3 (Summer 2015), pp. 1161-1180",na,12,na,41,na
"The Field Theory: Martial Law, the Suspension Power, and the Insurrection Act [article]","Vladeck, Stephen I. (Cited 793 times)",6688,"Temple Law Review, Vol. 80, Issue 2 (Summer 2007), pp. 391-440",80 Temp. L. Rev. 391 (Summer 2007),12,na,19,na
"Enemy Aliens, Enemy Property, and Access to the Courts [article]","Vladeck, Stephen I. (Cited 793 times)",6688,"Lewis & Clark Law Review, Vol. 11, Issue 4 (Winter 2007), pp. 963-996",na,10,na,9,na
The Problem of Jurisdictional Non-Precedent [article],"Vladeck, Stephen I. (Cited 793 times)",6688,"Tulsa Law Review, Vol. 44, Issue 3 (Spring 2009), pp. 587-616",na,10,na,2,na
"The Unreviewable Executive: Kiyemba, Maqaleh, and the Obama Administration [article]","Vladeck, Stephen I. (Cited 793 times)",6688,"Constitutional Commentary, Vol. 26, Issue 3 (Summer 2010), pp. 603-624",na,9,na,4,na
Big Data before and after Snowden [article],"Vladeck, Stephen I. (Cited 793 times)",6688,"Journal of National Security Law and Policy, Vol. 7, Issue 2 (2014), pp. 333-340",7 J. Nat'l Sec. L. & Pol'y 333 (2014),9,na,56,na
Common-Law Habeas and the Separation of Powers [comments],"Vladeck, Stephen I. (Cited 793 times)",6688,"Iowa Law Review Bulletin, Vol. 95, pp. 39-54",na,8,1,3,na
After the AUMF [article],"Daskal, Jennifer (Cited 158 times); Vladeck, Stephen I. (Cited 793 times)",6688,"Harvard National Security Journal, Vol. 5, Issue 1 (2014), pp. 115-146",5 Harv. Nat'l Sec. J. 115 (2014),7,na,69,na
"The Supreme Court, the War on Terrorism, and the Separation of Powers [article]","Vladeck, Stephen I. (Cited 793 times)",6688,"Human Rights, Vol. 38, Issue 1 (Winter 2011), pp. 13-13",38 Hum. Rts. 13 (Winter 2011),7,na,8,na
Targeted Killing and Judicial Review [comments],"Vladeck, Stephen I. (Cited 793 times)",6688,"George Washington Law Review Arguendo, Vol. 82, pp. 11-28",na,7,na,13,na
The Calling Forth Clause and the Domestic Commander in Chief [notes],"Vladeck, Stephen I. (Cited 793 times)",6688,"Cardozo Law Review, Vol. 29, Issue 3 (January 2008), pp. 1091-1108",na,6,na,11,na
Normalizing Guantanamo [article],"Vladeck, Stephen I. (Cited 793 times)",6688,"American Criminal Law Review , Vol. 48, Issue 4 (Fall 2011), pp. 1547-1572",na,6,na,13,na
Detention after the AUMF [article],"Vladeck, Stephen I. (Cited 793 times)",6688,"Fordham Law Review, Vol. 82, Issue 5 (April 2014), pp. 2189-2208",na,6,na,42,na
"Democratic Competence, Constitutional Disorder, and the Freedom of the Press [article]","Vladeck, Stephen I. (Cited 793 times)",6688,"Washington Law Review, Vol. 87, Issue 2 (June 2012), pp. 529-548",na,6,na,12,na
The Demise of Merits-Based Adjudication in Post-9/11 National Security Litigation [article],"Vladeck, Stephen I. (Cited 793 times)",6688,"Drake Law Review, Vol. 64, Issue 4 (2016), pp. 1035-1090",64 Drake L. Rev. 1035 (2016),5,na,14,na
Insular Thinking about Habeas [comments],"Vladeck, Stephen I. (Cited 793 times)",6688,"Iowa Law Review Bulletin, Vol. 97, pp. 16-23",na,5,na,3,na
"Habeas Corpus, Alternative Remedies, and the Myth of Swain v. Pressley [article]","Vladeck, Stephen I. (Cited 793 times)",6688,"Roger Williams University Law Review, Vol. 13, Issue 2 (Spring 2008), pp. 411-442",na,5,na,2,na
The Constitutional Right to Collateral Post-Conviction Review [article],"Vazquez, Carlos M. (Cited 1530 times); Vladeck, Stephen I. (Cited 793 times)",6688,"Virginia Law Review, Vol. 103, Issue 5 (September 2017), pp. 905-960",103 Va. L. Rev. 905 (2017),5,na,26,na
Foreword: National Security's Distortion Effects [comments],"Vladeck, Stephen I. (Cited 793 times)",6688,"Western New England Law Review, Vol. 32, Issue 2 (2010), pp. 285-294",na,5,na,3,na
Standing and Secret Surveillance [article],"Vladeck, Stephen I. (Cited 793 times)",6688,"I/S: A Journal of Law and Policy for the Information Society, Vol. 10, Issue 2 (2014), pp. 551-580",10 ISJLP 551 (2014-2015),4,na,6,na
Ludecke's Lengthening Shadow: The Disturbing Prospect of War without End [article],"Vladeck, Stephen I. (Cited 793 times)",6688,"Journal of National Security Law & Policy, Vol. 2, Issue 1 (2006), pp. 53-110",2 J. Nat'l Sec. L. & Pol'y 53 (2006-2008),4,na,4,na
War and Justiciability [article],"Vladeck, Stephen I. (Cited 793 times)",6688,"Suffolk University Law Review, Vol. 49, Issue 1 (2016), pp. 47-60",49 Suffolk U. L. Rev. 47 (2016),4,na,17,na
Terrorism and International Criminal Law after the Military Commissions Acts [article],"Vladeck, Stephen I. (Cited 793 times)",6688,"Santa Clara Journal of International Law, Vol. 8, Issue 1 (2010), pp. 101-114",8 Santa Clara J. Int'l L. 101 (2010),3,na,6,na
Terrorism Prosecutions and the Problem of Constitutional Cross-Ruffing [article],"Vladeck, Stephen I. (Cited 793 times)",6688,"Cardozo Law Review, Vol. 36, Issue 2 (December 2014), pp. 709-730",na,2,na,2,na
"Habeas Corpus, Due Process, and Extradition [comments]","Vladeck, Stephen I. (Cited 793 times)",6688,"Cornell Law Review Online, Vol. 98, pp. 20-34",na,2,na,5,na
State Sovereign Immunity and the Roberts Court [article],"Vladeck, Stephen I. (Cited 793 times)",6688,"Charleston Law Review, Vol. 5, Issue 1 (Fall 2010), pp. 99-132",5 Charleston L. Rev. 99 (2010-2011),2,na,3,na
Using the Supreme Court's Original Habeas Jurisdiction to Make New Rules Retroactive [article],"Vladeck, Stephen I. (Cited 793 times)",6688,"Federal Sentencing Reporter, Vol. 28, Issue 3 (February 2016), pp. 225-232",na,2,na,na,na
Introductory Note [notes],"Vladeck, Stephen I. (Cited 793 times)",6688,"International Legal Materials, Vol. 47, Issue 5 (September 2008), pp. 705-722",na,2,na,na,na
Targeted Killing and Judicial Review [comments],"Vladeck, Stephen I. (Cited 793 times)",6688,"George Washington Law Review, Vol. 82, Special Issue (2014), pp. 11-29",na,1,na,9,na
Re-Rethinking the Prize Cases: Some Remarks in Response to Professor Lee [comments],"Vladeck, Stephen I. (Cited 793 times)",6688,"Saint Louis University Law Journal, Vol. 53, Issue 1 (Fall 2008), pp. 85-[ii]",na,1,na,2,na
Why Klein (Still) Matters: Congressional Deception and the War on Terrorism [article],"Vladeck, Stephen I. (Cited 793 times)",6688,"Journal of National Security Law & Policy, Vol. 5, Issue 1 (2011), pp. 251-262",5 J. Nat'l Sec. L. & Pol'y 251 (2011-2012),1,na,3,na
A New Paradigm of Leaking [comments],"Abdo, Alex (Cited 3 times); Cole, David (Cited 2204 times); Ellard, George (Cited 31 times); Wainstein, Kenneth (Cited 1 times); Vladeck, Stephen I. (Cited 793 times)",6688,"Journal of National Security Law and Policy, Vol. 8, Issue 1 (2015), pp. 5-32",na,1,na,8,na
Convicted Terrorists: Sentencing Considerations and Their Policy Implications [article],"Baltes, Joanna (Cited 1 times); Greenberg, Karen J. (Cited 1 times); Lee, Gerarld Bruce (Cited 1 times); Reagan, Robert Timothy (Cited 47 times); Vladeck, Stephen I. (Cited 793 times)",6688,"Journal of National Security Law and Policy, Vol. 8, Issue 2 (2016), pp. 347-[iv]",na,1,na,8,na
"The Supreme Court, Original Habeas, and the Paradoxical Virtue of Obscurity [comments]","Vladeck, Stephen I. (Cited 793 times)",6688,"Virginia Law Review in Brief, Vol. 97, pp. 31-40",na,1,na,2,na
Unlawful Command Influence and the President's Quasi-Personal Capacity [article],"Vladeck, Stephen I. (Cited 793 times)",6688,"Texas Law Review Online, Vol. 96, pp. 35-41",na,1,na,12,na
That's So Six Months Ago: Challenges to Student Scholarship in the Age of Blogging,"Vladeck, Stephen I. (Cited 793 times)",6688,na,"Vladeck, Stephen I. (Cited 793 times)",na,na,na,na
The Bivens Term: Why the Supreme Court Should Reinvigorate Damages Suits against Federal Officers [article],"Vladeck, Stephen I. (Cited 793 times)",6688,"Advance: The Journal of the ACS Issue Briefs, Vol. 11, pp. 135-142",11 Advance 135 (2017),na,na,21,na
Trying Terrorism Suspects in Article III Courts: The Lessons of United States v. Abu Ali [article],"Vladeck, Stephen I. (Cited 793 times)",6688,"Advance: The Journal of the ACS Issue Briefs, Vol. 4, Issue 1 (2010), pp. 123-138",4 Advance 123 (2010),na,na,1,na
The Torture Report and the Accountability Gap [article],"Vladeck, Stephen I. (Cited 793 times)",6688,"Georgetown Journal of International Affairs, Vol. 16, Issue 2 (Summer/Fall 2015), pp. 174-182",na,na,na,10,na
Military Officers and the Civil Office Ban [article],"Vladeck, Stephen I. (Cited 793 times)",6688,"Indiana Law Journal, Vol. 93, Issue 1 (Winter 2018), pp. 241-252",na,na,na,23,na
Foreword [comments],"Vladeck, Stephen (Cited 793 times)",6688,"William Mitchell Law Review , Vol. 34, Issue 5 (2008), pp. 5001-5002",na,na,na,na,na
Is National Security Law Inherently Paradoxical [article],"Vladeck, Stephen I. (Cited 793 times)",6688,"National Security Law Brief, Vol. 1, pp. 11-18",1 Nat'l Sec. L. Brief 11 (2010),na,na,8,na
On Jurisdicitonal Elephants and Kangaroo Courts [article],"Vladeck, Stephen I. (Cited 793 times)",6688,"Northwestern University Law Review Colloquy, Vol. 103, pp. 172-184",103 Nw. L. Rev. Colloquy 172 (2008-2009),na,na,2,na
The Wars of the Judges [article],"Vladeck, Stephen I. (Cited 793 times)",6688,"Washington Law Review Online, Vol. 92, Issue 1 (2017), pp. 1-12",92 Wash. L. Rev. Online 1 (2017),na,na,7,na
Douglas and the Fate of Ex Parte Young [article],"Vladeck, Stephen I. (Cited 793 times)",6688,"Yale Law Journal Forum, Vol. 122, pp. 13-18",122 Yale L.J. F. 13 (2012-2013),na,na,3,na
